4668013,135310516,5,4,4,4,15-12-05,在南四环边上，里面有各种各样的老爷车
4668013,6531492,5,3,4,3,15-12-04,好几层 但感觉内容还可以再丰富一些 讲解不够详细 车子中国的多 没有太亮眼的尖货 小孩喜欢车可以带来玩玩
4668013,883269,3,2,2,2,15-12-02,北京雾霾严重，周末带着孩子没地方去，刚好看见朋友圈里有人发了这里的游记，心血来潮携老公带孩子来此，原价30元一张，团购很划算两人只需要39元。虽然是周末但是人不多，有可能地方很大的原因吧，从五层开始转起，有一些放录音的介绍，五层是各个朝代的马车以及汽车的发展史，人类的智慧不是一蹴而就的，汽车的发展也是慢慢从畜力到动力，从三轮到四轮的一个过程。四层主要就是一些品牌汽车的发展史，很震撼，记忆犹新的就是90年代的小面，很显眼，好像有个中国第一代的公共汽车，上面放的都是假人，孩子一上去就被吓哭了，还有一个是成人体验区，就和驾校的练车机器是一样的，老公玩了两下觉得很没意思。三层是儿童体验区，既有男孩子喜欢的用电脑组装汽车，又有女孩子喜欢的给模型小车填色，很有意思，不过我家宝宝太小了，不太敢玩。还有一些电影里的人物和座驾，蜘蛛侠等，孩子们都很喜欢。二层就是餐区，闻着很香，不过看评论并不好，所以也没敢体验。总得来说还是挺不错的，男孩子肯定会喜欢，不过对于妈妈的我来说更喜欢樱桃小丸子，多啦a梦，hello kitty等，汽车等并不吸引我。不过为了孩子还是会去的！
4668013,543832,5,4,4,4,15-11-30,周六一早就到了，换票非常方便，不用排队，馆内环境很好，内层都有休息区，卫生间。
4668013,93994343,5,4,4,4,15-11-29,孩子玩的很高兴，也很有特色，适合男孩子！
4668013,118866690,5,4,4,4,15-11-27,孩子特别喜欢汽车博物馆，所以隔断时间就会去。1.2米以下儿童免票，成人大众点评上有团购，很划算。博物馆内比想像的要丰富，可见设计者与筹划者的用心。
4668013,729192986,4,3,3,4,15-11-26,壮观大气每一个都很酷，视觉冲击，不错，值得一看
4668013,157560567,4,4,4,4,15-11-24,环境不错，孩子们喜欢，强力推荐！
4668013,47687669,5,4,4,4,15-11-24,买了团购。大集一定注意周一闭馆啊！这地方其实就是再花乡二手车交易市场这里。环境乱。但是进入博物馆后就好了。
4668013,2982815,3,2,2,2,15-11-22,外观挺高大上的，里面其实没什么内容，有几辆老爷车，和汽车的发展历程。我是过去面试来着，没花门票就进去了，面完顺便逛了一圈。觉得一般般吧。不如去看车展
4668013,37145353,4,3,4,2,15-11-21  更新于11-21 22:23,周末闲着没事说带孩子出去玩 由于动物园 海洋馆都去了很多次了。想去个没去过的地方。在大众点评上就搜了下博物馆。搜到了北京汽车博物馆 离我家也挺近 决定去那 团购的门票成人25 儿童1.2米及以下免费 到了之后。售票处取票。售票处挺有特色 是在小火车里。取票进入博物馆。一共分五层。每层都不一样。老爷车 跑车 卡车 等等 汽车的东西挺全 讲解各个汽车部件 还有体验区 4d 5d电影  讲解汽车的历史 从古至今。总之孩子玩的挺高兴。而且博物馆人不是很多。适合带孩子去。
4668013,49424347,5,4,3,2,15-11-21,带孩子去感受一下，去一次就差不多了！基本没服务。
4668013,15989350,5,4,4,4,15-11-20,五星好评，不仅能看到汽车工业的发展，还能学到很多关于汽车结构的知识，在体验中了解未来汽车，非常适合带着孩子去，
4668013,4110276,4,4,3,2,15-11-20,看了点评 做的地铁 下雪时过来的 挺顺利的 主题餐厅被包场 遗憾 快餐厅 不是我的调调 孩子随便吃点 互动游戏排队人少 玩
4668013,20624660,5,4,2,4,15-11-17,带孩子去的，科普，怀旧的感觉都很不错，环境只能说凑合，馆里所有的自助试饮料售卖机都是坏的，而且没有什么吃饭的地方，希望日后能够改善一下
4668013,14682327,5,4,4,4,15-11-16,很好很好 汽车博物馆是男孩的天堂
4668013,1010139,5,3,3,3,15-11-16,儿子喜欢汽车，就带他去了。展品数量还可以，摆放的不是太好，有的地方摆的密，有的地方摆的疏。里面光线有些暗，能和小朋友互动的东西不是太多，也许是我家小朋友有些小。以后还会带他去的。
4668013,29019780,5,4,4,4,15-11-15,适合带着小朋友去，门票成人30，1.2米以下免费，大众有团购，不知道需要不需要提前预约，进门直接上五层，就可以参观了，配套服务挺完善，有志愿者，休息区，餐厅，卫生间每层都有，还有互动体验区，但是需要交费，就五层感觉还不错，展品很多，二层有餐厅，逛累了可以去吃饭，但是餐厅没有儿童座椅，卖的基本都是套餐30到40元左右不等，味道一般吧，停车也很方便，不过最好早点来，要不就没车位了，10点左右到应该差不多，停车费一小时6块
4668013,37340965,5,4,4,4,15-11-12,超级棒棒哒，儿子好开心啊！下次一定再光顾。
4668013,1417875,4,3,3,3,15-11-12,很大，环境不错，展出很贴近生活，适合慢慢看看。
4668013,762332691,4,3,3,3,15-11-12,适合带小孩子看的博物馆，五楼最好看。
4668013,42090182,5,4,4,4,15-11-11,室内博物馆里算是很有特色的 要早去 停车位有限
4668013,812011557,4,3,4,3,15-11-10,展品多环境好，有专人讲解，由上到下参观，有魅影镇馆
4668013,4257354,5,4,4,4,15-11-09,雾霾天气最佳地点，地方大，孩子也能玩的开
4668013,3066516,5,3,4,3,15-11-08,人不太多，但展出的东西也实在不多
4668013,1667165,4,3,3,3,15-11-08,挺好的一次参观，小朋友很喜欢。
4668013,45462846,5,4,3,3,15-11-07,还不错，很大，看了学习了很多知识。有几个互动的驾驶游戏，可惜排队不爽。
4668013,44406079,2,1,3,2,15-11-07,展品太少，有点水。车停在外边最好
4668013,32421499,5,4,4,4,15-11-05,展馆内环境不错，我们是周末去的，人也不算很多，最主要是孩子喜欢，玩的开心。
4668013,58343250,5,4,4,4,15-11-03,跟小伙伴一起去的，玩的非常开心
4668013,43542208,5,4,4,4,15-11-03,孩子很喜欢，说每周都要去。三层以上好玩
4668013,754537580,5,4,4,4,15-11-03,带儿子一起去的  儿子很开心  老子很满意
4668013,1665090,5,4,4,4,15-11-03,非常满意，整个展馆大气豪迈哈！小朋友大人都很着迷的欣赏啊！不错！不错！
4668013,50252069,5,4,4,4,15-11-02,工作日去的，人不多，很多幼儿园小朋友和小学生来参观～一共五层，有餐饮，带孩子开学习挺好玩的～
4668013,29649192,5,4,4,4,15-11-02,真的很好，专业和非专业的人都适合去看看，有时间可以仔细看，大开眼界。。。
4668013,135508891,5,4,4,4,15-11-01,特别好，孩子的好去处，孩子很喜欢
4668013,36245600,5,4,4,4,15-11-01,非常满意，有时间还要带着孩子去玩
4668013,33399314,5,4,4,4,15-11-01,孩子很喜欢的地方，环境好，有小孩参与的项目
4668013,762203427,5,3,4,3,15-11-01,地理位置偏远，环境很好，希望多开一些馆多放一些老车
4668013,181272534,5,4,4,4,15-10-31,孩子美术老师要求在这上一堂写生课。去了之后发现还不错！主要是孩子玩的!
4668013,8557653,3,3,3,2,15-10-31,展览的布置还是挺用心的，但展品真心一般，整体来说不错，但没有出乎意料的惊喜，有点小失望。几个可以玩的项目人都特别多，逛一会儿就逛完了。
4668013,611323368,5,4,4,4,15-10-30,儿子很喜欢，已经是第三次来玩了。停车也很方便。
4668013,1783758,5,4,4,4,15-10-30,从古董车到现代车，从公交车到豪华跑车，展品非常丰富。
4668013,47781620,5,3,3,3,15-10-30,还可以吧 就是没事无聊过来随便看看
4668013,44966385,5,4,4,4,15-10-30,近两个月第三次去了，娃很喜欢，吃饭人好多
4668013,49309207,5,4,4,4,15-10-29,满意，喜欢车的小朋友更适合，建议从上往下玩
4668013,37438900,5,4,4,4,15-10-29,男孩子可能更感兴趣，男孩子可能更感兴趣，
4668013,36519721,5,4,4,4,15-10-27,亲子票非常划算，当场买了就能用
4668013,4663749,4,2,2,3,15-10-26,好多小朋友哦，可以了解汽车发展史
4668013,69322881,4,2,3,3,15-10-26,环境还行，但小孩玩的东西真不多，服务还可以！
4668013,3079946,5,4,4,4,15-10-25,小男孩的最爱！最喜欢的就是老公共汽车的售票座
4668013,15417141,5,4,4,4,15-10-25,儿子很喜欢汽车，隔段时间就要去一次，团购价很实惠
4668013,44054572,5,4,4,4,15-10-25,很不错的地方，好玩很好啊啊啊呃呃呃
4668013,183077,4,3,3,3,15-10-25,来了很多次了，孩子很喜欢，就是模拟驾车人太多，能不能多增加几台车啊？
4668013,23046793,5,4,4,3,15-10-25,非常满意的陪孩子游玩的地方，几乎每个月都会来一次。
4668013,6434216,5,4,4,4,15-10-24,来过2次了，老少皆宜，配套设施不错，挺人性化的，光线如果没有那么昏暗就好了
4668013,180252147,4,3,2,2,15-10-24,这个地方去过三四次，真心不是我想去的，是儿子想去的，其实没什么看头，能玩的需要排队至少半小时以上，孩子喜欢去的原因就是因为他想研究活塞运动...不过没去过的还是值得去看看的，里面的吃的真心难吃到爆，能不吃就不要吃还不便宜！
4668013,6396195,5,4,4,4,15-10-24,带着小朋友玩耍的好去出！！！！
4668013,22900952,5,4,4,4,15-10-24,很方便 带孩子经常来 周末人也不多
4668013,8797961,5,4,4,4,15-10-24,不错，挺大的，一米二一下儿童免费。里面有些体验项目需要收费
4668013,31480330,5,3,3,3,15-10-23,临近南四环，展品很丰富。
4668013,47315464,5,4,4,4,15-10-23,从北四环到南四环来回四个小时，不过儿子非常喜欢。周二人也不是很多，还不错。
4668013,4165099,5,4,4,4,15-10-23,不错孩子很喜欢.真心不错.赞赞赞
4668013,44473337,5,4,4,4,15-10-22,到了现场发现大多数人都是兑换纸质票，环境可以，展品丰富，人多但不拥挤。
4668013,110605866,5,4,4,4,15-10-21,主要是带孩子玩去的挺好的。。。
4668013,1708541,5,4,4,4,15-10-21,非常好玩的博物馆，很用心，固定时间还有讲解员免费讲解，特别棒！
4668013,102492388,2,3,2,1,15-10-21,不大，细逛一个小时足矣，孩子在里面互动性不多，兴趣不大
4668013,16956227,5,4,4,4,15-10-20,建议四岁以上小朋友去，可以学到和认识很多汽车种类
4668013,2870554,4,3,3,3,15-10-19,儿子很开心
4668013,817016816,5,4,4,4,15-10-19,不错  孩子喜欢  环境很好  孩子说长知识了
4668013,188813748,4,3,2,3,15-10-19,不错 位置好找 停车位充足 馆内通风不怎么好
4668013,780091159,5,4,4,4,15-10-19,博物馆环境不错，餐厅不太好，太少了。
4668013,772849269,5,4,4,4,15-10-19,很多车，但是里面一些体验游戏需要再单花钱
4668013,752614281,5,3,3,3,15-10-18,第二次去，孩子喜欢，可是有些孩子玩的设备坏了，扫兴
4668013,144150764,5,4,4,4,15-10-18,带着小朋友去玩的，小朋友喜欢汽车，玩的特别好，推荐哦
4668013,5678803,4,3,3,3,15-10-18,挺不错，已经是第三次带孩子来了
4668013,723533033,5,4,4,3,15-10-17,老幼皆宜的博物馆。能让你过上一天。记得带上相机哦。如果不会开车的人还可以尝试尝试，软件驾驶。
4668013,5477188,4,4,4,2,15-10-17,总体上还不错，小朋友玩的很开心
4668013,778549166,5,4,4,4,15-10-17,不错，宝宝看得很开心，下回再去
4668013,26814489,5,4,4,4,15-10-17,非常棒，家里有小孩的一定要带去！有男孩的必须带过去
4668013,50849939,5,4,4,4,15-10-17,汽车梦工厂设计好难，才得了2000分
4668013,135780835,3,4,4,4,15-10-17,换票的时候有个小插曲，不过工作人员帮忙解决了，没有影响孩子玩的兴致！
4668013,65094925,5,4,4,4,15-10-16,很棒的感觉，虽然不大，但车还是很多的，值得一去
4668013,117934579,4,3,2,3,15-10-16,车还将就，环境不太好，很嘈杂，背景音乐和声音很嘈杂，布置有些拥挤，估计不会再去了
4668013,43669512,5,4,4,4,15-10-15,不错，能学到很多知识，值得一去。
4668013,27987238,4,3,3,3,15-10-14,周六去的，还赶上免费参观，展品很多很精致，从中对汽车有了更深层次的了解
4668013,118583,5,4,4,4,15-10-13,好就一个字，展品丰富，小朋友很喜欢
4668013,192980810,5,3,4,3,15-10-13,带爸妈和儿子来的，共五层，还不错，喜欢各种博物馆，向朋友，尤其是带孩子的朋友推荐。
4668013,5653475,5,4,4,3,15-10-13,六一儿童节我和老公带儿子一起去的汽车博物馆，看了很多国产汽车和国外的名车，了解一下国产汽车的发展史，孩子和非常喜欢，美团团购的价钱非常合适，建议大家不要周末去，周末人太多，平时去人可能会少很多，玩儿互动孩子就能过瘾了哈哈，总之挺好的还有互动，有机会还会去的，建议大家都带孩子去参观吧～
4668013,6051783,5,4,4,4,15-10-12,晚来评价了。总体不错！有团购，不贵环境好，主要空间够大，设施还算完善，适合带孩子来玩。半天即可，周边没有吃饭的好地方，所以比较适合过一个惬意充实的下午。
4668013,1959726,5,4,3,3,15-10-12,这次离上次去时隔一年了，觉得没有好多设备都老旧了。尤其儿童驾驶区，4辆车就一个好的。排了长长的对，最后干脆放弃了！
4668013,416420,5,4,4,4,15-10-12,小孩喜欢，价格还可以。适合男孩子
4668013,44327875,5,4,2,2,15-10-12,朋友送的赛车票正好带孩子过去看看，里面吃喝玩乐都有呢，看见很多复古车孩子也是无比兴奋……
4668013,5567168,5,4,4,4,15-10-12,确实很不错的博物馆，周末带着孩子老人一同前往去参观。展馆分为三层，层层都有新车型。三层会有互动，可以带孩子感受模拟的驾车感受，孩子们玩的非常开心，迟迟不肯离开。二楼有餐馆，非常便利，可以解决大家的吃饭问题！值得推荐。只是需要注意一点，早去车比较好停，晚了车位很难找。吃饭也是如此，越早越好！避免客流高峰。带孩子就需要更细心的考虑！
4668013,829833814,5,4,4,2,15-10-11,汽车博物馆很棒，喜欢！以后还会推荐朋友来观看！
4668013,9535458,5,4,4,4,15-10-11,满意 虽然是周末 但仍然有很好的参观体验
4668013,2194563,3,4,4,0,15-10-11,位置很好，停车方便，展品很棒。布展一般般吧，各种锐角，空间非常浪费。游线还不错，只是下楼的弧形台阶太黑了，容易绊脚。为什么不弄成坡道呢？真心不明白。用小火车改装成售票厅是个很好的创意，但是离入口略有点远。
4668013,831064221,5,4,3,3,15-10-11,很多车，地方也够大，喜欢车的朋友可以去看看。
4668013,115316392,3,2,3,3,15-10-11,环境不错，服务也不错，人也不算多！
4668013,52418121,4,3,3,3,15-10-11,不错 孩子很喜欢 只是配套餐饮弱了点
4668013,57910385,5,4,4,4,15-10-11,里面有的地方有点黑，孩子还小，有点怕，挺便宜的票，挺好的！
4668013,131522861,5,4,4,4,15-10-11,总体不错，车很多。。。。。。。
4668013,1438718,5,4,4,4,15-10-10,小朋友很多，车也很多，很好玩的博物馆
4668013,27040753,3,3,2,2,15-10-10,北京汽车博物馆位于丰台区南四环，就在南四环辅路上，建筑物很醒目也很好找。坐公交车的话可以乘坐740、特9、运通115等线路到怡海花园南门站，下车就是北京汽车博物馆的北门，如果自驾车的话就必须到博物馆南门停车了。 
4668013,51093549,5,4,4,4,15-10-10,挺不错的，孩子很喜欢，售票是在真的火车上，很有特色！
4668013,6288324,5,4,4,4,15-10-09,相当不错的博物馆，很适合带孩子来，内容丰富，还有很多可以动手操作的设备，现场的讲解非常好，馆内还有快餐，厕所很新很干净。
4668013,109179652,5,4,4,3,15-10-09,有很多儿童娱乐区域，很适合喜欢机械和车的大人孩子
4668013,136112900,5,4,3,3,15-10-08,展品很丰富，就是没看到宾利啊哈哈哈！
4668013,10624887,4,4,4,2,15-10-08,一进馆，一楼并不是，一楼是丰台区的区介绍什么的。在一楼存了下包，虽说是免费的，要填表，不用证件，但是总觉得这样不踏实。二楼开始就是车了，中国的车居多，每个车都有介绍，一排排的老车放在那还挺有感觉。往上去还有一些车模，做的很精致。外面有小孩玩的四驱车，挖掘机什么的。到了五楼，发现有讲解的，赶紧跟上听。有人讲和自己看完全不一样。联系先上五楼，听完讲解再一层层的看
4668013,5740913,5,4,4,4,15-10-08,带孩子去的好地方……～～～～～
4668013,48966411,5,4,4,4,15-10-08,整体比较满意，馆内餐饮品种偏少，要不可以逛一天O(∩_∩)O
4668013,94006059,5,4,4,4,15-10-07,孩子很喜欢去看汽车。团购方便还省钱。喜欢。
4668013,131801375,5,4,4,4,15-10-07,很满意，小朋友很喜欢，玩的很高兴
4668013,32961933,5,4,4,4,15-10-07,在南四环，路边，挺大的，停车5元一小时，周末活动相对多些，周边很宽敞，适合亲子周末活动，半天时间基本够了，票价30元
4668013,35450693,5,4,4,4,15-10-07,周一闭馆，没去成，只能退了，特意去的
4668013,18390127,5,4,4,4,15-10-07,离家比较近，就是没直达的车，导了一趟车到的，就在南四环边上，过马路就是！广场左手边是售票处和入口，特别说明那个火车就是售票处啊，直接换的电子票，儿子不到1米2
4668013,29086141,5,4,4,4,15-10-07,车展也去过，不亚于车展。有讲解员讲解，有体验区，还有 儿童游乐设施。
4668013,59656119,5,4,4,4,15-10-07,非常不错，孩子很喜欢，一开门就进去了，人少环境好，二个小时足够转完了，孩子还排队做了个什么驾驶。
4668013,832625572,5,4,4,4,15-10-07,人不多，在这个拥挤的城市能有这样的地方感觉很好，参观过后感觉又了解了许多许多关于汽车历史的东西，门票价格很便宜，一共5层，最好从5楼往下参观，内还有免费的汽车电影，还有体验驾驶，感觉棒极了
4668013,23652219,5,4,4,4,15-10-06,不错，到那就用，挺好的，就是单人的贵5块钱
4668013,768616688,4,3,3,2,15-10-06,带孩子玩儿挺好的地方，推荐，里面卖的玩具是玩具城的三倍价格，服务态度一般。
4668013,1697460,4,3,4,3,15-10-06,真不错，环境好，人不算多，看了不少车型还学习了汽车知识，车模不贵
4668013,27909387,5,4,4,4,15-10-06,还行吧，带小朋友的可以去，停车方便，就是觉得假期去人多！
4668013,48469807,4,3,4,3,15-10-06,整体感觉还行！适合带孩子去～～
4668013,1023092,5,3,3,3,15-10-06,汽车博物馆，没人讲解。。。。。
4668013,57303627,5,4,4,4,15-10-06,中国的汽车文化刚刚起步……还有很长的路要走！
4668013,9533343,5,4,4,4,15-10-06,值得一去，看看汽车和发展历史，对比下如今的汽车技术，不得不感叹技术的发展真的很快
4668013,791114,5,4,4,4,15-10-06,很好玩，宝贝很喜欢，还会再来的
4668013,830939961,5,4,4,4,15-10-06,小朋友很喜欢，人也不多，还有互动得游戏，是个增长知识得地方！
4668013,29419471,5,4,4,4,15-10-05,还不错吧，带小朋友去的，小朋友玩得很高兴。人也不多，就是停车场正经不便宜。
4668013,52535794,5,4,4,4,15-10-05,很不错，交通方便，和老公一起带儿子来的，环境好，还有体验活动，儿子挺高兴。
4668013,179765437,4,4,4,4,15-10-05,还可以吧，团票很合适，不贵，要是男孩子可能会更喜欢一些，女孩对这些兴趣不算太大
4668013,96807399,5,4,4,4,15-10-05,儿子很喜欢，还学习了很多的知识
4668013,832532684,5,4,4,4,15-10-05,还不错，带着宝宝一起去的，喜欢汽车的可以去看看，还有模型卖～
4668013,44103276,3,2,3,2,15-10-05,没什么可看的、建议路边看车就好了
4668013,140528393,5,4,4,4,15-10-05,不错，就是关门太早'还没来得及玩
4668013,8325253,5,4,4,4,15-10-05  更新于10-05 14:40,很开心带着孩子来看，很好找就在南四环边上，换电子票的地方是一列蒸汽小火车，本来是去参观的没想到一下找到换票的地方，很吸引人！换好票直奔5楼，赶上一个讲解员正在讲解汽车发展的历史，最早的汽车跑的还没有自行车快，但是发明者受到妻子的鼓励和支持不断改进，完成了这一伟大发明！里面藏品真不少，有一款豪车全球共28辆，这里就有一辆！讲解员讲解的很生动，通过讲解学到了不少知识！很适合带孩子来，三楼有很多小朋友的体验区，四楼大部分是大人的体验区，个别的体验还需要再买票！出门后围着楼转一圈，发现还有一个丰台区规划展，基本没人，拿身份证就能进入！
4668013,29115954,4,4,3,3,15-10-05,人不算太多，但空气不大好，尤其五层很是闷热、窒息。小朋友待着不舒适，越往下走越好些。太大了，小年龄宝宝只得走马观花的看。
4668013,90310740,5,4,4,4,15-10-05,孩子很喜欢，已经第二次来了，方便科学人性化
4668013,2184878,5,3,3,2,15-10-05,十一假期人比较多，体验项目排队，不错的博物馆
4668013,40529184,3,2,3,3,15-10-04,位置很方便，地铁出口走十分钟就到了，馆里很大，一共五层，展出的汽车种类也很多很适合带孩子参观，但是建议孩子大一点，五岁以上吧，能学到不少东西！
4668013,87197213,4,4,4,3,15-10-04,五层和四层老爷车展品很丰富，学到不少汽车知识
4668013,23396607,2,3,1,1,15-10-04,空气流通不好，适合5岁以上的孩子
4668013,19789787,3,3,2,1,15-10-04,也就适合家长带小学生来玩玩 并没有什么科普意义 不会再去了
4668013,185810238,5,4,4,4,15-10-03,孩子很喜欢 还会再去 点评团购的票很合适
4668013,766513725,3,4,4,3,15-10-03,挺好的博物馆就是有点远，带着孩子去的，人不是很多，坐地铁到丰台科技园，那边在建高楼，车都很少，真是不敢相信！
4668013,31796610,5,4,3,2,15-10-03,还可以，总体感觉不错。对孩子而言很长知识！
4668013,180279253,5,4,4,4,15-10-03,展品非常丰富，非常好，孩子也很有兴趣
4668013,753565864,5,4,4,4,15-10-03,和朋友一起带我家宝宝一起去的，人挺多的，孩子玩的开心
4668013,819870012,4,2,2,3,15-10-03,出了几款老爷车，车型不多。五楼开始到二楼，有点虎头蛇尾。前面还行，后面就……。二楼大部分是商店和吃饭的地方了。
4668013,22920376,3,2,2,3,15-10-02,我是团够的25一张票，其实可以不用团够，可以去出口那那优惠券，每张门票减8元，就是22元。地方挺大的，但是我觉得不值得30元的门票，10元还可以接受。里面好多收费项目，什么体验F1赛车10分钟就30元吧。还有体验高速的气流，3分钟20元。总之都是要收钱的。停车是收费的。但是我们停路边了，所以免费，呵呵。
4668013,3042865,5,4,4,4,15-10-02,孩子很喜欢哦 推荐家有男娃的来 呵呵
4668013,41061264,5,4,4,4,15-10-02,第一次去，孩子特别感兴趣，下次还会去吧
4668013,42371108,4,3,3,3,15-10-02,团购很方便实惠～
4668013,6852273,5,4,4,4,15-10-02,好多车车，适合孩子也适合大人！
4668013,138034743,5,4,4,4,15-10-02,孩子很喜欢！门票价格合适，要是能有一些免费体验的项目就更好啦！
4668013,14869611,5,4,4,4,15-10-02,好多古董车，可以了解汽车工业的发展进程。很有意思，小朋友还想去。
4668013,30112282,5,4,4,3,15-10-02,儿子很喜欢 每次到北京都要去看看
4668013,22424106,5,4,4,4,15-10-01,挺好玩的，有各种各样的人，当然还是我们自己国家的居多，也有一些老爷车啥的，但不多。主要是我国发展汽车历史啥的，还有一些汽车的基本知识。有好几层楼，我们去的那天参观的人不算多，不知道旺季是不是人多很多。馆里有些可以体验的项目，但也要排队半天，所以我们没咋体验。里边有个吃快餐的，中式和西式快餐都有，反正凑合吃了，还可以。
4668013,40253446,5,4,4,4,15-10-01,灯光有点暗，小朋友害怕，希望调亮点。
