22464554,834569649,3,0,0,0,15-12-19,感觉有点没意思，除了星空的那部分。有点不值。下午人有点多所以照相有点困难！
22464554,43457319,5,0,0,0,15-12-19,不错，最好带相机～记得带闪光灯
22464554,43875243,5,0,0,0,15-12-19,里面挺大的，很好玩，但是有些布景需要两人以上才能完成。
22464554,17665972,3,0,0,0,15-12-19,！去过一次韩国的  基本差不多 还可以
22464554,3065620,4,0,0,0,15-12-18,里面还不错，错位艺术，必须带单反相机，否则白去！
22464554,56550638,5,0,0,0,15-12-18,带外甥去的，不错啊很好玩儿，就是找了半天才找到
22464554,767764670,4,0,0,0,15-12-18,玩的挺开心的，票有点贵啊，最伤心的是最后竟然抽中了半价券！！！可是已经玩过了啊啊啊
22464554,129533018,5,0,0,0,15-12-18,还算新鲜，宝宝很喜欢，这种地方人多了也就没啥感觉了
22464554,25166904,5,0,0,0,15-12-18,离家很近一直想来，昨天约好姐姐一起来玩。有团购性价比很高，临近圣诞节里面有圣诞风格，还有北欧，梵高，和一些基本的3D场景～还不算多，可以拍的比较尽兴～一般拿手机拍就足够了，但也看到有人拿单反来玩～建议还是三人起比较好，有一些两个人一起的场景没办法拍，下回有了新主题可以再来尝试～总体满意，前台工作人员也很好，可以换硬币来存包和大衣。简单放两张图吧～
22464554,44045359,5,0,0,0,15-12-17,地儿不大，一个多小时就出来了，孩子觉得还不错，有几个感兴趣的。
22464554,41772366,5,0,0,0,15-12-17,很好玩哦 有的景很逼真呢 很值得去
22464554,2965409,5,0,0,0,15-12-17,很美~很美~ 去的时候 还没建好  只是一小部分，牌照真是美翻了
22464554,767600771,5,0,0,0,15-12-17,还是不错的，就是有点小，本来还以为挺大的呢，逛了1小时就逛完了！
22464554,839627499,5,0,0,0,15-12-17,人少，好玩，拍照乐趣多多，价格也不贵
22464554,28347827,5,0,0,0,15-12-16,喜欢，太喜欢了。
22464554,53526600,5,0,0,0,15-12-16,感觉还不错，三人以上去更好，里面有点热
22464554,4158820,3,0,0,0,15-12-16,有种被骗的感觉。。。看之前以为很高大上。。。
22464554,74741865,3,0,0,0,15-12-16,太简陋了，而且特别难找，连个标志都没有，不值这个价
22464554,112094207,5,0,0,0,15-12-15,好，孩子玩的高兴开心，照了好多照片
22464554,8485869,4,0,0,0,15-12-15,人挤人，真心没怎么看，带着家里宝宝，一岁多
22464554,810623563,5,0,0,0,15-12-14,去过其他的3D展，这里环境算是好滴，展区多，有些创意很新颖。人很多，服务人员特好，告知团价便宜，还帮忙团劵。门票价位算是便宜的，而且有很多优惠套票，适合家庭，情侣，学生来观看。位置在商场地下，不是太好找。
22464554,15328938,4,0,0,0,15-12-14,拍照是足够了，布景很多都旧了但实际效果照片还是挺好玩的影响不大。整体值得去玩玩
22464554,485574643,5,0,0,0,15-12-14,挺好的   还不错  有的不知道怎么拍  没有明显的效果
22464554,167738851,4,0,0,0,15-12-14,整体还可以吧。就是空间感觉比较挤。服务挺好的
22464554,77395828,5,0,0,0,15-12-14,还可以，就是有点乱。从兑票开始就好多人也没有排队。进去之后还好，地方有点小，拍照是个不错的选择，团购也不是很贵～这里满足了我对大长腿的所有幻想
22464554,37916432,4,0,0,0,15-12-13,以照相为主要乐趣 有点意思 周末人不少
22464554,40374545,5,0,0,0,15-12-13,里面比想象中大很多，玩到手机都没电了～不过有些画被磨的旧了，希望常换新背景呀～
22464554,18998846,5,0,0,0,15-12-13,孩子特别喜欢！玩嗨了！我们也是第一次感受这种错觉的空间！好！
22464554,23439398,3,0,0,0,15-12-13,人太多，部分设备老旧。感觉挺一般的
22464554,115962085,4,0,0,0,15-12-13,地方比较小，孩子觉得还可以。有点远。
22464554,43596183,5,0,0,0,15-12-13,还不错哦，照片拍出来的3D效果很棒，挺有意思的，推荐3人以上去，会更好玩儿！在那个星空小厅里放着Vincent这首歌，特别好听～
22464554,45041279,5,0,0,0,15-12-12,玩的很尽兴，效果做的逼真，只怪照相技术不好，没有达到预期感觉～～
22464554,796044949,5,0,0,0,15-12-12,感觉棒棒哒…值得一去！小孩大人都可以哦
22464554,6614865,3,0,0,0,15-12-12,跟梵高有关的内容不多，大部分都是错觉展。是如果喜欢拍照，跟小伙伴一起来的话，可以玩好久。但是如果冲着梵高来，又自己一个人，就觉得没大意思了。
22464554,6927113,5,0,0,0,15-12-12,好玩，真好玩，要有想象力。拍照时，注意角度。
22464554,46006484,4,0,0,0,15-12-12,有些景还是很漂亮的，超级梦幻，可以带孩子一起来。
22464554,85817572,4,0,0,0,15-12-12,人太多太多太多了，不然应该更有意思。
22464554,18856253,4,0,0,0,15-12-12,带孩子去的，孩子很喜欢，人很多，就是有些乱。总体还不错吧。
22464554,758352552,5,0,0,0,15-12-11,艺术品味，不错的选择，有空就去吧。
22464554,18780460,5,0,0,0,15-12-11,很有意思，玩的好高兴，各种照相 各种摆姿势
22464554,1925595,5,0,0,0,15-12-11,带孩子去就是个错误...没机会自拍啊！下次要自己去
22464554,7353620,5,0,0,0,15-12-11,不错，里面有很多，我们照了好多相片
22464554,37901141,4,0,0,0,15-12-10,挺有意思的，本来以为很小，结果进去发现内容挺丰富的，团购票很合适
22464554,44970903,4,0,0,0,15-12-10,去了，玩的蛮开心，不过现在这种3D很多
22464554,7698110,3,0,0,0,15-12-10,孩子还是喜欢的，虽然地方不那么大设施不那么细致，但是还是很开心
22464554,1041931,4,0,0,0,15-12-10,总体不错……看着挺low的进去以后还挺大的……不过确实挺low，但照片拍出来还是让人满意滴
22464554,29949546,5,0,0,0,15-12-09,喜欢，推荐给了同事，就是位置不是很好找
22464554,1851123,4,0,0,0,15-12-09,其实地方挺小的，但是空间利用很合理。
22464554,47334971,5,0,0,0,15-12-09,地方不大 不过感觉不错 人少的时候去好
22464554,141529224,5,0,0,0,15-12-09,好好玩儿，在里面拍照摆pose玩儿了一下午，累死了！
22464554,20459682,4,0,0,0,15-12-09,位于国瑞地下，来这里玩最好人多照出来的照片会更加有感觉，周末人比较多，工作日还好，点评有团购。
22464554,8792315,5,0,0,0,15-12-09,很好的一次体验，价格也优惠，很壮观啊。
22464554,8632118,5,0,0,0,15-12-08,还不错 喜欢拍照的可以尝试一下 价格合理
22464554,57481878,4,0,0,0,15-12-08,最好三个人去，还有因为第一次去不会拍，很浪费，要是有指导人员应该能好点，可惜没有！景色还是不错的。推荐去，也请商家改进。
22464554,94177636,5,0,0,0,15-12-08,地方不大，还挺好玩的，但是得人少的时候去
22464554,176941593,4,0,0,0,15-12-07,一个人去的表示很忧伤！必须要有人拍照才好玩！但是感觉还不错！
22464554,118800927,4,0,0,0,15-12-07,不错挺好玩的，出来还可以抽奖，地方不大
22464554,38230050,5,0,0,0,15-12-07,很好玩儿！这种立体的错觉感真的挺有创意。
22464554,30597794,4,0,0,0,15-12-07,第一次来感觉很新奇，近大远小的道理都懂，只是照岀照片来还是觉得很神奇，感受一下很不错。只是有一点简陋，如果再做的精致一点就好了。
22464554,40774244,5,0,0,0,15-12-06,位置很好找，大众点评给出的位置信息很准确。周末晚上来的，开始人多，玩到最后都没人了，哈哈哈～还是很好玩的，爱照相，谈恋爱没地方去的，比较推荐，孩子小的 就不推荐了，总是到处看看摸摸的，拍不了几张图。网上团购的券还是很划算的。就是里面的设备有些老久了，沙发椅子的都有破损。拍摄时站上去都要小心些。
22464554,39754312,4,0,0,0,15-12-06,还在布置，到处都是乱七八糟的材料，进去之前前台也没有跟我们说一声，结果…反正觉得好亏呀
22464554,53697227,3,0,0,0,15-12-06,好久之前去的了，忘评价了，今天补上吧。。。之前看微博上的宣传，感觉各种漂亮。实际一去，场地非常小，人又很多，照相都得抢地儿。冬天去的，里面很热，抱着大衣照相非常不方便。3D画的效果还是不错的，只要找好角度。最喜欢里面那个天使翅膀的！排队人最多的是星空的小屋，当时是这样，不知道现在还有没有了，排了半天进去之后感觉有点坑。。。后来去济州岛玩也去了一个3D艺术馆，虽然不情愿，但不得不说人家那个真的好太多，布局呀什么的更合理。
22464554,1346777,4,0,0,0,15-12-06,整体还行，周末人有点多。好玩的要排队一下。
22464554,760511824,5,0,0,0,15-12-06,团购很不错，值得去，有机会还会再去
22464554,153618060,5,0,0,0,15-12-06,比想象中大很多，感觉还蛮值的，比鸟巢那个要赞，周末人有点多但是也没有特别挤，朋友转发朋友圈集齐100个赞门票只花了20，还挺有趣儿的。效果挺不错的。
22464554,43403529,3,0,0,0,15-12-06,周六去的人挺多，这种错觉馆大概每个城市都有而且里面的东西都是一模一样！跟朋友一起个人实际不是很喜欢这种地方，色彩丰富灯光浓烈，晃的眼晕。文艺小清新还是不要去了
22464554,820460849,4,0,0,0,15-12-06,一般，面积太小了。幸好可以团。
22464554,2692332,4,0,0,0,15-12-05,强烈推荐团购，否则单独买票的话，性价比不高。进场大约七点半，里面分许多主题，可以慢慢拍。虽然地上游最佳拍摄点的提示，但还是需要动动脑筋，有实例可以参考，实际取景还是需要一定的创意。体感游戏都还分布很均匀，整个面积不小，大大小小十几个独立的房间供参照。说是裸眼3D，但如果位置不够准确或者姿势不够清晰还是看不太出来的。出来的时间差不多是九点，建议人多点去，因为部分场景需要不止两个人的配合，人多有优势，可以拍出不一样的效果。部分场景的确拿捏不好位置，特别提醒一下，存包是个坑
22464554,190186596,5,0,0,0,15-12-05,刚进去以为很小，没想到逛到累啊…几乎每一个场景你都欲罢不能…三个人以上去玩会比较合适。我跟朋友都是让别人帮忙拍的。还是很好玩的，每一个场景都有示范图片还有最佳拍摄点。当然你有更好的创意就更棒啦！下面看看我们的有趣照片吧～
22464554,834010947,5,0,0,0,15-12-05,和朋友一起去的，遇到北欧特级，很漂亮，人也是比较大的，值得去玩
22464554,70014403,4,0,0,0,15-12-05,不怎么地啊，不怎么地，比较坑人～～
22464554,5726599,5,0,0,0,15-12-05,不错哦，推荐，还是很有意思的，大家去吧。
22464554,52385348,1,0,0,0,15-12-05,因为赶上在布置圣诞场景，里面的原来的东西也大都破摆不堪，53一个人真心不值。
22464554,177958257,4,0,0,0,15-12-04,总体四星吧 人很少 位置不好找 打电话之后告诉了位置 建议三人去 不然没人帮着照相 里面的东西 看似简陋 照出来效果还是不错的
22464554,7828296,4,0,0,0,15-12-03,还不错 有几个场景效果很好 带公婆来玩一下 还挺开心
22464554,1151958,2,0,0,0,15-12-03,一般般，人多的很，拥挤。地方太小
22464554,789291295,5,0,0,0,15-12-03,没有想象中得好   特别小  一般般  人不多
22464554,766987365,4,0,0,0,15-12-03,还可以吧，效果一般般，体感游戏好多没开，星空里面有些灯坏了。。。
22464554,45971252,5,0,0,0,15-12-02,跟好朋友一起来的，拍照根本停不下来，强烈推荐星空
22464554,145950736,5,0,0,0,15-12-02,和小伙伴在一起玩的很开心，不过自己要找角度，里面是不大，但是拍照还挺花费时间的，没有传说中的工作人员帮忙拍摄，有的地标都不太明显了。照出来还真挺独特的，总之五分好评啦，第一次点评写这么多～～～
22464554,51952030,5,0,0,0,15-12-02,非常好，去了就是各种拍拍拍，人多去挺好玩。
22464554,19255391,3,0,0,0,15-12-02,这个真的不敢恭维..真的不是有趣.整体比较粗糙
22464554,6524395,2,0,0,0,15-12-01,不怎么样，没有宣传的好，几乎出不来宣传的效果。
22464554,229240212,5,0,0,0,15-12-01,感觉很不错，能搭配演出不同的效果，拓展想象力
22464554,2834556,4,0,0,0,15-11-30,这个是家庭套票，如果三个成人买还得补3块钱。场馆不算小，可以玩两个小时，三四个人去最好，可以组合拍照。大部分画有点旧，3d效果不是很好，这个价格有点贵了
22464554,7375207,1,0,0,0,15-11-30,周末去的，人特别多，所谓的梵高展览实在真的是特别的坑。
22464554,23058282,5,0,0,0,15-11-29,人有点多，不过还可以，虽然没有想象的那么好。建议大家好好保护里面的设备
22464554,105009929,5,0,0,0,15-11-29,人不算太多，带小朋友去照相比较好玩，有部分在维修，总体还行。
22464554,123143474,5,0,0,0,15-11-29,去晚了，好多场景都坏了，大家的破坏能力太强了
22464554,61509997,5,0,0,0,15-11-29,还好吧，拍了好多照片，值得去看看
22464554,3599342,5,0,0,0,15-11-29,一直很想来，终于有机会体验一下。超级有趣！连我5岁的女儿都玩得很开心。
22464554,192231193,4,0,0,0,15-11-29,还算可以的吧，比以前少了不少东西
22464554,38113756,4,0,0,0,15-11-29,照相，摆拍，累出一身一身的汗，不过挺好玩的，意境很重要
22464554,20779312,5,0,0,0,15-11-28,棒棒哒！值得一去！人挺多的 不太好找就是！
22464554,7234545,4,0,0,0,15-11-28,和朋友一起去的还不错   就是人太多太多⋯⋯
22464554,28426894,5,0,0,0,15-11-28,很好玩  各种创意拍照 比去年的设施多了一些灯效。空间不大 位置有点难找。
22464554,89282290,1,0,0,0,15-11-27,费半天时间来这了，就因为照片模糊不让进，门口女的跟死了娘一样，办不起活动别办，祝早日倒闭
22464554,94530679,1,0,0,0,15-11-27,举办不起活动就别办，来这了门口的娘们耷拉着脸来个“学生卡太模糊，不行！”，过来是给你面子，别tm觉得欠你的
22464554,51703790,5,0,0,0,15-11-26,北京刚开就去了，人超多。后来再去那附近的游乐场，基本就门可罗雀了。
22464554,819282184,4,0,0,0,15-11-25,还好吧。人不多。有些在更新。有些不知道怎么弄.哈哈
22464554,192738387,5,0,0,0,15-11-25,在朋友圈看到分享就约了朋友去了，挺好玩的，就是不太好找，找了好久，两个人拍照拍了好几个小时，有些人多需要排队，挺开心的，团购50一张票挺划算
22464554,19042622,5,0,0,0,15-11-25,好久之前买的，和家长一起去的，不错
22464554,50021521,5,0,0,0,15-11-25,错觉艺术馆最主要在于拍照，拍出来的效果还是不错的，是很好的纪念！
22464554,4058764,5,0,0,0,15-11-25,挺好玩的，就是人有点多啊，有的时候都摆不到最佳位置了
22464554,29170582,5,0,0,0,15-11-24,人有点多 总体还不错 团购价格也蛮便宜的
22464554,37474044,5,0,0,0,15-11-24,发达的哥哥回家不开看看就好哥哥 v
22464554,801616017,5,0,0,0,15-11-24,里面特别适合照相，挺特别的，很喜欢！
22464554,52099917,5,0,0,0,15-11-24,和小伙伴一起来照相，没有想象中那么大，倒是很有意思～
22464554,30083168,5,0,0,0,15-11-24,带孩子去玩的，玩的很高兴，有机会还去
22464554,5697556,4,0,0,0,15-11-24,还行吧，有些设施估计接待了太多人，略旧了，咔咔咔拍了一下午~出门还可以扫码抽奖，小伙伴居然抽了个一等奖，噔噔噔~门票一张~
22464554,50625593,5,0,0,0,15-11-24,还是很好玩吧 如果再精致点就好了
22464554,24145755,5,0,0,0,15-11-23,很好玩的地方，特别适合拍照，快带你的小伙伴去玩吧！
22464554,40099456,5,0,0,0,15-11-23,不错啊，很适合拍照，还是能玩上2小时的
22464554,22164929,5,0,0,0,15-11-23,挺好玩的，推荐大家可以去玩玩，团购也很便宜
22464554,837308219,3,0,0,0,15-11-22,门口布置什么的都挺不错的，进去之后有点差强人意了，很多景有点掉色了，感觉有点怪怪的，有些灯光也不是很亮，对于喜欢拍照的孩子来说有点郁闷
22464554,56607594,5,0,0,0,15-11-22,不错的地方，我们一群人，玩个1个多小时吧，主要是照相，效果背景布景确实不错！团购挺合适！
22464554,15686168,4,0,0,0,15-11-22,星空比较简陋，没想象中那么精致。
22464554,124282013,4,0,0,0,15-11-22,还行吧 没想象的好 好多东西都坏了 也没人修 有的灯不亮了 体感游戏坏了 .......
22464554,760101073,4,0,0,0,15-11-21,慕名而来 拍照效果蛮好 建议3个人以上来 方便拍照
22464554,158047509,5,0,0,0,15-11-21,去过很多城市类似的错觉艺术馆 这家的独特之处就在于星光 一直很喜欢梵高的星空这幅画 这也是到这里的主要原因 现在处于淡季 人不多 是个照相的好地方 带着自己的另一半也是个不错的选择 工作人员和和善 可以答应帮忙照相 值得一去
22464554,557962028,4,0,0,0,15-11-21,总体一般 性价比一般 好多还没有开 很累 很多不是很搞笑
22464554,83025729,5,0,0,0,15-11-21,跟朋友一起去的。人太多了。买个星空都没去。排队排的有种要死的感觉
22464554,2887868,3,0,0,0,15-11-21,孩子喜欢，周末人多，有些破旧…
22464554,20219443,4,0,0,0,15-11-21,一般，和预期有差距，但小朋友应该觉得可以
22464554,39228003,5,0,0,0,15-11-20,和朋友一起去的，地方也挺好找的，能在里面待2-3小时吧，周末去的话人会多
22464554,40661939,1,0,0,0,15-11-20,纯粹骗人的！很多设施都没有开！
22464554,41568580,5,0,0,0,15-11-19,很好，带老妈一起去的，找了很多照片，很有感觉
22464554,774576271,5,0,0,0,15-11-19,蛮好玩的，东西很多，很有趣，喜欢拍照的可以去
22464554,62341479,5,0,0,0,15-11-18,空间再大型就更好了，音乐也要欢快些
22464554,153912401,4,0,0,0,15-11-18,这个地方不好找！因为很少来这边逛街，更没注意到乐天玛特超市，展览就在地下一层。其他感觉不错，周末去的人不很多，孩子特别喜欢，呆了2个多小时不肯出来，很有趣，高科技还有错觉艺术都很值得玩味。年轻人去的很多，大家都研究怎么按图片上的姿势来拍照，挺热闹的！下次再来还可以再玩一次，糯米团的比较便宜，原价的不到一半。
22464554,31923562,5,0,0,0,15-11-17,很超值的体验，逗逼的朋友一起去玩就比较有意思
22464554,37815449,5,0,0,0,15-11-17,很有意思的地方！照相效果非常好~
22464554,9295655,4,0,0,0,15-11-16,和老公一起去的，照出来的照片都很有意思，可以尝试
22464554,27378057,5,0,0,0,15-11-16,对于爱照相的我来说，很好，就是地方不大
22464554,30591635,5,0,0,0,15-11-15,感觉好极了，很棒。。。。。。。。
22464554,100053070,5,0,0,0,15-11-15,很有意思，效果很逼真，玩的很高兴！！！！！
22464554,2051619,1,0,0,0,15-11-15,太黑了 打着梵高的旗号 什么都没有
22464554,100104519,4,0,0,0,15-11-15,地方有点小，但是和朋友小玩一下还是可以的
22464554,35826896,5,0,0,0,15-11-15,好玩儿 里面还有切水果的游戏 玩儿了半天 出了好多汗 很有意思
22464554,750229374,5,0,0,0,15-11-15,不错，就是地方小，人很多的，当时找位置可难找了
22464554,38983002,5,0,0,0,15-11-14,挺好玩的就是人有点多拍一张很慢下次可以再去玩玩
22464554,27841519,1,0,0,0,15-11-14,最差的一次体验！没有之一！为了看所谓星空展，在外面拍了半个小时队，进去后到处都是人，又为了看星空排了近两个小时，进去后就是一个不到十平米的小黑屋子，点着一堆会变色的灯泡，周围放着玻璃，七八个人挤在一起，呆上一分钟然后被通知该出去了。
22464554,21274602,3,0,0,0,15-11-14,挺好玩的，不过画的有点糙，去一次足够了
22464554,42928882,3,0,0,0,15-11-14,还好，玩的不多，感觉还行，没什么特别吸引的地方
22464554,11488059,3,0,0,0,15-11-12,感觉还凑合，不能说特别满意倒也还行，没有鸟巢的多。
22464554,49593453,5,0,0,0,15-11-12,呵呵，有点小坑爹啊，地方也不太好找
22464554,76977104,5,0,0,0,15-11-11,喜欢拍照的人可以去。。。。。。
22464554,2257390,4,0,0,0,15-11-10,照相好地方，取景找好角度还是很有意思的
22464554,41938817,5,0,0,0,15-11-10,第一次带孩子去玩，孩子玩的很开心(∩_∩)
22464554,794834059,5,0,0,0,15-11-09,周末去的，三个大人买的团购还要补差价，就是照照片，没有什么实质玩的东西，地儿是真难找
22464554,50633259,5,0,0,0,15-11-09,之前看评论说要逛挺长时间，确实如此，在里面各种拍拍拍、玩的很尽兴。
22464554,845306839,3,0,0,0,15-11-08,说站门口看一眼都不让！不过里面的帮忙照相的工作人员蛮好的，就是非常普通照相的地方，大家看图就懂了，好多地方我都真心觉得哪个SB想照这种东西。有简单的体感游戏可以玩，人不太多，不用围着，有一个星空主题的，一直在放幻灯片似的背景还不错，大概就是我来的唯一意义了，然而跟我同去的小伙伴照相技术实在是。。。。
22464554,31894067,5,0,0,0,15-11-06  更新于11-08 21:39,总体来说在他家可以拍照拍得很高兴，这是刚进到这个小空间时没发现的，看着都是花花绿绿的假假的道具，可是拍出来全是意想不到的收获。颜色很浓重，适合来拍拍拍，错觉造成的奇妙效果只有在照片里才展现得更好。同时，建议三个人来，有那种两个人共同出镜的场景，只有两个人来就比较麻烦了。不足的是感觉这几个场景就要那么多门票，想想有点贵。
22464554,123915962,5,0,0,0,15-11-08,人太多了，建议平时的时候再去。
22464554,51155321,5,0,0,0,15-11-08,带小朋友来感觉很棒！小朋友非常喜欢！照出来效果倍儿棒！
22464554,156913860,5,0,0,0,15-11-08,还挺好玩的 我们在里面几乎全部照了一遍 大概用了2个小时
22464554,35272567,5,0,0,0,15-11-08,之前和朋友去过，场景不算很多，总体感觉还不错～
22464554,52025434,5,0,0,0,15-11-08,值得一去，人越多越好玩儿！！！
22464554,166179363,5,0,0,0,15-11-07,适合情侣去！感觉非常的不错！挺好的
22464554,131792199,5,0,0,0,15-11-07,3D效果很逼真。让人仿佛置身其中！玩得很嗨
22464554,37342308,4,0,0,0,15-11-07,设备旧，没维护。就是个照相的好地方，建议3人以上去 ，有些照片要拍出效果至少3人。
22464554,51231204,3,0,0,0,15-11-06,还不错，可以一看，就是人有点多
22464554,63926360,5,0,0,0,15-11-06,很适合照相 还有体感游戏 今年又去了一次
22464554,577188493,5,0,0,0,15-11-04  更新于11-04 20:17,挺美的。记得带笔。遇见梵高很感动。
22464554,5781930,4,0,0,0,15-11-03,适合带小孩来拍照，纯看的话也没太大意思的
22464554,102637894,4,0,0,0,15-11-03,还是很不错的，为喜欢拍照的小伙伴们提交的广大的场景，刚开始的时候去的，人比较少，慢慢的人多了，稍微要等一下，还可以玩切水果，感觉很不错的一次放松，值得推荐
22464554,720981742,5,0,0,0,15-11-01,孩子们玩的很嗨！挺开心的！他有才了
22464554,5720768,4,0,0,0,15-11-01,很久之前就想着来玩玩，终于过了把瘾。
22464554,59542433,5,0,0,0,15-11-01,太好玩了，人还不服的，服务非常好，常帮人解说、拍照，值得一去的一个地方。
22464554,129666077,4,0,0,0,15-10-31,挺好玩的，和小伙伴在xbox区跳了一个多小时，拍照效果很逼真，总的来说挺好的
22464554,6200132,5,0,0,0,15-10-31,体感游戏挺好玩～票价略贵，40差不多
22464554,79388989,5,0,0,0,15-10-31,挺好，就是人太多了，排了好久才进去。
22464554,27745559,3,0,0,0,15-10-31,半年前去过一次，这回再来，更新不多
22464554,103268789,4,0,0,0,15-10-31,还可以，没有想象的那么好，不过也还好啦
22464554,13680337,3,0,0,0,15-10-30,用凡高的画做广告，我以为是类似画展的地方，结果不是。不过照出来的相片还不错
22464554,766181528,3,1,2,2,15-07-04  更新于10-29 22:51,还不错！玩到最后都累！朋友觉得还不错！
22464554,765760931,3,0,0,0,15-10-29,还需要时时更新，多搞一些活动，吸引客人
22464554,179719506,5,0,0,0,15-10-28,还可以，也很感兴趣，只是希望商家能够及时修复设备，给人新鲜的感觉，而不是看到破损的东西
22464554,133138477,5,0,0,0,15-10-28,还行，逢节假日，人超级超级超级多哦。
22464554,15378213,3,0,0,0,15-10-28,太小了！我觉得应该做大一点，限人流，不然进取的人总也玩儿不好，本来安排了1天玩儿，结果我们20分钟就出来了，人多，而且那个味儿太难受了
22464554,41105107,5,0,0,0,15-10-28,孩子玩的很高兴，真的不错，下次还去
