22464554,116835342,5,0,0,0,15-01-19,帮朋友团的，小孩子都喜欢，人较多
22464554,44888119,5,0,0,0,15-01-19,其实好不好玩完全取决于你的小伙伴会不会照相！！！
22464554,41921787,4,0,0,0,15-01-19,周一去的，如果没有正好去的小学生的话人不算多。星空馆不如叫星空屋，很小一件。我们前面的人以为没来灯就出来了，幸好我发现了灯的开关。里面不大总体感觉55块钱不值。
22464554,40829136,5,0,0,0,15-01-19,没有想象中那么大 东西有点陈旧 但是拍出来效果还不错 去的时候尽量轻便 拍照时候也方便 里面太热了
22464554,167005732,5,0,0,0,15-01-19,跟朋友一起去的，很好玩，身临其境的感觉
22464554,8093722,4,0,0,0,15-01-19,照相背景比想象得多，人非常多。
22464554,36605481,5,0,0,0,15-01-19,就是里面温度太高，热！其他还不错。
22464554,26864906,4,0,0,0,15-01-18,人比较多，传给很小，拍照还要等别人拍完，不然总是镜头被挡住，我们逛了一个小时就出来了，里边超级热，去的记得穿短袖就可以了。在地下二层最角上，不太好找。
22464554,24775350,5,0,0,0,15-01-18,场子满大的！内容比较丰富，足够满足大家拍照和自拍的欲望。
22464554,17916330,3,0,0,0,15-01-18,有意思，就是有点旧，人多，总得来说还是值得体验的
22464554,2545060,3,0,0,0,15-01-18,一般吧，地址不明确，请大家关注，门口没用指示
22464554,27704005,5,0,0,0,15-01-18,终于去了！8月份买的团购券被告知不能验证，貌似是大众点评这边出了问题，不过她们还是收了只55块钱。3D画看起来一般般，但是照相的效果不错，工作日去得人也没有那么多，只有星空房间需要排队，不过排了队进去感觉被坑了…挺愉快的一次玩耍，三个人玩的很嗨～
22464554,13307540,4,0,0,0,15-01-18,人居多，没有想象的好，照相得等机会
22464554,27208021,1,0,0,0,15-01-18,果然和想象中的一样无聊……摆几个Xbox就牛逼了？
22464554,8321417,4,0,0,0,15-01-18,我感觉星空的那个还是挺美的，就是时间太短了，略抠门，体感游戏玩了半天跳舞那个，三个人浑身是汗，这个绝对适合减肥，其他的画趣味性也蛮强的，下午5点多去的，人不算多，为了避开所谓的熊孩子
22464554,900903,5,0,0,0,15-01-18,觉得泡芙不错，鸡翅还行，要排队。
22464554,14108791,3,0,0,0,15-01-18,元旦去的，人巨多………星空坑爹………
22464554,3362116,4,0,0,0,15-01-18,原来拍照也是很消耗体力的，可惜空间有些窄小。
22464554,7019408,5,0,0,0,15-01-18,第一次去挺有意思的，，，，，，，，
22464554,8999272,2,0,0,0,15-01-18,玩了玩体感游戏，星空什么的还是很水的。。
22464554,71046313,5,0,0,0,15-01-18,整体还可以，就是人太多了，抽奖还行
22464554,42594827,5,0,0,0,15-01-17,人好多，挺有意思的，夏天再去一次
22464554,8023333,2,0,0,0,15-01-17,可能是场地有限，这样拥挤的艺术馆实在令人大失所望。
22464554,145131,2,0,0,0,15-01-17,为了星空去的，本来也没有报太大期望，所以也没什么失望。人比想象少些，但有的场景照相还是要等待。感觉最好三个人一起去，里面有一些要两个人拍才能出效果的场景，找别人终归不方便。最后要说里面真的很热。
22464554,117328071,5,0,0,0,15-01-17,感觉不错人太多
22464554,18657180,5,0,0,0,15-01-17,不错啊，第一次去，感觉挺新鲜的
22464554,33826631,4,0,0,0,15-01-17,建议去天津的，北京的人太多，东西也比天津少好多
22464554,101307454,5,0,0,0,15-01-17,very good 一次非常棒的体验 我很喜欢这种3D艺术
22464554,1838027,5,0,0,0,15-01-17,还没有去，看别人发的照片很不错，适合带孩子玩
22464554,3645378,4,0,0,0,15-01-17,除了人多，里面闷，不太干净以外，其他都很好，玩儿的很开心啦
22464554,36950861,3,0,0,0,15-01-17,更适合家长带孩子来，拍些好玩的照片！
22464554,30027199,3,0,0,0,15-01-17,有团购更值当一来了，玩呗，不用带着思考，进来就是图个乐呵。
22464554,2356051,3,0,0,0,15-01-17,图有点假，不过挺有意思的，环境有点简陋，有存包柜
22464554,25694871,4,0,0,0,15-01-16,还是很适合小女生去的，尤其是爱摆姿势照相的女生，还有喜欢给别人照相的女生也适合。星空馆就是那么坑爹。
22464554,117828143,5,0,0,0,15-01-15,照相蛮好玩的，不知道是不是一直有这个活动
22464554,55754860,4,0,0,0,15-01-15,这地方适合多人一起去，两人就有点少了。照相效果还是很棒的
22464554,37806321,5,0,0,0,15-01-15,挺有意思，就是票价不便宜，团购价算还凑合
22464554,59528199,5,0,0,0,15-01-15,带孩子去的，孩子玩的很开心，确实很新颖，就是地方太小了，人挤人的，要照全景得等半天
22464554,113336296,2,0,0,0,15-01-15,明显价格偏高，场景场景间挨的太紧，不好拍照，设备陈旧，这种地方也就去一次，再不会去的
22464554,184537787,5,0,0,0,15-01-15,还不错 就是没有小杨生煎好吃 但是味道还是不错的
22464554,18498770,5,0,0,0,15-01-15,很有意思，比较好玩。推荐哦！！！！！
22464554,48326885,4,0,0,0,15-01-14,还不错，但是挺简陋的~就是一些画纸和纸版制成的
22464554,87678,3,0,0,0,15-01-14,还可以，人多，不过有点陈旧了。指示拍照点还可以，加上示范图片就好了
22464554,2759582,3,0,0,0,15-01-14,有点坑，不太值票价。本来最感兴趣的是星空，实际上就一个屋子里串着彩色灯泡，一关门就自动亮起来了，带孩子来玩玩拍拍照还是不错的，就是没有宣传的那么好，人多且杂乱无章。
22464554,77512247,5,0,0,0,15-01-14,挺好的，人有点多，必须三人以上去。方便拍照。
22464554,51330012,5,0,0,0,15-01-14,就是去拍照的，太闷热了，建议开下冷气~
22464554,57026540,5,0,0,0,15-01-14,团购55/人，地方不大，玩的很
22464554,17826159,5,0,0,0,15-01-14,感觉不错人不是很多新来的星空馆需要排队还限时
22464554,30350559,5,0,0,0,15-01-14,画很多，玩的超级开心，摆动作很累，星空照相好看
22464554,141880426,5,0,0,0,15-01-14,周一去的，人很少，里面的服务人员很热情，帮忙拍照，介绍。只是设施有点旧了，应该再装修了
22464554,13369197,5,0,0,0,15-01-13,团购很方便，随去随团就可以，很好玩哦～
22464554,143665168,5,0,0,0,15-01-13,比较新奇。但是人太多，看一次足以。没什么高科技。比起这种成本，略贵了。故宫那么大成本也就40。嘻嘻
22464554,52356146,5,0,0,0,15-01-13,真的很不错，大人孩子都很喜欢。就是地方太小，人有些多！
22464554,20319060,3,0,0,0,15-01-13,一般般，人太多了，空气不畅，场地也小
22464554,33537926,4,0,0,0,15-01-13,现在他们家的三的了，搞得比较不错，最好就是他们家的场景会经常的挑换，这样拍照片呢，就不会冲突，去过一次的人了，过段时间还可以去第二次!
22464554,105874217,4,0,0,0,15-01-13,去的时候排队取票，人多的也没法好好拍照，而且屋里实在太热了。
22464554,35991147,3,0,0,0,15-01-12,还行，人多去比较好玩，星空展比较坑啦
22464554,9911154,3,0,0,0,15-01-12,还行吧 虽然图不是很多 但是画的都很逼真 星空展其实就是一件小房子 很闷 只能站下三个人 还是并排的 边上都是水 那个食人的特效还有一进门那个挺好玩的
22464554,94076054,3,0,0,0,15-01-12,星星房太小了 不过很美 每次只能进去两三人 创意3D很喜欢 还有几个体感游戏 跟LP拍了不少照片 门口有抽奖
22464554,115063884,5,0,0,0,15-01-12,满意满意，主要是一起玩的人在哪儿都开心
22464554,51619835,5,0,0,0,15-01-12,三个玩儿High了的小伙伴，非常开心，比较适合3-5个人一起去，这样比较热闹呢~建议早点去，十点之前开门了就，去的早点的话人比较少，拍照的时候不用排队，超级爽呢~
22464554,34054785,5,0,0,0,15-01-11,周末人好多，都是带孩子的，挺好玩的，里面很热
22464554,137596284,4,0,0,0,15-01-11,"不错!只是1月3号去的时候人有些多〉〈星空排队1个多小时,效果差强人意"
22464554,42303136,3,0,0,0,15-01-11,还好吧。。？！啊b十五个字好罪恶
22464554,24781065,5,0,0,0,15-01-11,非常好，值得一去，我跟朋友玩儿了三个小时还出来
22464554,5280810,3,0,0,0,15-01-11,去了趟王府井顺便就走到了崇文门，在国瑞里走了很远才到的。看别人拍的还可以。几个玩游戏的地方都被人占着。
22464554,11054952,4,0,0,0,15-01-11,不错～～～不过就是人有点多，空间比较小
22464554,4984663,4,0,0,0,15-01-11,场景比咔咔多很多～但是人太多了！还特别特别热！星空那个要排很久队！
22464554,48689371,3,0,0,0,15-01-10,地方不大，但人挺多的，拍着拍着还挺好玩的
22464554,28546519,4,0,0,0,15-01-10,人多的话会排队，里面太热啦，可能因为人多的原因，不过设施还好，适合美美的去拍照
22464554,96705,5,0,0,0,15-01-10,很不错，孩子喜欢，大人也喜欢。
22464554,4599406,4,0,0,0,15-01-10,很有意思，大多数场景都有拍照示范图，便于效仿，还有可以亲身体验的场景，每个都看遍拍遍的话需要大半天，就是人多，照片效果很好，很多场景比较逼真
22464554,6843956,5,0,0,0,15-01-10,还不错，蛮好玩的，团购的比较值
22464554,130502677,1,0,0,0,15-01-10,相当后悔 ！地方很小 在超市里很不好找  星空展就一个小破屋 真服了 还得排队进去 就45秒 ！！！！坑爹！要是不团购太不值得咯
22464554,34374326,5,0,0,0,15-01-10,地方还算好找  人比较多 照相需要等位
22464554,54850445,4,0,0,0,15-01-10,还好吧……拍下片子后看看还有点意思
22464554,34530376,1,0,0,0,15-01-10,排了将近一小时的队，一次4人进小黑屋体验（拍照）45秒，然后出来。真不值。外面就是普通的所谓3D体验馆，拍拍照什么的。人多缺氧巨热。太差。
22464554,54975065,5,0,0,0,15-01-10,还不错哈哈哈哈一月四号去的，人不是很多，很有意思
22464554,47315075,4,0,0,0,15-01-10,感觉挺有意思的，不过大部分都比较旧了，应该换换新的3D画幅
22464554,7694461,5,0,0,0,15-01-10,特意选平时日子去的，人不多，拍起来很顺利。偶尔去体验一下还是不错的。星空那个比较坑啊，就是个很小的屋子看一分钟灯光变化。
22464554,14619377,4,0,0,0,15-01-10,好吃，就是有点小贵～黄桃泡芙奶油太多，有点腻
22464554,175263115,5,0,0,0,15-01-10,我觉得此次团购又值又好，很不错
22464554,10223761,1,0,0,0,15-01-10,上当的地方，去了就会后悔，浪费时间不说
22464554,70231,4,0,0,0,15-01-10,地方小，特别热！没有工作人员讲解如何能拍出效果！照片没能拍出3D的感觉
22464554,3001019,3,0,0,0,15-01-09,排队长，拥挤 无法最佳角度拍照！
22464554,139139607,5,0,0,0,15-01-09,排队排好久，但很值得~!大小屋那里被陌生人把手机塞到帮忙拍照也是醉了，可见社会风气真的好好…
22464554,11358517,4,0,0,0,15-01-09,就是人太多啦 人少的时候应该还可以 而且那个所谓星空展实在是。。。
22464554,9040986,4,0,0,0,15-01-09,还不错。因为之前玩过3D画，所以这次玩的就没那么大兴致了。那个北欧就是一间小屋……自己去体会吧
22464554,47057067,2,0,0,0,15-01-08,与想像的不太一样，没那么精彩，人太多，热，感觉不好
22464554,18725197,4,0,0,0,15-01-08,1.4去的，人不是特多，总体来讲还是挺好玩儿的，基本上每个图片都照相了，总共花了两个小时左右。必须人少时候去，人太多就要排队。星空展感觉挺水的，才一分钟，小房子里特别小，就是一堆灯泡。
22464554,27060416,4,0,0,0,15-01-08,照片至今又忘记传给我了...这个地方适合朋友玩闹，情侣开心
22464554,26050205,5,0,0,0,15-01-08,很有意思的3d展，玩得很嗨，特别赞
22464554,21752328,5,0,0,0,15-01-08,非常好！超值！就是人有点多！还回去！
22464554,28213382,1,0,0,0,15-01-08  更新于01-08 12:04,吐槽都觉得浪费精力。慕名而去，在国瑞里面走三圈也没找到，还以为取消了，如果是牛逼的活动，应该满商场都是广告牌和指引才对啊。最后问了工作人员，走了十万八千里才找到，越走越荒凉的时候心里预感就越来越糟，排队买票的时候放的歌是上个世纪80年代的口水歌，当时听到心里就咯噔一下，心想完了，听这歌就感觉里面一定很***。情侣票150.进去之后。果然比想象中的还要***。那叫一个粗制滥造，那叫一个糙，那叫一个low。传说中的星空，排队排了大概半小时，就是个不超过5平米的小屋子，全是镜子，空中挂着特别劣质的蓝绿红小灯，把你关里面大概40秒钟，灯变换几次颜色，就开门放狗了。里面还四周有脏水，有姑娘穿UGG一脚进去，洗鞋的钱我都觉得不值。ANYWAY。自认倒霉。后来回家后想想，就是自己傻。如果真的是多么牛逼的高大上项目第一次进北京，那选址肯定是在国贸啊三里屯啊，怎么可能去南城这个等级的地方。呵呵呵。头脑发热，钱是小事儿，但就是觉得被坑了，名不副实虚假宣传到极致了也算。
22464554,31730275,4,0,0,0,15-01-07,元旦假期最后一天去的 人非常的多 每个取景的地方都相隔太近 有的根本拍不出3D的感觉 也不算失望吧
22464554,47654078,5,0,0,0,15-01-07,照相不错。就是人太多 最好晚上五点后再去
22464554,6405533,3,0,0,0,15-01-07,人太多，一般吧，不用特意来，没那么有意思！
22464554,29028742,5,0,0,0,15-01-07,不错，挺好的，人多了去才好玩！带孩子去的，宝贝儿也挺喜欢！
22464554,77906383,5,0,0,0,15-01-06,非常满意，而且有特色，让人觉得有趣
22464554,34601452,5,0,0,0,15-01-06,找对位置可以拍出不一样的画面！
22464554,2107101,1,0,0,0,15-01-06,太坑爹了，地方又小又闷，3D效果太粗糙，那个什么星星，地方还没厕所大，一次只让进3个人，45秒就结束了，千万别来
22464554,24598608,4,0,0,0,15-01-06,还不错吧，馆有些小。那个什么星空展我有些呵呵，创意到还是可嘉的…
22464554,44549504,4,0,0,0,15-01-06,人挺多的，就是拍照，游戏什么的基本无意义。挺好。
22464554,42836096,4,0,0,0,15-01-06,有点坑，不是特别满意，人多而且乱
22464554,55712976,4,0,0,0,15-01-06,不大，但是场景挺多的，有几个游戏机坏了，整体还行吧，适合人多去〜
22464554,109304758,5,0,0,0,15-01-05,还行吧，四个人一起去的。人不多，
22464554,16520821,2,0,0,0,15-01-05,开始去得人很多，人挨人的，照起来不过瘾，有的效果不是很好
22464554,173311,4,0,0,0,15-01-05,适合拍照的场所。看拍出来的照片超好玩。
22464554,28535392,5,0,0,0,15-01-05,挺好 就是人多 太多了 看得挺有意思
22464554,20529998,4,0,0,0,15-01-05,圣诞前两天去的 还在建设圣诞主题的场景 没赶上 好可惜啊 总体还是不错的 晚上去的人不多 玩了好久
22464554,36580279,4,0,0,0,15-01-05,人多，热，其他还好…………………
22464554,26280679,3,0,0,0,15-01-05,整体来说还好，建议来参观体验的亲们最好是多人同行，一来是可以互相拍照，二来人多热闹拍出来的效果也好。
22464554,34671120,5,0,0,0,15-01-05,第二次吃了
22464554,85408366,4,0,0,0,15-01-05,周末带女朋友去的 地方不是太好找 里面有些场景在装修 有些场景有些掉色 照出来效果略差 游戏还是有点意思 总体感觉还行吧
22464554,3808185,5,0,0,0,15-01-05,好玩儿，好玩儿！拍照巨好。就是建议别穿太厚，热！
22464554,42792039,4,0,0,0,15-01-05,一般，场馆比较旧了，反正拍了一堆照片就出来了
22464554,8452679,3,0,0,0,15-01-04,跟朋友一起去的，感觉三四个人一起去比较合适，有的姿势需要两个人及以上完成~主要就是拍照玩儿，大部分都挺有意思的。
22464554,29608769,4,0,0,0,15-01-04,错过高峰期去的，人不是很多，但是里面超级热。还是很好玩的。
22464554,44044235,3,0,0,0,15-01-04,感觉跟自己想象中的差距还挺大的…
22464554,12521792,4,0,0,0,15-01-04,不错，不过星空馆小了点，每次进去四个人，只能呆半分钟就出来。
22464554,4778527,2,0,0,0,15-01-04,元旦去的，人实在太多了，所以体验很不好，拍照的话要排队，地方比较小也经常会闯进别人的镜头。匆匆看了看就走了，拍了拍就走了。
22464554,139995267,4,0,0,0,15-01-04,拍照的效果还不错，就是人有点多
22464554,47284895,3,0,0,0,15-01-04,元旦放假去的。人真是多。里面有个什么星空，感觉有点坑爹。
22464554,1823315,3,0,0,0,15-01-04,元旦去的，人太多了
22464554,2017241,5,0,0,0,15-01-04,出来时候还能抽奖，又抽了一张券，值了！
22464554,37218927,5,0,0,0,15-01-04,星空有一点点坑。就是一个小屋一下放进去三五个人让你呆一分钟就得出来。凑合吧。没想象的那么美
22464554,7208454,3,0,0,0,15-01-04,场地布置的一般，如果去过首尔的话这个就没必要去了，场地相比小设计的也没有首尔的精致，如果花100去就不值了，所谓北欧星空就是用几面镜子里面布满了小灯泡，然后变换不同的颜色而已，在那间封闭的小屋子跟蒸桑拿一样巨热无比，还得排半天队。唯一值得一提的就是有几个互动游戏可以和小伙伴一起，话又说回来其实就是没有手柄的wii
22464554,39714847,5,0,0,0,15-01-03,还不错！挺有意思的！就是好多体感游戏都没有！还有有的东西陈旧点！
22464554,14719290,3,0,0,0,15-01-03,错觉展不错 但星空展太坑人了 排了一个多小时队 就看了也就半分钟 小房间都转不开身！
22464554,26876702,5,0,0,0,15-01-03,不错。很有乐趣，孩子喜欢，感受到了3d艺术的魅力。
22464554,46355947,5,0,0,0,15-01-03,孩子很喜欢，就是有点热，人多，不过照相的效果特别好
22464554,1558296,5,0,0,0,15-01-03  更新于01-03 20:15,很不错的一次体验，元旦最后一天中午去的，人真不少，每个布景交相交错，人多时不易拍照，但效果确实可以，有的布景有些老旧了，应不定期更换下，水下世界为最大亮点，但由于光线问题很多相机和手机只能望尘莫及，幸好带了D750，很是精彩。排大长队的星辰大失所望。就是无数个LED灯在一个满是镜子的狭小空间，没意思。里面太热了。存储箱不够，拿着大衣包包实在不便。
22464554,118792344,3,0,0,0,15-01-03,还可以，不过那个星空有点坑啊，小小的房间几个灯泡，还不如蓝色港湾，还免费
22464554,62069613,3,0,0,0,15-01-03,团购还算可以吧，但是人太多了，可能是过节的关系，建议非节假日过来。
22464554,69950804,4,0,0,0,15-01-03,里面画也不是很多 有几个挺好玩 有体感游戏 玩玩还不错
22464554,51651422,3,0,0,0,15-01-03,拍照出来的效果还可以，世纪一般
22464554,60668424,3,0,0,0,15-01-03,人多，太热，太挤。团购很合算。感觉还是不错的。
22464554,27911990,5,0,0,0,15-01-03,挺没劲的，不值这个价钱，不推荐
22464554,38053747,5,0,0,0,15-01-03,人简直是太多了，在哪个画面前照相都要排队，如果人不多，觉得还有挺好的，人多不适合带孩子参加
22464554,52794518,5,0,0,0,15-01-03,一定得多点人去，不然照相会很着急
22464554,21151288,4,0,0,0,15-01-03,我们四个人去的，拍出来效果还可以
22464554,4955824,2,0,0,0,15-01-03,人暴多，组织人员虽然很努力，但组织水平还需要提高。排队买票的人原本自觉按秩序排成一条队，工作人员为了后面能排更多人，轰着让后面的人到前面，秩序立刻乱了。经过游客提醒，工作人员才区别开，让一些人先进一些人后进。里面很热，人很多，星空要排队一个小时，有些作品没办法拍。
22464554,6108052,3,0,0,0,15-01-03,星空体验排了一多小时队 进去就45秒 有点微妙 其他场景人真的太多 都没有什么心思看了
22464554,5413002,4,0,0,0,15-01-02,图片很多，就是人太多，建议装几扇窗户或者排风扇，里面人一多，空不流通，憋得都要窒息了；还有入口处的存包柜也应增加，都是坏的，还要服务员手动操作，很不方便
22464554,26057349,2,0,0,0,15-01-02,购买之前看了评价很一般，不过还是很期待地来玩了。大概下午5点到的，居然还排队，而且是在入口外几米处专门弄了一条排队的道，刚过来的时候根本不知道应该在哪儿排队，工作人员的态度超级差，一点也不耐心，只会说后面排队。国瑞城地下的信号超级烂，移动4G连不上，也没有可用的wifi，买完券没有发短信，所以只能进客户端查找券，问了2次，工作人员都冷冰冰地说没有wifi，只得去借助旁边吉米的wifi，看完展览在出口处发现这家有3个wifi，还列出了名称和密码。当时有好多人因为连不上网专门去一楼打开再下来兑票，而这家就这么冷酷无情，公开下wifi会怎样。说下里面玩的吧，主要就是3D的画和Xbox体感游戏，设施有点破旧了，没见过这些的还是比较新鲜吧。前面说了人多，里面很闷，没有空调，热得不行。饮料也卖的贵。一个小时就差不多出来了，所以说门票很是不值，就是圈地捞钱。
22464554,13187086,5,0,0,0,15-01-02,很有意思，拍了很多照片留念！赞一个
22464554,82435074,4,0,0,0,15-01-02,有点太热了，建议存包不过需要准备一元硬币，还是很好玩的
22464554,107257639,5,0,0,0,15-01-02,总体感觉很不错，玩的也很high，值得推荐
22464554,8894833,2,0,0,0,15-01-02,太没意思和失望了！奔着星空展去的，结果就那么一大点地方，真是只剩下拍照了
22464554,8644825,3,0,0,0,15-01-02,人太太太太太多了。11点到的时候已经排起了长队。买票换票要排队，入场还要排队。进入以后里面也是人挤人，照相都是抓拍，星空排的人更多，根本等不起。
22464554,124692592,5,0,0,0,15-01-02,挺好玩的  带小孩来不错
22464554,28468861,5,0,0,0,15-01-02,人太多，地方有点小，应该好好做下维护
22464554,8655548,1,0,0,0,15-01-02  更新于01-02 19:01,对了，从微信买的票还不支持退货。好坑爹。。。地方不好找。打电话也没人接，原来都呀里面坐着。。。。维持秩序的也没有。热，乱，不值，还有臭味。
22464554,45508398,5,0,0,0,15-01-02,人无比多，里面无比热，排队时间无比长！不过凑活吧
22464554,35414137,1,0,0,0,15-01-02,蒙特么大傻子呢！一开始排大长龙，网上买票一样排，国瑞这层巨热，穿短袖都哗哗流汗。进去全是3D图，说实话一点都不3D，好坑啊，结果看星空还要排队，排了两个小时将近，越往里越热越臭！好不容易排到了，尼玛就一小黑屋，里面弄各种灯换颜色亮，周围是镜子。。。坑爹啊！！！还踩一脚水。里面有个自动售货机全都售空也没人补。你妹的推广宣传那么好，门票那么贵，里面你到弄好点啊！！千万别去！！
22464554,45378319,5,0,0,0,15-01-02,很好玩，就是人特多啊，很多3D照片
22464554,14548904,4,0,0,0,15-01-02,白天去吧真心是人很多，有那个团购的门票还可以
22464554,11527451,1,0,0,0,15-01-02,太坑爹了，放进去那么多人，根本没法拍照，无良商家
22464554,9341639,5,0,0,0,15-01-02,好玩，带女儿和老人去的，只有我花了55，他们都免费，超值
22464554,8725306,5,0,0,0,15-01-02,真的很好，一开门就进去人还成，等到我出来人更多
22464554,106708479,3,0,0,0,15-01-02,还可以吧，就是人太多又热啊，地上标着拍照的最佳地点
22464554,25676945,5,0,0,0,15-01-02,不错，不过赶上节假日人太多呀，还可以，
22464554,143860366,3,0,0,0,15-01-01,节假日去的，人太多了，最好3人以上去，方便拍照
22464554,25343745,1,0,0,0,15-01-01,这个地方真的不值不值不值不值！
22464554,9389030,3,0,0,0,15-01-01,还可以，就是人太多了，排队买票排队入场排队照相
22464554,123189143,5,0,0,0,15-01-01,人太多了建议下午五点以后去，最好别带太多东西，人多点去才有意思也好拍照。太热了，星空展就一个小屋，一般般吧
22464554,6300387,5,0,0,0,15-01-01,团购了、结果到门口没进去退票了……人太多了，队伍很长.果断放弃[汗]
22464554,6752271,1,0,0,0,15-01-01,完全完全感觉被坑。奔着星空去的，见过那么局促的星空么？在KTV看看灯吧～ 就几根儿串联小灯泡 三面镜子… 3D画也不是特别有新意，充满山寨之味。另外，容纳能力有限就控制一下每天售票数量，别光顾着圈钱好吗，顾客体验很差…
22464554,3330015,5,0,0,0,15-01-01,排队的人超级多，等了将近1个小时才进去了。人在里面都特别的兴奋，好热，不过效果还是可以的
