4668013,1811527,3,2,2,2,15-08-10,在去哪儿团购的双人票，原价40，莫名其妙减10元，哈哈，赚到。在售票处就可以换票，很方便。
4668013,645509,5,4,4,3,15-08-10,团购的门票，很多汽车，孩子玩得开心
4668013,55712505,5,4,4,4,15-08-10,很好哦。就是离有点远。。。。。
4668013,29118366,4,3,4,4,15-08-09,全是汽车，新的，旧的，好的，坏的，半天的行程。
4668013,754553636,5,4,4,4,15-08-08,展品很棒，如果是汽车爱好者，很开眼界，还有一些互动游戏，需要另外购票，展厅大，凉快
4668013,131015798,4,3,3,3,15-08-03,周末人还挺多的，都是带着小朋友来玩的，大多是男孩子，果然男孩子就是喜欢车，这个是天性吧。体验的地方都挺不错的，就是需要买票，还有挖沙子的机器，超级多人在排队
4668013,81754,5,4,4,4,15-08-03,现在汽车博物馆的周边有工地施工，路标有的看不见，不过还是比较好找的。
4668013,793578950,5,4,4,4,15-08-03,孩子们很喜欢，以后有机会还去。
4668013,108415593,3,2,2,2,15-08-02,孩子很喜欢，有机会还会再去，周边环境也不错，转完博物馆还可以在门口玩会
4668013,762896677,4,3,4,3,15-08-01  更新于08-01 19:51,很适合带孩子，有很多体验项目，公交很方便，装修设计很不错，如果能多些展车，就特别好了，
4668013,51284160,5,4,4,4,15-07-31,有停车位，地方大，孩子每一层都看得很仔细，很开心。
4668013,779574335,5,4,4,4,15-07-29,孩子很喜欢，环境非常好，还有休息的地方，到处都很干净，非常好
4668013,165026215,5,4,4,4,15-07-29,指导员很有耐心的跟我们讲解，资料也很全面，太适合带孩子去长见识了！
4668013,5922958,5,4,4,4,15-07-28,汽车博物馆真心不错，各个展馆介绍很详细，值得带着娃来
4668013,25998990,4,3,3,3,15-07-27  更新于07-27 23:43,展品丰富、环境宽敞，寓教于乐，老少咸宜，值得参观。
4668013,7036057,5,3,4,3,15-07-27,挺有意思的，很适合带孩子来。就是位置离家太远！
4668013,5774339,5,4,4,4,15-07-26,适合带孩子去玩！！！！！！！！
4668013,42814422,5,4,4,4,15-07-23,值得参观，可以带孩子来。看汽车
4668013,40208500,1,0,2,1,15-07-23,去了只觉得这就是一个骗孩子钱的地方 展品薄弱 缺乏专业性 4d电影连汽车倾侧方向都搞不清楚 也太失败了 总体评价一星 带孩子去一次不会再去
4668013,124857269,4,3,3,3,15-07-22  更新于07-22 20:10,越往高层去1，展品越好，建议从1上往下参观，适合小朋友，大部分是纺织品
4668013,981459,5,4,4,3,15-07-21,儿子钦点要看的，我和粑粑也刮目相看，人少，展品靓丽。展馆布置的大气，人也少。唯一的缺点就是地铁下来要走很久。回来的时候，不得不叫辆车送到地铁站。
4668013,1944989,2,2,2,1,15-07-21,周末带孩子去的，参观者非常少，显得特空旷。依据点评上的推荐，直接坐直梯到五楼开始参观的。五楼主要展示了一些大牌的老爷车，确实很漂亮，也恶补了一些知识。四楼基本为汽车构造的剖析，对汽车感兴趣的看了有用，对小孩子来说还是早了点，不是太能搞明白。三楼只有三个较小型的体验区，有一个体验交通标识的区域说是坏了不开放，但绕了一圈回来后发现有孩子在玩了，原来换了服务的工作人员！特别要表扬一下这位工作人员，不仅耐心地给孩子们讲解游戏规则，而且特别负责任，从进入到出来都是牵着孩子的手。另外两个免费体验区，排队要玩儿的队伍那叫一个长。其中儿童体验区的体验其实就是模拟开汽车，与好多商场内游戏机上的开汽车游戏一样，只是速度超级慢，但还是吸引了超多的孩子和家长在排队，排了近一小时才玩上。该项目的体验是受时间限制的，这也是当天目睹了一件不让排队体验的事情后才知道的。当时有一位家长带着孩子来排队，现场的工作人员态度比较恶劣地就不让她们排队，说话还挺损“就想玩不花钱的，想贪便宜就早点来，你们在这儿排也没用，不会让你们玩的。”那个带孩子来排队的家长争辩说，我们也不知道这个项目截止到四点半不让体验呀，你们也没有公示，而且现在还不到三点呢，那个穿白色工作服的工作人员不仅没给任何解释，还很蛮横，把那孩子都给吓哭了。个人感觉这里的部分工作人员的素质和服务态度有待提高，不过当天的志愿者给我感觉很好，非常热情。整个馆虽说是五层，但主要集中在三到五层，内容也不多，可看性并不强，感觉30元的门票贵了点。博物馆自身有一个不大的收费停车场，馆外的路边则为有限的免费停车位。
4668013,28454081,5,4,3,4,15-07-20,7月19日开车去的，地方很好找，这个博物馆也不错，内容丰富，总体来说属于科普性质的博物馆，相比于铁道博物馆和航空馆来说专业深度要差一些，比较适合汽车爱好者、摄影爱好者。小朋友很多，大部分都是家长带孩子来的，小男孩居多。一共五层，一层大厅好象没开（从二层往下能看到一层也有展出内容，但是关着）。这次最坑的是停车花了不少钱，来之前看大众点评上很多网友说可以免费停车，我到了地方想都没想就开进停车场了，结果在里面待了不到3个小时，出来收了我16大元停车费！免费停车可能说的是外面路边吧。
4668013,34408852,5,4,4,4,15-07-20,展品丰富了解汽车的发展趋势及其他
4668013,6099844,5,4,4,3,15-07-20  更新于07-20 13:51,可以在里面泡一天，适合大点的孩子，了解汽车发展历史，里面有快餐厅，30左右一份。
4668013,85015011,4,3,3,3,15-07-19  更新于07-19 17:13,博物馆地点有些远，环境好，坐直梯从5楼开始参观。
4668013,8961262,5,4,4,4,15-07-19,值得看，只是未来馆概念车太少。
4668013,21865444,5,3,4,4,15-07-12  更新于07-12 22:36,在这里不得不说一下四楼，第一个互动活动（给汽车上颜色）那里的穿黑色的服务员美女，我的iPhone 5S丢在汽车创造那里了，美女服务员帮助收起来了，当我急匆匆回去找的时候，主动问我丢了什么了？感谢您了，我认为在这金钱导向的中国，苹果手机丢了找不到是正常的，因为我身边已经有两个人丢了两个4S都没有找回来，只有在这里您找到了。还帮我保管好了，感谢您了，您很美，心里更美，谢谢了，由衷的感谢
4668013,4229819,5,4,4,4,15-07-12,很好的地方，就是停车不太方便哦
4668013,4809426,3,2,2,2,15-07-12  更新于07-12 10:59,9点开门，一共五层，成人票30学生票20，点评的团购两人券超级划算。先从5楼开始，从远古时代的车到现代的汽车，很多老爷车很漂亮，还有几个收费项目略坑，很多小朋友。只有3、4、5层还可以看，2楼没啥东西1楼是大厅，目测一个半小时能完事儿，带孩子可能会时间长点
4668013,121228795,5,4,4,4,15-07-10,很不错啊，工业革命的标志啊，我喜欢
4668013,7727534,5,3,4,3,15-07-10  更新于07-10 10:13,如果家有爱车的小朋友推荐去一下，理由有三：
4668013,37111310,5,4,4,4,15-07-09,好好！环境很好适合孩子去！！！
4668013,131619601,3,3,3,3,15-07-06,去的早，人不多，一上午就逛完了，男孩子喜欢的地方，推荐！三星级！
4668013,60669102,3,3,3,3,15-07-04,感觉一般、周末去人不少，知识量一般
4668013,25351450,4,4,4,3,15-07-01  更新于07-03 21:07,每年都会来一两次。去年底新增添的地面画很有些3d效果，不过貌似没有多少人注意到。
4668013,114685866,4,3,4,4,15-06-29,这个地方适合带着孩子一起去，展品还是不错的，不过个别楼层展品很少。
4668013,166343541,5,4,4,4,15-06-28,第N次来这里啦，头次写评价！他们这儿9:00开门，最好是9:30再来，要不换票排队。每次都早来，要不人一多，孩子就没法儿专注学知识啦！我家闺女三岁，可能跟同龄男孩儿不同，她还是喜欢五层的历史篇（创造馆）特别是计里古车和指南车，这真的是古代华夏文明智慧的结晶。这里不仅可以让孩子聆听到汽车工业的发展史，更能让孩子了解到各国文化、风土人情，特别是民族振兴的使命感。我觉着孩子从小就该受到这样儿的熏陶，从小培养社会责任感！跟不少家长都聊过，大家都认为国内的博物馆做成这样儿，已经很赞了！这里每层都有休息区，孩子走累了，就坐下来聊聊；饿了，就去餐厅吃点饭。这里有家汽车主题餐厅，西餐为主，孩子喜欢里面的氛围，不过最近在装修，期待重装后的模样！如果朋友来，还是建议从五层看起，可以跟着讲解听听，然后再自己参观，讲解免费而且还特生动，也有互动。我觉着参观博物馆不能走马观花，还是得细细品，相信在博物馆里长大的孩子，绝对跟在外面疯跑的不一样，会有些文化底蕴。他们这二层还有个小朋友的画展，才10岁，画的可棒了，据说这孩子就是老来这儿画画儿。
4668013,9365263,5,4,4,4,15-06-23,非常好！适合男孩子，就是地方不是很好找啊！
4668013,8119024,4,4,4,3,15-06-21,很不错，带儿子去的，里面一共五层，建议从最上面开始逛，分为创造馆，进步馆和未来馆，里面有互动，有大人和小孩的驾驶体验是免费的，也有风力的那种实体体验是收费的，里面有志愿者，有一个公交上面的假人有点恐怖，孩子小有点怕，二层有快餐，价格也不算特贵，三四十，有卖模型车的，小朋友去看看挺好的
4668013,89669274,5,4,4,4,15-06-21,小朋友很喜欢，有好多的不同的车
4668013,3893255,5,4,4,4,15-06-17,团购买的门票 60元两个大人一个小孩 交通很便利地铁就可以到达了 就是从地铁出来后要走一段路 夏天很晒很晒  里面环境很舒服 适合夏天带孩子去 工作人员会指引从五层到一层参观 里面很适合拍照 小孩子还有互动项目 需要在消费
4668013,49984529,5,4,4,4,15-06-13,带宝宝去的，个人比较推荐，很好玩，
4668013,750320709,5,3,4,4,15-06-10,一共五层，但1-2层基本啥都没有，是吃饭和卖纪念品玩具的。里面各种汽车模型，老式的居多，国外国内都有！展示了特别多的小车模，1:24的或者1:18的那种。博物馆很新颖，现代化，干净。平时去的，人超级少...走马观花的大概1小时到1个半小时就转完了。就是进门安检好严格啊，有机场安检的即视感了...
4668013,56587898,5,4,4,3,15-06-08,展品比较多，环境也不错，就是免费互动的比较少！
4668013,8579707,4,3,4,3,15-06-02,孩子还小，去了也没参观出什么来，建议小孩子可以玩的项目再多一些
4668013,43002844,5,4,4,2,15-06-01,看到不少老爷车，感觉比现代车更漂亮
4668013,1639293,3,3,3,3,15-05-24,环境不错，就是停车场一早就满了
4668013,53784195,4,3,3,3,15-05-20,带孩子来看的 孩子很喜欢 就是节假日人太多 里面空气不太好
4668013,6745897,5,4,4,4,15-05-20,人挺少的，可看的东西也不多，溜溜达达半小时足以
4668013,943020,4,3,4,1,15-05-17,喜欢汽车的去看看不错。带孩子去的，有些可以互动的，有收费项目。2层主体餐厅装修没法吃。只有4，5层不错，其他的很一般。
4668013,35825009,5,4,4,3,15-05-10,我家娃不是很感兴趣，整体不错。
4668013,9379192,4,3,3,3,15-05-10,买票兑票都方便，楼里面5层，值得一看，汽车模型很多，就是到了商品部孩子就迈不开步了，汽车主题餐厅装修了，只能吃套餐，太难吃了，还不便宜。
4668013,751900726,4,3,3,3,15-05-10,还行吧，跑了那么远没啥意思呀，不值得
4668013,4550264,3,3,3,4,15-05-08,还行吧，适合孩子。大人的话还是算了，孩子玩不错的还是！支持！
4668013,31379270,5,4,4,4,15-05-08,展品多，人太多，吃得不够丰富！
4668013,151342942,5,4,4,4,15-05-05,环境不错，干净，人不多，门票也能接受！
4668013,46233069,4,3,4,2,15-05-04,服务等于没有，环境还是那样，展品不少，介绍很单薄。
4668013,4026589,4,3,3,3,15-05-04,这里的售票处很有意思，是火车车厢，挺有创意的。一共是五层，但是一层就是服务台，从二层开始，有发展厅等几个厅，全是带着孩子来的，确实更适合小孩子看，大人去的话估计会觉得没什么意思，应该叫做少年儿童汽车博物馆吧。
4668013,20570564,5,4,4,4,15-05-03,特别好，特别适合宝宝，特别凉快
4668013,3275216,4,2,3,2,15-05-01,环境很好，展品没有想象的丰富，带小朋友去不错。
4668013,52066824,3,4,4,4,15-04-29,适合带小朋友去， 不适合情侣。。。。跟男朋友去转了一圈。 虽然他很喜欢车但是还是觉得没什么意思。。。哈哈不过环境很不错。。。推荐爸爸妈妈带着你们的宝贝们去。
4668013,5102033,3,3,2,1,15-04-27,这里适合小朋友，
4668013,9477627,4,3,3,2,15-04-25,还不错 有些拿得出手的展品 还有些很适合小朋友的寓教于乐的参与性比较强的小活动
4668013,5097051,5,4,4,4,15-04-23,宝宝很喜欢，互动体验项目很不错
4668013,129708362,3,2,2,2,15-04-21,人多，地方很大，车车不少，看看也得一天
4668013,3353262,4,3,3,3,15-04-20,位置很方便，里面空间很大，售票处很有特点，是一节真实的火车哦。里面展品以汽车工业发展史为主线，有很多互动的项目，有收费的也有免费的。用餐的话有简餐也有西式的正餐，价位丰俭随人。不过不太建议很小的宝宝来，真正适合小宝宝的项目基本没有，互动的项目也多是给大一些的孩子准备的。另外，售票处和入口的位置太隐蔽，一进大门需要往里面走一段路还得拐个弯才会看到，第一次来的人不是很好找，建议可以增加指示牌哦！
4668013,161703882,3,1,2,0,15-04-18,今天去的给我感觉里面环境还可以！陈列还可以再丰富一点！互动设施太少很多都要排队！最主要的是停车免费！我最想吐槽的是穿黑西服的工作人员的态度！跟志愿者差远了！我们从安全通道楼梯下的！没说不能走啊！非让我们从哪来回哪去！这是员工通道！后来另一个工作人员让我们过去了！我没把他拍下来！不会用服务用语！不会说人话！你们看到后开会问问今天谁在那值班就知道了！
4668013,180275033,5,3,3,3,15-04-17,讲解少，环境不错，单收费项目多。希望多些玩的。
4668013,161736327,3,2,1,2,15-04-14  更新于04-14 16:56,人很多，比较大，环境不错，开车很方便
4668013,11363500,5,4,4,4,15-04-13,在四环边上，交通方便，老爷车很有怀旧感
4668013,768614828,4,4,4,3,15-04-12,突发奇想第一次来汽车博物馆，感慨万千，太喜欢这里了，全是我的最爱，
4668013,8537989,5,4,4,4,15-04-11,环境不错，挺好玩的，人不多 ，价格也合理 ，值得再来
4668013,186562253,4,3,3,3,15-04-09,不错的地方，带孩子来这边转转还是挺好的
4668013,4804348,5,4,4,4,15-04-06,地址位置很好找哦，就在四环边上！以前路过都没发现。赶着节假日去的，人挺多的，车位很紧凑得排队等。
4668013,5048948,2,1,1,1,15-04-06,不错的地方，很多家庭带孩子来参观，售票处很有特点，在装修的火车里面，提醒男士参观不让带打火机，展品很丰富，汽车的发展史，有一些自费项目，还是值得一去的。
4668013,128684399,5,4,4,4,15-03-30,非常不错！孩子很喜欢，作为家长也感觉是大开眼界！总体感觉如果再次到北京游玩，我们还回去游览！
4668013,8394625,3,3,3,2,15-03-30,比较适合小孩，展品好多都是仿制品
4668013,1292439,2,2,2,2,15-03-29,量少贵，基本等同火车盒饭水平。另外面条还不如米饭呢
4668013,46516015,5,4,4,4,15-03-24,这个非常方便 就是人多的时候有点慢
4668013,44147118,5,4,3,4,15-03-24,去过多次了，很不错的博物馆，就是里面灯光太暗了，希望增加些互动游艺
4668013,36387728,4,2,3,2,15-03-24,和爷爷奶奶来的 他们免费 我团购的
4668013,43100337,4,3,3,3,15-03-23,饿急了跑去吃的。快餐么。所有的都是在一次性盒子里。饭能接受，日式拉面也是放在纸碗里，画风不对。。饭味道不错，别点套餐了，果汁香精的，薯饼完全不脆。。
4668013,43100337,5,3,3,3,15-03-23,团购还是蛮好的。不过团完了。发现比美团贵了两块。。你懂的。。周一不开门。开车来路边停就成了。里边五层。车有点儿，孩子来看看挺好。。看见走道都不利落的孩子车标认的倒全乎儿，挺厉害的。。
4668013,181119066,2,1,3,3,15-03-22,车太少了。。真让人失望。。那么大一块儿地儿真是浪费。。。去过别的国家的汽车博物馆 人家一整个公园儿全都是各种有收藏价值的车。。
4668013,39443600,4,3,3,3,15-03-21,从最高层看下来是对的。最上层了解汽车历史。二层可以亲身体验一些小游戏。总体不错。就是吃的太少。
4668013,13193985,5,4,4,4,15-03-19,整体满意，孩子可以玩的尽兴。超级大，大人还能会议童年。
4668013,7432377,5,4,4,4,15-03-19,3.8日女士免费 我带宝去了 卖票的地方有两辆火车展品 平时票价30元   有5层 第一层没有展品 二层以上都有精品汽车展示二层有中国的早期汽车 还有餐厅 三层有小孩免费体验的三个项目 都得排队 ，四层有花钱项目10-30元不等 得1.4米以上才可以玩 5层展示的是汽车发展史 木质车还可以自动 有辆北京早期公交车103 可以上去玩 挺好的 各楼层边上有休息区 是软座
4668013,562029,4,2,3,2,15-03-18,3·15
4668013,18155330,5,4,4,4,15-03-17,特别好，应该早点过来。这次参观的有点走马观花，我觉得可以花上2.5个小时。从古代的车，到现代的科学技术。很适合孩子科普知识的一个地方。
4668013,31414780,5,4,4,4,15-03-16,差不多俩小时能逛完，还是比较有意思的，里面小孩比较多，成年人也能回味下历史
4668013,888184,5,4,4,4,15-03-15,挺好的~~周末带孩子去玩~~还有些可以互动的环节~~
4668013,20545994,4,3,3,3,15-03-10,三八妇女节女同胞们凭身份证免费参观 不过30元的票价的确有点高 浏览顺序为从上到下 分别展示了汽车的历史中国汽车历史 现在 和展望未来 最吸引人的还是各种外国车模 楼下的红旗轿车也极其漂亮 不足的是互动展区 说白了就是游戏厅里的赛车 十块钱一个崩儿 都没什么意思 带孩子的排大长队  嗯 院内免费停车 二楼有卖盒饭的
4668013,29286717,2,1,1,1,15-03-09,汽车博物馆里唯一的快餐厅，挺好找的，座位也不少，价格还能接受，量不大，味道一般。都是用的一次性的餐具。
4668013,29286717,3,3,2,2,15-03-08,3.8妇女节对女士免费，直接领门票就可以参观。去过四次了，孩子很喜欢。里面有不同的车，从最开始的老爷车到面的、也有豪车，还有可以互动的体验区，孩子每次去都很开心。这次去距离上次也就三个月，但里面明显又有了变化，新开了玩具的体验区，孩子玩的不亦乐乎啊！这次里面新来了很多志愿者，在里面讲解挺不错的。但也有个别的志愿者占了一排的座位在睡觉，旁边的人都没法坐，讲解很辛苦能理解，但这样有损形象啊！尤其是旁边还有外国友人，希望能注意点。
4668013,50212111,5,4,4,3,15-03-08,非常好玩，了解汽车发展史并且真车展览，展览馆的设计也非常好，像一个大的汽车工厂。妇女节女士免费参观哦！哈哈！
4668013,3419170,4,3,3,3,15-03-08,经常路过，第一次进去，展馆共五层，可以全面了解从古至今的车，适合带着小朋友来玩，特别是男孩子。
4668013,57312377,3,2,2,2,15-03-05,正月十五去这个博物馆也是醉了~
4668013,42426635,5,4,4,4,15-03-04,小孩子非常喜欢，环境好，展品多，免费体验区很受欢迎
4668013,7575453,5,4,4,4,15-03-04,一共5层 三层有儿童体验区 家有男孩的适合去那看看，2个小时就能转完，服务态度都超级好 坐地铁去穿过人行天桥就能到 网购才20
4668013,2792384,3,2,2,3,15-03-02,怪不得火不起来，内容不丰富，而且展示方式比较枯燥，不吸引人，就靠老爷车提高档次了
4668013,4963586,5,4,4,4,15-02-27,很喜欢这里，儿子在这里玩儿的很开心。也可以学到知识
4668013,755697832,5,4,4,4,15-02-27,比较酷 展示了汽车发展的历史 老少皆宜 而且人并不多 有些设施坏掉了 大多数展览馆的互动设施多少都有损坏 熊孩子的素质有待提高啊 人很少 喜欢静的人可以去 我和男朋友情人节游玩地点 哈哈…
4668013,32869875,2,1,1,1,15-02-26,离家不远，又是个汽车爱好者，一直想看，阴差阳错拖到现在才去成。。。说正题，刚看到售票处觉得不错，是个老式火车改的比较有特点，可进去一看大失所望，虽说分了未来馆。。。每层一个主意，可水平吗？也就是哄小孩子玩玩的地方。总之非常失望。带小孩玩玩还行
4668013,135763518,4,4,4,4,15-02-23,带孩子玩，好去处，人不多，长知识，免费游玩体验很多，小志愿者负责认真，卖票地点很有特点，孩子学到很多
4668013,67269,5,4,4,4,15-02-20,整体而言，汽车博物馆是我们在北京去过的最为现代化的，环境和设计最人性化，综合体验最好的博物馆。它位于南四环路边，交通很方便，而且参观的人也不算太多。馆外的售票处设计成了一列火车，从售票到寄存物品都在火车上。馆内五层，其中二层到五层是展览区，个人最喜欢第五层，讲述的是汽车的发展史，除了实物车之外，还有很多精致的汽车模型，做的非常好。至于孩子们，可能会喜欢四层的儿童游乐区，唯一的遗憾是排队的孩子有点多，我们等不及了，不过在三层还有一处遥控车，4个孩子一组，每次三分钟，排队的人尚可，而且为了让家长不无聊，工作人员还会给上智力测试的小卡片，很有意思。纪念品店在二楼，不像有些博物馆的纪念品店，这里出售的商品价格公道，质量也很好。以后会常去的。
4668013,2407323,4,3,3,3,15-02-17,和孩子一起去的，儿子喜欢，总体感觉不错，还会再去
4668013,2025114,4,4,3,3,15-02-14,展品很丰富，休息区超好，活动也很多，就是卫生间太小了。
4668013,720438143,4,4,3,3,15-02-11,里面有四五层，每一层都是一个主题，对汽车感兴趣的朋友和小朋友可以去，里面有很多小朋友可以玩和学习的
4668013,39151854,5,4,4,4,15-02-09,整体不错，就是换票排队时间有点长。
4668013,385934,5,4,4,4,15-02-06,团购的亲子票，换票的地方在大门的东侧，是在火车里哟！展馆的环境非常好，展品也很漂亮，服务热情。希望多增加体验的项目，每个体验项目都要拍好长的队伍。
4668013,2692753,3,2,2,1,15-02-05,教科书民族，也就是铺文字和搞陈列，除了那些名车，就是按比例缩小的车模占大头，投影仪的效果很差，互动的感觉技术含量很低，五层还有看头，其他几层更像赞助商陈列，比较适合4岁以上孩子去，工作日去，很多互动体验都没有开，供孩子玩的新颖玩意几乎没有，更像换了个场景玩电脑游戏……西餐厅价格很高大上，外面的快餐厅饮料是勾兑的……购物区东西价格亲民的少，还不如去小商品市场玩具摊上的种类全，也就这样吧，走马观花。
4668013,1640136,3,1,3,3,15-02-01,一派高大上的硬件设施，一副官老爷的做派！展览的所有方程式赛车都是假的模型，科普知识生硬无趣，真对不起那么好的场馆！工作人员态度冷淡恐怖，拿着扩音器向你喊，在空空的一层大厅吓得孩子往怀里扎！亲啊，您能把扩音喇叭关小点声吗？
4668013,14646948,4,3,3,3,15-02-01,里面很大很有特色各式各样的车都有，值得一去
4668013,190976677,4,3,3,2,15-01-30,很不错的科学教育基地。只是有点偏
4668013,3395537,4,3,3,3,15-01-30,很不错，会再去的，团购票很方便
4668013,26551781,5,4,4,4,15-01-29,儿子很喜欢里面的汽车足足逛了半天，对每个汽车都很感兴趣，对互动节目也很感兴趣，就是每个互动人都有点多，平时人少
4668013,1637111,2,1,1,1,15-01-29,娃三岁多，带着去的，比较无聊，不太适合小朋友去，大点估计还行，位置不是很好找，停车还算方便
4668013,5409965,4,3,3,3,15-01-28,一共五层：
4668013,4022019,3,0,0,0,15-01-27,全是假车…大众投了太多钱，一层都是
4668013,17576687,5,4,4,4,15-01-26,经常去，孩子很喜欢，这周还玩免费轨道赛车
4668013,29255796,5,4,4,4,15-01-25,给父母订的票，他们去看的。应该还不错，就是博物馆这些
