23216161,15078085,4,4,3,3,11-17,已经去过好几次了 每年有珠宝展都会到国展去转转 展馆位置还算便利 虽然是老馆 但设施没觉得很陈旧 今年的展会比去年的规模要大 馆厅很多 基本上展位都满了 展会安保工作做的还不错 没有车证不能进去展会内部停车场 所有车辆都要经过安检才能进去
23216161,1044614,4,3,3,2,11-07,东北三环角上的这个中国国际展览中心老馆，其实也不老，与北京展览馆相比，算是很新的建筑了，但是因为近30年来北京展馆建筑实在太快，于是变成了老馆，最大的问题就是服务和配套维护跟不上，承担的一些展会感觉也不算一流的。应该说，还有许多潜力可挖。
23216161,29046890,3,2,2,2,10-17,“中国国际中心老馆”是北京市一家历史蛮长的展馆；展馆面积有限，承接的都是一些专业性展览，规模不大，但位置好，就在三元桥内，进出都很方便！
23216161,120293604,4,4,4,4,06-27,2016中国国际餐饮食品饮料交易博览会6月25日-27日在中国国际展览中心老馆举办。展出面积一万二千平方米。参展单位二百六十余家，展出内容包括国内外食品食材与酒水饮料，休闲食品，调味品和各种餐具设备用品。
23216161,8144314,5,4,4,4,06-22,中国国际展览中心拥有14个常设展馆（包括A、B馆及二层）；
23216161,42089180,3,2,3,2,06-21,6月16日去北京参加了2016年第五届中国国防装备展览会，因为工作客户涉及到部队这块，有这个展览就跟同事一起过来参观学习了，门外有卖门票的，五块钱一张，网上的信息不怎么准确，说是九点开始，九点半去了不让进，正巧赶上开幕仪式，一些退休的都不是在职的军官。展会内容跟网上介绍的也不是十分一致，办公自动化设备很少，由于是菜鸟之前都没接触过，也是看什么都新鲜，1-5是可以参观的，1馆面积大一些也比较新一些，中午吃饭就是门外的吉野家，过天桥到马路对面就是，还挺方便的，下火车坐地铁过来的，走的也挺远。
23216161,47356771,1,3,3,0,05-22,19-22号科博会！我们最后一天去的，去的有点晚了，门口保安告诉我们还有一小时闭馆，没证不让进，我们大老远跑去总不能白去吧？保安小声说：“你给两盒烟钱我让他们放您进去，里面不单收门票，要是有拦你们的，你就说找我们保安部队长，姓魏还是什么忘了！”开始要30，我门大老远来了不看看也不甘心，就说给20，他还不敢明着要，走到驾驶位这边才伸手拿...挺好一个科博会一进门让这个渣保安恶心死了……回家想一下，这孙子比路边停车收费还黑！
23216161,5395887,5,4,4,4,05-01,"中国国际展览中心老国展，就在朝阳区 北三环东路6号,这里总是有各种各样的展览，就看你对什么方面感兴趣了。"
23216161,876803652,5,4,4,4,04-23,【位置】三元西桥那边，做300在静安庄下车就行，占地面积大，门口巨多人，好像都是微信扫码换票的
23216161,876845490,5,4,4,4,04-21,老馆在三元西桥附近，静安庄车站下车后还要走很久，门口可以微信扫码获得门票，去的时候赶上照明展览，整个一层都是照明的展览，地方挺大的，参观了几个展厅，展位摆放的都是各家的当家产品，看了很多展品还真不错，东西多，规划摊位也整齐，没想到照明一直以来就觉得是灯而已，但其实照明行业的高科技发展也一直存在，并且很迅速，不少外国友人也在进行参观，还是很值得一看的！
23216161,38124396,5,4,4,4,04-20,来这边办理展会，烹饪齐全，做甜点，香喷喷
23216161,1458339,4,3,3,3,04-04,老国展还是第一次来，这次是参加文玩展览会。
23216161,832033,5,3,3,3,03-23,每年有很多不同类型和专业的展览会，国际礼品展我每年都去，还有一些自动化啊，机械化的展览，希望多好搞一些关于食品咖啡酒业的展览好吗？
23216161,5950762,2,0,0,0,03-17,头两周的时候，陪朋友去找工作来着。门票十元，循环使用~
23216161,34703893,5,0,0,0,03-17  更新于16-03-17 19:23,北京人都知道，中国国际展览中心老国展，就在朝阳区 北三环东路6号，也就是在静安庄附近。
23216161,21802632,4,0,0,0,15-12-20,中国国际展览中心（老馆）在静安庄附近，也是历经沧桑的老展览中心了，每年还是有很多展览会选择在这里举办，比如每年的国际信息通信展览会。展览馆一共有8个馆，中间的1号馆是主展馆，去参加通信展，感到这里的安保措施还是比较完善的，进门前先要根据邀请卡领取参观证，才能根据参观证的二维码扫描进馆，门口也有比较完善的安保措施，从一个hall出来去另一个同样要刷二维码。展览除了一些运营商，还有国内的一些知名厂家参与，专业人员可以进行技术交流，普通大众也可以去了解一下近期前言的通信技术和相关的产品，现场也组织了一些知识普及和抽奖的小活动，蛮有意思的。
23216161,33986812,4,0,0,0,15-12-06,来这里参加招聘会，坐车到静安庄站，下车跟着大部队走到国展正门。凭有效证件免费换票，进入需要安检，拿了招聘信息的报纸就开始投简历啦。此次招聘会共分为5个馆，都逛下来需要一天，中午有卖盒饭的。据说是本年度规模最大的招聘会，人挺多的，投简历排队，上厕所也要排队！
23216161,5507615,4,0,0,0,15-12-04,北三环的老国展，挨着的家乐福也跟着沾光，水跟着多卖了不少。
23216161,26057349,5,0,0,0,15-11-28,专门过来看珠宝展的，28号到4号吧，整整一周，可以在网上免费报名，拿着二维码验证就可以，特别方便。现场也可以扫码拿着自己的证件去办。当然也有各种黄牛卖票的，也很便宜，十元一个。
23216161,129830540,5,0,0,0,15-11-28,今天来到北京国际展览中心老馆，位于北京市朝阳区北三环东路六号的展馆，这里正在举办中国国际珠宝展，每年都有的珠宝展销会，很壮观，能看到全国各地的珠宝展品，而且都是当下最流行的珠宝饰品，以批发珠宝原料为主，也有现货新货对外给消费者购买，这里的珠宝保真，我每年都会来这里看看，有好东西都会来购买，我是这家北京慕妮爱莎珠宝首饰有限公司的常年回头客了，他家东西真不错！
23216161,142130978,5,0,0,0,15-11-07,专程来看文博会的，大早上10点多来的，先凭身份证领门票，刷票安检过后再填问卷领观众证，场馆真的挺大的，有好几个馆，234馆是连着的，有各种展览，古玩文房字画，区域，旅游，新闻，台湾之类的，下午4:30就闭馆了，保安在门口拦着只让出不让进，有些卖的东西挺有趣的，不过挺贵的我没买，吃的种类好多，我还吃了吴裕泰的冰激凌，还有三元梅园和老北京小吃卖，总之下次还会来看展览的。
23216161,1711090,5,0,0,0,15-11-01,在没有顺义天竺新馆的时候，大多数含金量高的展览都在这里，这次赶上第十届中国北京国际文化创意产业博览会，真心是不错，一共八个馆，要想都仔细的看看估计得一天的时间！
23216161,19462050,4,0,0,0,15-05-11,很多展会都在这里举行，还可以吧，地方很大很多馆
23216161,5853791,5,0,0,0,14-12-06,来这儿参加母婴博览会，人很多阿，领票挺顺利，看着比较多但是排一会也就到了，进去之后会有两道检票，展厅挺大的，也不会觉得特别拥挤。
23216161,51927045,4,0,0,0,14-11-10,经常过去看展，就是暖气给的太足，冬天穿大衣没地方存
23216161,115863531,4,0,0,0,14-11-02,老牌展览馆了，紧三环路边。平常展览人挺多，不过，如果遇见汽车展，或者人才交流会。那才叫人山人海。直接影响周边交通。几年前，政府为减轻其压力。在顺义又修建一个。已开放了。
23216161,46348097,4,0,0,0,14-10-30,经常有展览，就是不好停车，有展览的时候门口会有黄牛票
23216161,7297305,4,0,0,0,14-09-23,肯定比那个新馆好，旁边的家乐福是中国第一家。
23216161,35350833,3,0,0,0,14-09-12,来这里参加展会的！位置比较方便，附近吃的也不少！
23216161,20698618,3,0,0,0,14-09-07,其实一直很好奇这个地方，不论是老国展还是在顺义天竺的新国展。
23216161,6606838,5,0,0,0,14-09-01  更新于09-01 21:22,离家近，不定期有免费的展可以去逛逛，周边设施也很全，挨着家乐福，还有餐饮很丰富，逛完展还可以有地方吃饭什么的。前段时间去看了国际咖啡展，就是换喝上厕所需要排队，其他还好
23216161,29515220,5,0,0,0,14-08-18,定期有免费展览，赶上了国际咖啡展的尾巴，感觉确实不错。
23216161,3840610,3,0,0,0,14-08-12,去老国展参观了国际咖啡展，展会办的不错，唯一吐槽的是厕所，竟然排了那么长的队。就不以改造一下吗？
23216161,36034180,5,0,0,0,14-08-11,经常路过，也看过几次展览，上周五去看的咖啡展。
23216161,2396996,4,0,0,0,14-08-11,8月8日-10日有免费的咖啡展览，咖啡爱好者必须的去啊！
23216161,8316560,5,0,0,0,14-08-10  更新于08-10 17:14,今天去看国际咖啡展览，感觉还是很不错很开心的。场馆安排很有序，虽然人不少，但是也没有让人觉得挤得不舒服，安排的清清楚楚的，有很多大牌的咖啡店比如caffebene\caffe bros等等都有各自非常有特色的展台。现场有很多摊位提供试喝的咖啡，饮料，还有可以试吃的冰沙，酸奶冰淇淋，华夫饼，小蜜饯之类，呃，害得我都忘记我要减肥这档子事儿来了。而且有些产品的确很便宜，比如买的挂袋咖啡，平时在京东上面买估计32-38可以买10袋，今天买就是10元5袋另外还送2袋，我一口气买了40块钱的，可以开开心心喝一段时间了。现场卖的1元一只的甜筒味道也不错，还有3元一只的酸奶冰淇淋也很好吃。现场还有展示怎么做咖啡的，做咖啡的小哥很帅，有一点点韩版帅哥的感觉，嗯，可以说有那么一点点都教授的神韵。现场做了肉桂薄荷拿铁，好喝到不行，以后一定去他们的家店里喝。感觉现场最大的不足就是厕所比较紧张，尤其适合女厕所，排队就能排20多分钟，别的感觉都挺好的，很开心的经历。另外我居然还在这里买了两瓶啤酒，也是觉得太便宜了，不买太可惜了，但是对于啤酒君为啥会出现在咖啡展上表示强烈的不理解。另外对于场馆里面有些摊位表示一下不高兴，卖的苏打水太贵了，而且里面也没有给我放金橘，而且味道还不好喝，还不如别人免费送的好喝，还需要15人民币，表示这是对观众的不负责任。
23216161,21125440,4,0,0,0,14-08-09,不错不错，总体来说感觉还算是五脏俱全，从进门领胸卡到看展过程再到出门的过程都很顺利，工作人员的引导也都做得还比较到位，安检速度也还蛮快，算是一次很好的观展体验。
23216161,1842172,3,0,0,0,14-07-30,前段时间去看珠宝展 好多东西都好漂亮 当然价格也很漂亮 哈哈 地方很大 转一圈下来都要不少时间
23216161,36246416,2,0,0,0,14-07-14,去过多次的老馆了。现在通地铁后，方便了不少。周围非常堵车，开车或者打车都是很痛苦的。一到有展览，外地的朋友就会麻烦订房，一下就能感知到周围的房间价格应声飞涨。外围的感觉还好，就是有点老旧，走进展馆，空气不好，脏乱不堪，管理者除了收费基本不作为，楼梯设计的那让无语，而要找个座位休息一下，非常艰难。要不是依托着行政的支持，早应该倒闭了。
23216161,31995020,4,0,0,0,14-07-02,第一次到国际展览中心看展览，
23216161,2599996,4,0,0,0,14-06-21,去过几次看，除了有活动其他的没有什么感觉，向来不爱看展览。去的这次是轻工出版社的美食新图书推介会，徐铁人和潘潘等人到场，追随之。
23216161,52728031,4,0,0,0,14-06-09,这是第一次来看展览会，以前也不知道呀。这种国防与信息化的展览会一般还真是不大关注，刚好实习的公司的有名额，就过来瞅瞅。展览的地方绝对高端大气上档次啊，展馆很多，有七八个，从第一个一直转到最后一个，展览的东西涵盖生活的方方面面，技术性不强，主要是一些成型的产品，当然，如果不是内行，就是看看产品的形状和功能吧。有些地方还送礼品，哈哈。
23216161,26756769,4,0,0,0,14-04-14,昨天有珠宝展 于是过来看看 挨着家乐福 停车场在对面 旁边还有肯德基什么的快餐 可以买点吃的东西进去就不出来了 里面挺热的 不过也有卖盒饭的
23216161,756153,2,0,0,0,14-04-13,印象中大概来过两次吧，最近的一次是过来看一个展览，展馆里面有点老旧了。
23216161,31757682,4,0,0,0,14-04-04,来这里参加了国际婚纱及摄影器材博览会和国际宠物用品展览会，地方很大，人很多呀，一圈转下来得三个小时，很不错的展览，希望下次还能来
23216161,154011,3,0,0,0,14-03-16,#春季礼品展#展位安排的很乱，本来看新闻里介绍，以为会看到不少创意产品，到现场有点失望了。
23216161,1226792,3,0,0,0,14-03-13,老场馆了，现在已经不会再在这里举办什么高大上的展览了，基本上全都是到新馆去了。也难怪，那边在地理位置上绝对有得天独厚的优势，起码停车位充足啊不会发生剐蹭，这边的老馆虽然位处三环边儿上，但是忒堵车了，门口就一个窄窄的车道，还经常混合周边的居民，就差推着车走了，太刺激太危险~~~~~停车位更是极其有限，其实就算有地儿停车也开不出来，所以最方便过来的方式还是腿着，环保又锻炼~~~~~
23216161,4347237,3,0,0,0,14-01-31,参加图书订货会，里面面积还是不小的，因为是老展馆了，当然不如新的宏大，但是还是不错的。
23216161,2305628,3,0,0,0,14-01-13,来这儿参加展会，
23216161,5792169,4,0,0,0,13-12-21,来这里看过头几届的北京国际汽车展，当时还挺热衷于看展览的，现在就对汽车展一般般啦。地理位置不错，就是太堵，所以得搬家到天竺啊。
23216161,35778294,4,0,0,0,13-12-13,挺好的展览中心  地理空间很广阔  貌似有8个场馆   附近紧邻家乐福超市  很方便
23216161,2412300,3,0,0,0,13-12-07,来这里参加过不少次展会，展厅和会场时间都比较久了，相较而言使用大型设备不是特别方便，而且展厅的一些工作人员比较。。。比较油滑，如果想要尽快进场和撤场跟他们联系时，时常要连请带央求好几次，而且有时他们还会主动索要一些小礼品什么的。
23216161,15158667,3,0,0,0,13-12-06,之前公司去这里参加珠宝展.
23216161,27813545,5,0,0,0,13-11-24,展馆优质，周边设施齐全，交通便捷，低调奢华有内涵！♪───Ｏ（≧∇≦）Ｏ────♪
23216161,2293064,4,0,0,0,13-11-13,自从有了新国展后，来这里相对就少了些，但每次来都有每次不一样的收获。
23216161,26531239,5,0,0,0,13-11-10,昨天去看了文博会，就第一次到了国际展览中心。展馆很大，好几栋楼，里面场地也都够用。就是部分设施觉得有些老化，建议改善。地理位置不错，周边很繁华
23216161,5272880,3,0,0,0,13-09-27,老的会展中心了，经常举办各类型展会。车展，画展；‘工程车辆展，通信展等
23216161,3083845,3,0,0,0,13-09-27,国际信息通信展览会参展，安保还像模像样的
23216161,38521252,5,0,0,0,13-09-17,原来参加过几次招聘会，虽然没成，但是还是觉得那里有很多的活动可以参与
23216161,14988223,4,0,0,0,13-09-13,参加会展第一次进去，内部还不错，挺大，国外的展台要比国内的精致。离吃饭的地方也近
23216161,8858675,4,0,0,0,13-08-10,设施比较老了，位置不错。服务也还可以。停车不免费。边上吃东西的馆子不少
23216161,25740665,4,0,0,0,13-08-10,刚刚去看的咖啡展，主展厅的沉香。原来上学的时候年年来看乐器展，是最熟悉的展览馆，但是停车位完全没有，路边超级贵15块一小时。
23216161,2198832,3,0,0,0,13-03-23,来参加CCBN，展馆很大，慢慢逛可以逛个一天。
23216161,30246982,3,0,0,0,12-12-12,好老的一个展馆，我们是今年4月份去参展的，里面设施很旧了。展馆里到处都是支撑住，挡住展位的视线的说~
23216161,4754668,4,0,0,0,12-11-02,挺大规模的建筑，环境好，对会场的要求也是非常的严格，这点还是很有中国范儿的呵呵
23216161,6573866,5,0,0,0,12-10-24,老 且 经典。
23216161,4038594,4,0,0,0,12-09-13,参加家博会来老国展的，  现在新国展开业了，老国展貌似就没太多的展会了。 门票是提前在网上申请的，不仅免费，还给我寄来了礼品券，可以免费领一套刀具的，因为小弟刚买了房子了，所以和媳妇儿提前过来踩踩点，看看现在装修、家居市场的行情和动态，就当提前热身一下啦。
23216161,15041459,4,0,0,0,12-09-11,展馆旁边紧挨着家乐福，客流和人气很旺，地理位置虽然也不错，但是如果是做公交车来，无论从前一站或是后一站哪站下，都要步行一段路程，展馆门口附近没有公交站牌。这样也有好处就是可以很大程度上减少展馆前的拥挤度，保持更好的秩序。展馆门前的广场面积也不小，气候好的季节，广场内也会有展位，横幅标语氢气球什么的都很大很醒目，可以更好的吸引过往路人的目光。展厅内高大宽敞明亮，无论赶上何种类型的展览都非常有特色风格，这里是开阔眼界、体味新鲜又不乏休闲娱乐的好去处之一。
23216161,5632615,4,0,0,0,12-08-14,参加过几次组织的国际礼品展的展览，国展离家乐福比较近。展厅很多，空间也很大。每次参加的时候都是小有收获，有吃的用的玩的，如果看上眼的还能直接从厂家代理以比较便宜的价格拿下。
23216161,5691947,4,0,0,0,12-07-26,中国体育文化博览会的时候去了一次，感觉不错，里面空间很大，居然还有休息娱乐区，而且宽敞明亮，颇有富丽堂皇的感觉
23216161,14650406,4,0,0,0,12-05-01,位置就在家乐福旁边，非常好找
23216161,8867988,4,0,0,0,12-03-17,各种展览的举办地点~ 
23216161,3976084,4,0,0,0,12-02-16,很大的一个展览中心，有好几个展馆，经常有大型的综合招聘会在这举行，去过好几次，都是要门票的。去年还在这参加过一次金博会，规模很大。
23216161,6042853,5,0,0,0,12-01-14,面积很大，经常举办发行展览，在新国展建好前承担了很重要的作用。
23216161,4648257,4,0,0,0,11-11-13,外面看起来有点旧了～而且像个工厂～蛮大的，有很多区域～里面的设施倒还好～是来看文化创意产业博览会的～第一次来～印象还可以～还买了点东西。跟赶集似的。呵呵。
23216161,4767355,4,0,0,0,11-08-23,在birtv，太阳晒不太好，真心满旧了，我们在7号馆。
23216161,11537532,4,0,0,0,11-08-14,去参加过好几次书展，这个中心的面积超大，是京城四大展会中最大的，所以规模也很大，人气超旺。每次书展都能吸引来自全国各地的出版社和图书公司。更有港澳台地区的出版商参展，是图书界的一大盛会。现在在顺义的新馆也已经开馆，还举办了2年一届的北京车展，呵呵！下次再去。
23216161,741363,4,0,0,0,11-07-22,其实场馆很旧了，但是离家近我就觉得开心，比新国展的优势就在这
23216161,4407974,4,0,0,0,11-07-15,以前公司在国展里面，还不错啊，1号馆四层有一个大大的食堂，还有咖啡厅。。。附近吃的也挺多的。
23216161,4475950,4,0,0,0,11-07-06,老国展非常好。常年办一些不要门票的展览，服务广大人民群众。我去了这里的通信展。从手机到平板电脑，在到电纸书，从软件到硬件光线、集成电路、芯片什么的。我想说的是，自主创新很重要。不要说汉王出了一个电纸书，大家就争相去做电纸书；不要说苹果出了一个ipad，三星、酷派神马的就马上把手机换成大屏幕。不要说苹果有一个ibook，你们那些山寨软件就都有个什么book，连界面都是ibook的。哎。。。不说了，桑心。。。
23216161,3596083,4,0,0,0,11-07-06,这里经常举办不同的展会，招聘会、产品展、洽谈会等，展厅挺多的，好像分ABCDE。。。好几个展厅，空调不太好，夏天的时候有点热，而且卫生间的卫生也比较差。
23216161,7728098,1,0,0,0,11-05-25,国展不错，国展里的工作人员“更不错”····为啥给一星····话说·····你国展里面的工作人员太不把别人当人看了，最起码的尊重意识都没有！
23216161,3974049,4,0,0,0,11-05-24,有年头了，建筑很陈旧了，而且边上没有发展的空间了；
23216161,4967731,4,0,0,0,11-05-18,大大大，国展真大，好几个场馆。
23216161,4046610,3,0,0,0,11-05-02,感觉这里平时就是找工作的地方
23216161,2812791,4,0,0,0,11-04-18,每年三月底四月初都要去北京参加面料展，门口安检很严格，男人进入还要严格，需要检查身上十分带打火机，不过我觉得只检查男人身上十分带火机有所欠妥，呵呵，女人还该贴身检查。
23216161,6371511,4,0,0,0,11-04-13,在我家门前矗立很多年了，小时候奶奶老是带我进去领东西，各种的笔啊本啊，还有小玩意儿，挺大的，馆很多的，现在就很久没进去了，每次开展览总是很多人很多车，很拥堵！
23216161,6918274,4,0,0,0,11-04-08,几乎每次来此都是因为车展，一到这时候门外就会巨堵，车也很不好停，一定要在周边转来转去，看到有开走的车赶紧停进去，对面的停车场太小了，还有去家乐福购物的也要停啊。里边的展厅很大，但给我印象最深的就是人挤人。现在的新国展凡是有车展还是人多无比。
23216161,8258347,4,0,0,0,11-04-08,以前姥姥家就住国展后门那里，小时候真是没少去，那时候只要一有展览那条街就堵车，看到有展览了就进去溜达溜达，现在反而去的少了
23216161,2455202,4,0,0,0,11-03-24,这地方印象太深，去了多少次了自己也记不清了。看的最多的就是国际汽车展览，每次去都得被挤得够呛，那时候很多外来的东西比较少见，互联网还没有现在这么发达。为了一张奔驰车的招贴画得排很长时间的队，在新馆开之前这里应该就是最好的展出场地了。那时候还觉得地方挺大的，只要一有展览这一带的交通就陷入紧张状态，堵的厉害。有一次去看一个体育用品展，还看见袁伟民了。后来慢慢的觉得展览馆的设施越来越陈旧，管理上倒是不错，只是没什么卖吃的东西的地方。
23216161,7664486,4,0,0,0,11-03-24,国展经常会举办招聘会，收费的免费的都有，我觉得这个活动办得好，现在找工作的人特别多啊，国展旁边还有个家乐福，还可以顺道买些东西，是在不错。
23216161,6135273,4,0,0,0,11-03-24,这地方还是经常有展览的...挺好的...
23216161,1790262,4,0,0,0,11-03-23,"经常举办一些展会,两年前参加过招聘会,最近经常去看得就是安防展,通讯展,网络展和广播电视展.是个学习和观看的机会,印象最深刻的是科博会."
23216161,4688608,3,0,0,0,11-03-23,老国展地段比较好，去起来也方便~还是很喜欢的，北京人比较习惯这里吧~熟门熟路~
23216161,1591926,3,0,0,0,11-02-04,正好去家乐福赶上看到国际展览中心有展览，用身份证换了2张票就进去了
23216161,4791308,4,0,0,0,11-01-10,某种程度上来讲，老国展相当大的程度上阻碍了北三环的交通，堵车不是没有原因的。只要是展览的时候，上班的路程总是比较艰难。有了新国展之后，希望展览全都改那边去！哈哈哈~
23216161,2285936,4,0,0,0,10-11-23,姥姥家就在这旁边，经常收到各种展览、展销会的门票。
23216161,1838149,4,0,0,0,10-11-22,老国展去过几次，都是看文博会。
