19827981,763654221,5,0,0,0,15-04-27,不错 挺有意思的 就是有的指定的照相地点照出来的效果不如自己找的角度 希望改进 有的图片场景太小
19827981,79913181,5,0,0,0,15-04-26,很好玩，就是人少了，总需要找人帮我们两个照相。
19827981,23514342,5,0,0,0,15-04-26,晚上来人少，效果好，孩子也很喜欢
19827981,196435378,5,0,0,0,15-04-25,非常不错，玩的很开心，非常非常棒的一家店
19827981,34924584,4,0,0,0,15-04-24,周六上午去的，人不多，方便拍照，拍出来的照片还挺有意思的。
19827981,762071419,5,0,0,0,15-04-23,很模糊很神奇的体验，吃惊与这些
19827981,14382080,4,0,0,0,15-04-23,还是挺好玩儿的，拍下来一圈的确是个体力活儿，适合家人朋友一起去玩儿~
19827981,36636143,5,0,0,0,15-04-20,内容很丰富，孩子玩的很高兴，值得下次再来哟
19827981,14437368,5,0,0,0,15-04-19,虽然不是很大，和姐妹们也依然玩的很开心，有团购时去的，值得一去！
19827981,22934888,5,0,0,0,15-04-18,和宝贝去的，很好玩，一共三层，最好三人行，要不有些场景就直接穿帮了
19827981,39707793,5,0,0,0,15-04-16,第一次来3的就来这边。感觉很全。人也特别的好。嗯。标示也都很到位好评！
19827981,756971577,5,0,0,0,15-04-15,好久没去了，今天一大早约了朋友一块去，好多人排队不过因为喜欢所以愿意等，这是第二次去，真心很喜欢里面的东东，总之和朋友一起玩的非常高兴
19827981,758395225,5,0,0,0,15-04-15,还不错，就是有点小~~不过很适合带小孩儿去玩还有情侣去最好再带一两个朋友，不然好几个地是需要别人帮忙拍的
19827981,7196718,5,0,0,0,15-04-14,很好玩！离杜莎夫人馆不远.        下次可以再来.
19827981,44449986,4,0,0,0,15-04-13,挺适合两人以上去  主要是拍照  一些场景做的确实很赞  一些需要后期维护下了  比如超人那个玻璃实在该擦擦了  太影响效果了  整体照得挺嗨的  希望再多加点场景
19827981,19515119,5,0,0,0,15-04-12,不错不错 强烈推荐 以后还会来的 工作人员态度不错
19827981,440414799,5,0,0,0,15-04-11,还不错…第一次来，感觉还比较有趣，再多一些就更好啦～
19827981,14019067,5,0,0,0,15-04-10,还算挺好玩的，再多一些就好了！！！！
19827981,5489577,5,0,0,0,15-04-10,挺好玩滴，来前门玩的可以过来团购下。有些比较高难度哦……
19827981,118380756,5,0,0,0,15-04-10,非常好！里面背景特别真实，像真的一样！！！赞\(≧▽≦)/
19827981,4214925,5,0,0,0,15-04-08,很有意思～可以玩儿很久～~~~
19827981,40185963,3,0,0,0,15-04-08,一般，比较贵，没什么人的话可以玩一会
19827981,56086932,4,0,0,0,15-04-07,哈哈哈哈还好吧哈哈哈哈有点坑～～
19827981,29286717,3,0,0,0,15-04-06,位置好找，步行街里肯德基斜对面就是。不是很大，有三层。
19827981,19958473,5,0,0,0,15-04-06,早上9:30到的，已经有20多人在排队了。地点是在大栅栏步行街的南头，肯德基的斜对面。挺好玩的，孩子拍了一小时出来的。大众点评的免费体验，工作人员说没相纸了，就是有要出图片也要另付费。
19827981,114844181,4,0,0,0,15-04-05,还可以的，拍照可以去，但不会再去第二次
19827981,17393768,5,0,0,0,15-04-02,太棒了，早上去的都没有人，两个人照high了，太好玩了！！！
19827981,26112379,5,0,0,0,15-04-01,地方不大，挺好玩儿的，没去过的挺新鲜
19827981,9190163,5,0,0,0,15-03-31,挺好玩的，和老婆两个人一起玩得蛮开心的！
19827981,50333673,4,0,0,0,15-03-29,总体来说还不错，一大早过去的，人不算多，照相真是个技术活，哈哈，两个人去得，感觉人多一点比较好，因为有些还是需要两个人或者多个配合比较更有意思，反正玩的很开心，不错。
19827981,122339017,5,0,0,0,15-03-28,地方虽然很小，但是孩子玩的很好
19827981,61691083,5,0,0,0,15-03-27  更新于03-27 17:48,还可以，跟国瑞的差不多，不知道是不是没有逛全，感觉没有店员说的那么多场景
19827981,22601549,4,0,0,0,15-03-26,很有意思，拍照的过程中使人充满乐趣，还增长见识，适合各个年龄段的朋友们。
19827981,141584459,4,0,0,0,15-03-26,确实很不错，三个人完就更好了，位置也好找，总之很满意
19827981,35757792,4,0,0,0,15-03-26,还不错，就是自己不会拍，再多一点会更好，哈哈
19827981,160275709,5,0,0,0,15-03-25,还好吧，带姑娘去过一个类似的，还是觉得那个好玩儿点
19827981,49407771,5,0,0,0,15-03-24,很好玩，不算大，孩子都要票，价格确实贵些。
19827981,117865070,3,0,0,0,15-03-23,就是人有点多，建议错开周末，人多点比较好玩
19827981,19602832,5,0,0,0,15-03-22,拍照的好去处，跟小伙伴玩了两个多小时，开心
19827981,4101299,3,0,0,0,15-03-22,不太值 很小 没有济州岛的好。。。
19827981,42994337,5,0,0,0,15-03-22,还是不错的，很好玩！要是感兴趣的朋友可以去，带着孩子一起！体验不同感受！
19827981,33050866,5,0,0,0,15-03-22,赶上装修了，店家又给了两张票，可是没去成过期了，店家可不可以通融一下，不限时了好不？
19827981,34166669,3,0,0,0,15-03-22,还是挺满意的，感受到照相的乐趣。团购50元去的，要是30元就更好了。
19827981,10571205,3,0,0,0,15-03-22,还行，带着老妈和妹妹去尝鲜，能拍的不是特别多，没有那么逼真
19827981,5488225,3,0,0,0,15-03-21,周末下午去的 照相馆很好找 珠市口地铁附近 场景共三层  一楼免费 二三楼需要门票才能进 人稍微有些多 每个场景前都挤满了人 需要等待和沟通技巧才能成功照出效果 总的来说玩的挺开心
19827981,52869969,5,0,0,0,15-03-21,哇咔咔，愉快的体验。随时关注，换背景画面了还要去。
19827981,45993065,5,0,0,0,15-03-21,特有意思，团购来的，创意不错，值得！
19827981,35836402,5,0,0,0,15-03-20,位置很好找，就在肯德基斜对面，一共三层，但一层基本没什么，楼上的一部分场景还是很不错的，建议三个人去，创意更好。
19827981,23687285,5,0,0,0,15-03-20,挺有意思的，和朋友一起去的！但去一次也就足以，除非再出新的场景！
19827981,7808160,2,0,0,0,15-03-17,太小了 。基本进去二十分钟出来了 。一般吧~~
19827981,10541144,4,0,0,0,15-03-16,还算满意 不过真的是场地比较小 有的场景3d效果不是很好 团购的话挺合适的
19827981,177302871,5,0,0,0,15-03-16,挺好，有创意。适合朋友一起游玩。
19827981,127714221,5,0,0,0,15-03-16,平时去的没人玩的比较爽适合三个人以上去
19827981,4139474,4,3,3,3,15-03-16,还好吧，比较小，第一次体验的会比较新奇。团购券50，现场儿童30，验证后才发现，服务员明显知道也未提醒，待改进
19827981,6129662,4,3,3,3,15-03-15,孩子玩的很开心，但是场景不够多，尤其有趣好玩的明显还待加强。
19827981,23659153,5,0,0,0,15-03-15,挺不错的适合情侣，或者带孩子去玩
19827981,47548624,5,0,0,0,15-03-15,挺好玩的，照片拍出来也很好，注意到一个细节，里面设有充电的，想的很周到！
19827981,127532763,5,0,0,0,15-03-14,菜品一般丿，服务员差劲环境很好
19827981,118722673,5,0,0,0,15-03-14,挺好玩儿的！地方大一点就更好了！
19827981,755171295,5,0,0,0,15-03-14,团了2份，另和老婆饼，一起取得，儿子超爱。好吃不贵。环境服务都很棒！
19827981,4610389,5,0,0,0,15-03-14,场景还蛮多的，地方比较小，好多场景拍完需要裁一些才不会出戏…相比普通的3D拍摄场景，各种小东西的配合更有感觉，比如超人、漂浮等等的效果，还是很好玩的！本来是冲着AR技术来的，但是AR的只有一个，其它视错觉倒是玩了不少。很适合一群小伙伴来玩哦～
19827981,195412249,5,0,0,0,15-03-14,全部逛完并照完大概两个小时左右，三个人去的，所以有些画面可以有更大的创意空间，一部分是需要两个人或者三个人一起合作的，但是建议还是两个人一起去，不然没有办法照相。效果还算逼真，不过感觉空间太小，有些画在一个屋子里，如果有两拨人同时照不同的画，根本排不开，而且浪费时间。只能在旁边等着一拨人照完一幅画，另外一拨人在照另外一幅。无法重叠，而且稍显拥挤
19827981,45351055,5,0,0,0,15-03-13,不错价钱实惠服务态度也非常好!
19827981,2292607,5,0,0,0,14-11-11  更新于03-11 19:07,还行，就是有点小、一个多小时就转完了！
19827981,7915514,4,0,0,0,15-03-10,还可以就是有点小，一点要早去，要不然周末光照人了，照片的创意还是有点肤浅，没什么特别有特色的
19827981,47801302,5,0,0,0,15-03-10,特别有意思，我和宝宝玩的非常非常hight
19827981,45409761,4,0,0,0,15-03-10,不大，门票有点贵，景区，效果还行
19827981,9555522,4,0,0,0,15-03-09,挺不错的，周末去人比想象的要少。工作人员说有60多个场景，感觉要少些。图个新鲜，赞
19827981,1396912,4,0,0,0,15-03-09,还不错人不太多，画面还可以吧，第一次玩挺有意思的，3.4个人比较好
19827981,53020011,5,0,0,0,15-03-08,感觉还不错！建议3人以上通行！因为有很多两个人一起的景
19827981,3619036,4,0,0,0,15-03-08,好玩 就是游玩时间有点短 半个多小时就出来了
19827981,694981,5,0,0,0,15-03-08,非常不错，是一个照相的好地方。
19827981,7381677,5,0,0,0,15-03-08,创意无限啊，每个场景都有最佳拍照位指示和姿势样例，最少两人去，多人更好玩，带好你的创意哦。
19827981,2906521,5,0,0,0,15-03-08  更新于03-08 07:58,地方不大但是朋友几个能玩上3小时左右～图不少，画的也很精致～就是离得太近了～人多的时候不方便照相
19827981,11372103,5,0,0,0,15-03-07,很不错，第一次去就收获很多好玩的照片
19827981,1696963,5,0,0,0,15-03-07,这个地方太适合天生爱搞笑的去我了
19827981,6128270,4,2,2,2,15-03-06,有些画面效果一般，总体来说还不错
19827981,3346905,3,0,0,0,15-03-06,"总体来说挺好玩的,不同的景色背板,地上有提醒你应该在哪里是最佳拍照角度的脚印,最好早去10:00AM 开门,人一多挤在一起拍照的感觉就会差很多,他们家靠近前门大街南口路西!"
19827981,35791423,4,0,0,0,15-03-06,整体感觉还不错，但是确实如其他小伙伴点评的人多了去才好玩，很多场景是需要很多人才能做出感觉。场景有点少，好像有的地方还在装修
19827981,81155383,4,0,0,0,15-03-05,只有我和朋友两个人，及其动脑子，很好玩
19827981,35901685,5,0,0,0,15-03-04,挺有创意的，就是画面太少了点，地方也挺小的
19827981,4162370,5,0,0,0,15-03-03,不错！团购50每人，周一去的人少，多的话还真是不太好照。不过建议2人以上一起去，不然总要麻烦别人给合影。大概二三十个场景，每幅图旁边都有拍照说明和最佳摄影点提示，就是存衣柜太少了！撑死了也就20个左右，根本不够用！里面很热的，冬天进去脱了外套还得拿着，十分不方便！而且里面没有卫生间。望改善
19827981,35034513,2,0,0,0,15-03-03,适合爱照相的朋友、带孩子玩完还可以、不团购也有活动真的不大
19827981,6945792,5,0,0,0,15-03-02,好玩，特别童年，跟老公去的，好多不能一起合照。还是人多一点好玩。
19827981,4433897,4,0,0,0,15-02-28,说是三层，其实就两层，蛮小的…
19827981,6552291,5,0,0,0,15-02-28,真的很好玩！和老公玩的很开心！照出来特好玩
19827981,14407001,5,0,0,0,15-02-27,偶然发现女儿和她姑姑玩的很开心。
19827981,18602359,4,0,0,0,15-02-27,地方不大，工作日去的，人很少可劲儿照
19827981,2155540,5,4,4,4,15-02-27,适合小朋友 及爱照相的小伙伴们 里面太赞了 值得来哦
19827981,7159906,5,4,4,4,15-02-27,棒极了，开动脑筋。是个很有趣的照相地方。
19827981,894115,3,0,0,0,15-02-26,团购非常合适，里面不大但很好玩
19827981,24434136,4,0,0,0,15-02-26,一般般，没有想象的大。路过看看
19827981,44097374,5,0,0,0,15-02-25,非常有意思的地方！！朋友都想去！
19827981,27556071,5,0,0,0,15-02-25,同行的人多些，创意会更多更好玩儿!
19827981,32565136,4,0,0,0,15-02-25,挺好玩就是春节人太多了，拍照需要找角度
19827981,30456605,4,0,0,0,15-02-25,还是比较开心的，除了人比较多。也不能怪商家。主要是我们赶在情人节去了…
19827981,8659634,3,0,0,0,15-02-24,有点小，就显得挤，东西有点少。
19827981,23532871,5,0,0,0,15-02-24,还不错！三五个好友去比较有意思~俩小时拍完。初五人微多，感觉和国瑞城的差不多。位置好，团购价50还可以
19827981,26766225,4,0,0,0,15-02-23,和售票处前的几个模型摆了造型拍了几张，感觉挺好玩的，但是票价觉得有点贵，不知道怎么样，相信应该更好玩！
19827981,20538862,5,0,0,0,15-02-23,好好玩，我和妈妈很喜欢~值得去
19827981,14337061,5,0,0,0,15-02-23,很好，地方不大但是照相花了好多时间。
19827981,1686479,5,0,0,0,15-02-23,很不错的一家3D照相馆，值得来玩！
19827981,34962676,5,0,0,0,15-02-22,很不错，有创意，孩子特别喜欢！推荐！
19827981,1805967,4,0,0,0,15-02-22,很有意思，图的设计让你拍出不一样的照片。关键是和谁一起。么么。情人节快乐。
19827981,9640069,5,0,0,0,15-02-22,很好。值得玩儿。值得带孩子玩儿。
19827981,1457035,5,0,0,0,15-02-22,地方不大但是场景很经典，有团购很值得一去
19827981,3873710,4,0,0,0,15-02-21,环境不大，可以拍照的点很多。有趣！想拍出跟宣传册一样的效果图。需要动脑子，还要多尝试。
19827981,2239844,4,0,0,0,15-02-21,不错，挺有意思的，孩子好玩，谢谢点评团购
19827981,7719492,5,0,0,0,15-02-20,里面环境挺干净的，景也比较多，3D效果不错
19827981,28797304,5,0,0,0,15-02-20,感觉有点小 不过还是挺有意思的 人还好不算多
19827981,20532629,3,0,0,0,15-02-19,团购来的 人不多。里面的画挺有意思的
19827981,20538291,5,0,0,0,15-02-19,很有创意，年初一来人很多，挺有意思的
19827981,57621470,4,0,0,0,15-02-17,还是非常不错的。因为快没流量了。所以没有上传照片。
19827981,31552937,3,0,0,0,15-02-16,能拍的的东西太少啦 而且很多景也不是3D呀。。。
19827981,50736760,4,0,0,0,15-02-16,5个小伙伴一起去的～ 没想到仅仅几个区域也很费体力。 大家都挺开心的～ 个人觉得比较适合小孩儿去～ 去一次就够啦～
19827981,2519197,5,0,0,0,15-02-15,很适合照相，效果不错，团购还算划算
19827981,6121079,3,0,0,0,15-02-15,还可以吧，挺不错的，但是也没那么好玩
19827981,4984663,5,0,0,0,15-02-15,周日一大早10点就去了，人很少，场景还可以，不过没有崇文门的场景多，但是人比较少，照的很过瘾
19827981,25362884,5,0,0,0,15-02-15,和姐妹儿一起去的 超级喜欢 疯狂照相
19827981,20534768,5,0,0,0,15-02-14,还好吧，内容有点少。带孩子估计还可以吧
19827981,26678752,4,0,0,0,15-02-14,店就是太小了，照一会儿就没了，效果还是不错的
19827981,14832165,4,0,0,0,15-02-13,还不错吧，就是感觉至少三人来才有趣，人挺多，喜欢大福的画作，小的没意思
19827981,43852859,3,0,0,0,15-02-13,就是拍照地方就那样，为了凑够15个字
19827981,5902689,3,0,0,0,15-02-13,利用视觉误差做的一些拍摄场景，拍出来的照片挺有意思，有些布景做的很逼真很搞笑。
19827981,42410329,5,0,0,0,15-02-13,来得早，人还不多，就是场景不太多，希望以后能扩大点儿，整体不错，以后有人来的话，早一些比较好
19827981,18585296,4,0,0,0,15-02-13,不错哟。推荐情侣。家人一起去看。玩的很开心
19827981,85422341,4,0,0,0,15-02-13,还不错！位置也很好找！儿子很喜欢滴
19827981,190994491,5,0,0,0,15-02-12,好玩，人少，可劲拍，地方也好找
19827981,5942022,4,0,0,0,15-02-12,孩子大人都玩儿的挺开心的 要是地方再大些就好了
19827981,13482032,4,0,0,0,15-02-11,很不错啊～很有意思～不算特别大但是场景蛮多的，很多场景跟韩国的差不多～去的时候时间特别棒几乎包场了哈哈哈哈！
19827981,35117157,3,0,0,0,15-02-11,工作人员服务很好，可是场景不够多，逼真效果还行，照片拍拍还是可以的
19827981,190508557,5,0,0,0,15-02-10,画质良心，人不多，值得去^W^
19827981,45113133,4,0,0,0,15-02-09,挺有意思的 但是我是一个人去的 没人照相 哭死
19827981,499732,3,0,0,0,15-02-09,场景排布近，人多照相不方便，场景少
19827981,31750185,3,0,0,0,15-02-09,创意无限，画师好像是韩国人，真的很佩服他们的创意！糯米团便宜，现场买票65学生55大众50
19827981,48141101,5,0,0,0,15-02-09,很好玩的地方，人很多。带弟弟一起去的
19827981,1160613,4,0,0,0,15-02-09,爸妈觉得好玩就好，见识一次就够了，怎么玩看你想象力
19827981,30687315,5,0,0,0,15-02-08,还不错吧，周六日有点人多，有的效果不是太明显，玩玩还行
19827981,31963042,4,0,0,0,15-02-08,规模有点小了吧，不值得这个价。
19827981,141485921,4,0,0,0,15-02-08,带爸妈来放松一下，感觉很不错，周日上午人也不多，就是有些带着孩子推婴儿车的人拿照相的地方当歇脚的地方，很妨碍人照相。
19827981,35077624,4,0,0,0,15-02-08,一般吧，第一次去还行。拍照专供…多几个小伙伴一起比较好
19827981,23086521,3,0,0,0,15-02-08,场景比较少，有的也不知道该怎么玩，比不上上海那个好玩
19827981,54803509,4,0,0,0,15-02-07,一定要找摄影技术好的小伙伴一起来，不然会吵架，好心塞
19827981,52496548,3,0,0,0,15-02-07,还不错啦~就是可以照照片的部分太少，希望多加一些
19827981,35785947,5,0,0,0,15-02-07,很好玩的地方！！！喜欢！！！会经常来的～！！灰常赞
19827981,3989113,5,0,0,0,14-10-12  更新于02-06 15:00,看他家很多人，有团购，不贵。就和几个同事一起过来啦！外面看他家比较高大上。原来3D立体画还能这么拍，新奇特，真搞笑。里面拍照区一共3层，没有回头路，游客可以根据自己的时间自由游览。感觉他们布置的很合理。我们弄了个自己的纪念册。太有才了，太有创意啦！他家的画面好真实，细致。尤其是服务人员满Nice，需要帮忙拍照都很耐心！只有你想不到的，没有你拍不出的。上面还有3D打印的礼品，还挺神奇！尤其那个中国梦。。。
19827981,49272697,5,0,0,0,15-02-05,"哈哈没买自拍神器,就想参观一下！"
19827981,4465919,5,0,0,0,15-02-04,还可以 今天去人不多可以随便拍 不用排队
19827981,25652658,5,0,0,0,15-02-04,非常有意思，工作人员也和蔼可亲的，人也不多，不错
19827981,39592647,4,0,0,0,15-02-04,喜欢拍照的孩纸值得一去～虽然3层也不是很大，一会就拍完了～照片还是挺逗的
19827981,45330582,5,0,0,0,15-02-03,里面很好玩，闺女很开心，下次还回去！
19827981,39145856,5,0,0,0,15-02-03,不错哦！我是周五去的，人不是很多！我去过韩国的那个，觉得有一拼
19827981,9250348,5,0,0,0,15-02-02,人不算多，里面有很多东西，很不错！
19827981,5713842,3,0,0,0,15-02-01,还算有意思，内容不是很多！！！
19827981,7917638,5,0,0,0,15-01-31,适合跟朋友一起去。小孩不太适合
19827981,40712007,5,0,0,0,15-01-31,很好的一次体验！！！！！！！！！
19827981,7210042,4,0,0,0,15-01-30,不是休息日去的人很少，但是有点太小了
19827981,1854581,4,0,0,0,15-01-30,没体验过随便溜达下还是可以的，总共用不了多久
19827981,32767871,5,0,0,0,15-01-30,刚跟朋友去过，还是很好玩的，价格也不贵，打发时间的好去处~
19827981,12820010,5,0,0,0,15-01-29,很好玩，就是感觉有点小哈。 不过还是拍的挺给力的。
19827981,18547547,3,0,0,0,15-01-28,比店内就便宜了5块。。场景还是有点少 不太值
19827981,161579818,5,0,0,0,15-01-28,呵呵！很好玩的一个地方，周末带着老家朋友来的，小孩子特别喜欢，玩的特别嗨！还可以体验，里面地挺大的，要想全部看完得有个工作人员，这里的工作人员也挺好的，大家一起照了相。以后时间不要周末过来，有好多没有人玩到。不过今天应该会很累还有其它地方要去的。回去好好休息吧！
19827981,3675316,3,0,0,0,15-01-27,不知道为什么有那么多人会觉得好玩，地方很小，人也比较多，照相很难出效果，不过去看看倒是应该，也就是仅仅看看
19827981,905490,5,0,0,0,15-01-25,很愉快的体验，还有店里人员帮忙摆Pose，帮忙照相，还想再去
19827981,15147715,5,0,0,0,15-01-25,在装修，地方不大，场景挺多，适合爱拍照的朋友
19827981,14960363,3,0,0,0,15-01-24,带孩子去玩的有点意思，共三层，一层几乎没什么，玩的时候一定看好了怎么拍，我们就有几个拍的不好。
19827981,185270674,3,0,0,0,15-01-24,感觉还可以，但是刚装修好，油漆味还比较大，另外就是找不到停车位
19827981,6273733,4,0,0,0,15-01-23,这地方在前门大街肯德基对面，很好找，停车就不好找位置了。这里就是照相的地方，会玩的玩三四个小时没问题。去这里玩最好是三五知己去才合适，两个人都有些少，因为有双人照相的场景，需要找工作人员帮忙。照相需要融入场景，不能到此一游式的，带老人孩子可能就不太好，因为孩子不老实让你照相还捣乱，老人是禁不起折腾。最后说下，这里的工作人员服务都挺好的。
19827981,106360661,4,0,0,0,15-01-22,很有意思就是画少了点 不过瘾 孩子不够1米不要钱
19827981,85054046,5,0,0,0,15-01-21,很好玩，一开门就到啦，因为去的早没有多少人，后来慢慢人多了起来
19827981,1694427,3,0,0,0,15-01-20,就那么回事吧。。。太小了。。。
19827981,3886383,5,0,0,0,15-01-20,挺有意思的，但应该限制人流，不然拍照相互干扰
19827981,95350470,4,0,0,0,15-01-16,二三十个图，消遣娱乐还行，出来感觉没什么意思，性价比不高
19827981,38626583,5,0,0,0,15-01-15,新开的，还挺大，上下三层～位置也好找
19827981,48120327,4,0,0,0,15-01-15,和小伙伴玩的很开心，就是感觉图片都旧了，很多土，应该多清洁一下，多带点好盆友一起玩比较好
19827981,28157445,3,0,0,0,15-01-11,感觉一般般吧，没有想象中的那么美好。
19827981,3787921,5,0,0,0,15-01-11,还不错吧，玩得挺开心的，人也不多，适合拍照
19827981,41383396,4,0,0,0,15-01-07,没去过3D的就推荐这家~非常有趣~要提前想好姿势或者带一个比较逗逼的同伴一起去会特别的有趣哒~有团购~挺合适的~
19827981,176375399,3,0,0,0,15-01-07,很一般…觉得没什么大意思，不会照的很难照出效果。
19827981,154179255,5,0,0,0,15-01-06,玩得很开心，人也不多，就是拍不出示例的效果
19827981,3763969,3,0,0,0,15-01-05,地点在前门  对面是肯德基  很好找  但是现在在装修  说是要1月20号以后再开业  希望到时候能多添加几个场景  在北京旅游微信买的票  到现在还没退钱  也查不到程序走道哪了
19827981,17054003,1,0,0,0,15-01-05,元旦时候团购完门票，兴致勃勃的去了，结果人家根本就没开门！说什么系统升级，暂停营业！太过分了，点评上根本没提醒！
19827981,143504375,5,0,0,0,15-01-04,团购票去的，小孩子不要钱，一共三层，一个小时足够了。
19827981,1845042,4,0,0,0,15-01-03,总体一般吧，没有太多惊喜，人多的时候不好玩，照相会挡着。
19827981,15697270,2,0,0,0,15-01-03,团购怎么还有呢，店已经关门了，元旦期间去吃了闭门羹，大家不要白跑一趟了。
19827981,136271008,5,0,0,0,15-01-03,还行吧，一般般的3D管，照相也一般吧，没有太多惊喜…
19827981,11358586,5,0,0,0,15-01-02,还未消费，在装修，由于没有提前通知，又送了两张票
19827981,35752822,5,0,0,0,15-01-01,小馆别有洞天，画面很丰富，地理位置也优越，不错不错〜
19827981,737200,4,0,0,0,14-12-31,虽然不大，但还挺有意思，附照片推荐拍法很贴心。
19827981,24537269,3,0,0,0,14-12-31,没有之前去的那家好，还有些没有装修完的，人不多，小失望！
19827981,32131312,4,0,0,0,14-12-29,可爱的地方，就是有的小。玩得开心
19827981,4671328,5,0,0,0,14-12-29,很有创意，就是建议标注最佳拍摄位置，谢谢
19827981,3132684,5,0,0,0,14-12-28,第一次尝试，很有意思，如果好几个朋友可能更有趣哦，就是看到图案还需要再想想怎么照啊，这是开发创意的时候，很好玩，要玩的开才行
19827981,28552170,5,0,0,0,14-12-28,真的很好玩，带孩子首选。有团购很合适
