19827981,139668129,5,4,4,4,15-07-11,第一次来3D馆，向往已久，果然没有让人失望，下次朋友来北京玩儿可以带来这里。这次和男朋友玩儿的很开心，环境很好，很干净，设备也都很新，夏天来有空调，不会很热。
19827981,6532114,5,4,4,4,15-07-11,服务员非常热情，很好，评价晚上了不好意思啦，真心不错的
19827981,669331734,5,4,4,4,15-07-10  更新于07-10 21:37,和朋友一起去的，真心推荐三个以上的人一起去，两个人有些地方的拍照还需要请路过的人来帮忙，因为是学生所以用这个价格购买的，感觉很实惠，我们下午4点多去的，还没什么人，5点多人就开始多了，给大家一下建议，希望能够有用
19827981,7296572,2,2,2,2,15-07-10,不会再去，看别人的朋友圈挺震撼，自己一去就那么回事，很小的一个地方。
19827981,159052773,3,3,3,1,15-07-10,一般吧，感觉有点不划算，小孩应该爱玩
19827981,4470548,5,4,4,4,15-07-10,宝宝们玩得很开心 只是两三岁的宝宝也要30一张票贵了点
19827981,52164648,5,4,4,4,15-07-10,还算不错吧……第一次玩这种，还挺好玩的
19827981,56125589,4,2,2,2,15-07-09,三层楼，二三层不大，最好是人不多时照，要不就转不开了，互相影响，我们晚上七点去的，没有人，太好了，和儿子照个够，很有意思。
19827981,24486246,4,4,3,3,15-07-08,周一人不多 四个小伙伴一起去的 位置挺好找 玩的很high 拍的满头大汗的 场景并不算多 总体还好 值得一试
19827981,24087410,3,2,2,2,15-07-08,总体一般，没什么特别，凑合吧。
19827981,50779759,4,3,3,3,15-07-08,步行街上很适合孩子玩儿的项目
19827981,33840319,5,4,4,4,15-07-08,空间比较大 有些设计很新颖 适合情侣
19827981,145827043,4,3,4,3,15-07-08,空间有点小 不过照出来很好玩，人不多基本不用排号
19827981,5733202,4,3,3,3,15-07-07,抽中的体验，趁着工作日和学生没放假赶紧去了，人不算太多，能照的比较充分。场景不是很多，但是还挺逼真的，玩的很开心。谢谢商家和大众点评。
19827981,5801741,5,4,4,4,15-07-07  更新于07-07 11:48,不错不错，一早就带大宝来的，创意好极了。大宝好开心！
19827981,43190441,5,4,4,4,15-07-07,拍了好多照片，第一次去3D照相馆，蛮好玩的，希望可以在多增加点3D图
19827981,104526256,5,4,4,4,15-07-06,里面挺有意思，不错不错哦，团购比较值
19827981,6297184,4,3,3,3,15-07-06,场景挺多的，但是赶上周六日人比较多，总要等别人照完，一般一个屋子里有四个场景，屋子很小，别人在旁边拍的时候也要等拍完才能拍自己要拍的这边，不太方便
19827981,5415457,5,3,4,4,15-07-06,人太多了，可能因为是假期的原因，带孩子玩玩！
19827981,34968797,5,4,4,4,15-07-05,挺好的，比现场买票差不多便宜一半！里面空间有点稍小，周日去得，人还不算太多，总的来说挺值的！
19827981,3999879,3,2,1,1,15-07-05,总体来说里面不大，只有偶尔几个比较新颖，其他一般，就算每个都拍，很快也能出来。所以门票贵了，即使团购也觉得贵。一般般吧。
19827981,185837811,1,0,0,0,15-07-05,没意思，灯光效果差，地方不算大
19827981,48688047,5,4,3,3,15-07-05,团购去的  人均45  在大栅栏步行街的南边   售票员很麻利  很快的接收了  团购码信息   然后存包   给了手环   可以愉快的拍照啦   共有三层  我和朋友先玩的在一起   可是我的身高不成比例啊  头卡住了  后来勉强的我们一起照了一张   建议三四个小伙伴一起玩   有的要合影   但是你也可以请其他正在拍照的路人  帮你   那就要看的她的水平了   有的给你照虚了  就哭笑不得了   场景很丰富   骑斗牛的很有意思   还有跳伞   超人    古墓丽影  侏罗纪世界的鳄鱼   幸福快车  街头霸王   赶上周六  居然人也不是很多   还真的不错  帮朋友拍了很多相片   她都非常喜欢   玩了大概有两个小时   我们都出汗了  我的朋友玩的很开心  说好了   以后换身行头  再来
19827981,21373552,5,4,4,4,15-07-05,挺好玩儿的～～就是地方有点小，希望3层也能开开～～
19827981,123887259,5,4,4,4,15-07-04,和两个小伙伴一起去的，觉得三个人去是最合适的，里面很多两个人要一起合照的背景，我们照了一个半小时左右时间，非常有意思！！觉得时间过得很快，而且没有尽兴。。。再多一些会更好哒~还没有去过的朋友可以去happy一下！
19827981,3708009,4,3,3,3,15-07-04,还行吧，团购比较值，人多的时候需要错位拍照，但是有的人很讨厌，完全不管你是不是在拍照直接就横冲直撞的强行入境了，里面场景要是再多些就好啦
19827981,45556795,5,4,4,4,15-07-04,样式有点少，再多一点就好了，也就够玩俩小时不到。
19827981,65138521,5,4,4,4,15-07-04,团购的 价位合适 很有趣 拍了很多
19827981,772824333,5,4,4,3,15-07-04,玩得很开心，忘带相机挺可惜的，但很值得来
19827981,3556252,5,4,4,4,15-07-04,非常不错的感受，下次有机会再来玩！
19827981,9070912,4,3,3,3,15-07-04,这个地方就在前门大街靠近珠市口的位置，坐公交地铁都很方便。
19827981,27178381,5,4,4,4,15-07-03,不团也不贵，适合孩子玩，我妹大二，玩的也很开心，旁边的冰淇淋也好吃
19827981,196765160,5,4,4,4,15-07-02,挺好～一家玩的很开心，团购非常合适，没敢周末去，人不是太多，玩了两圈～
19827981,5275481,5,4,4,4,15-07-02,很不错的，有很多更新的设备，稍微有点小
19827981,790612460,4,3,3,3,15-07-02,还不错，就是东西不太多。最好人多一点，大于两个比较有意思。
19827981,50803339,5,4,4,4,15-07-01,和孩子来排照，挺好玩的。需要自己发挥想像。照片出来好多人问哪里照的。顺便逛逛前门。
19827981,761887149,3,2,2,2,15-07-01,地方不错，服务再好些，可以再来一次
19827981,99366468,5,4,4,4,15-06-30,第一次来，感觉很好。非常有创意，拍照根本停不下来。一定要把手机充满电哦！
19827981,6432898,5,4,4,4,15-06-30,布景很有意思～能拍一个多小时。
19827981,58968309,5,4,4,4,15-06-30,值得来，很有意思，真的非常满意！
19827981,7690044,5,4,4,4,15-06-30,带孩子来  玩得特别开心  真的挺好玩的强烈推荐
19827981,18717587,5,4,4,4,15-06-30,工作人员很热情，不算有机会再来啦！还挺好玩的～～
19827981,24524587,4,3,3,2,15-06-29,在前门比较好找
19827981,766315111,5,4,4,4,15-06-29,节操尽丧之旅哈哈哈哈哈
19827981,103065037,2,2,2,2,15-06-28,不太满意，价格太贵，里面太小，竟然连洗手间都不提供
19827981,27045341,5,4,4,4,15-06-28,感觉棒棒的～端午去的，人不算多，立体感挺强的，面积也比较合适～
19827981,69129276,5,4,4,4,15-06-28,很好 很有创意 晚场来人不多 还有特价 环境很好 赞一个
19827981,170589448,5,4,4,4,15-06-28,和好朋友一起来，玩的很好！！推荐推荐！！
19827981,791535673,5,4,2,2,15-06-28,可以来玩玩，爱照相的朋友这是个不错的选择
19827981,25271143,5,4,4,4,15-06-28,在前门大街的很南边，好玩的挺多的，配合3D图摆pose也是需要一定勇气的～
19827981,23818422,3,3,3,3,15-06-28,个别背景需要维修，仿真程度有待提高
19827981,125966,5,4,4,4,15-06-28,带小朋友去的，很好玩，还能顺便逛逛前门大街，
19827981,786165310,5,4,3,4,15-06-27,人还不算特别多，挺好玩的地方，照了很多有意思的照片。
19827981,43059361,5,4,4,4,15-06-27,很好玩，一行五人，大人小孩都很开心。
19827981,127847270,5,4,3,4,15-06-26,非常好玩，和朋友一起很开心，室内，也不怕晒
19827981,9614142,1,0,0,0,15-06-26,做的实在太丑了，山寨风格，实在看不下去啦，坑爹啊
19827981,16740214,5,4,4,4,15-06-26,感觉还是不错的，就是地方小了点，跟韩国没法比
19827981,778878693,4,3,3,2,15-06-26,很一般。我们不是很喜欢！其他网站团了验证不了，退了又重新买的。
19827981,72228593,5,4,4,4,15-06-26,团购去玩挺不错的！很多场景挺有意思
19827981,33823136,5,4,4,4,15-06-26,超级好，比较不错，孩子玩的很开心
19827981,94968027,4,4,4,4,15-06-26,很不错，一起玩的很开心，就是地方有点小。
19827981,8155002,3,2,2,2,15-06-26,消磨时间还不错 就是有点少 看别人能拍好几个小时 我和朋友半小时就走了 有些还是很有意思的 现在微信扫比团购便宜
19827981,52173192,5,4,4,4,15-06-25,图案不错，但是图案不是特别多，就是一个拍照的地方。
19827981,107695589,3,2,2,2,15-06-25,地方不大，没有想象中那么好一般。
19827981,52954811,5,4,4,4,15-06-25,位置很好找，还挺好玩的！值得去！！
19827981,101883746,4,4,4,4,15-06-25,很好玩的呀 价钱也适合 值得推荐的
19827981,1696950,4,3,3,3,15-06-24,春节之前和同学&妹妹带小外甥女去的，同行4人比较合适，很多照片需要两三个人配合去照。
19827981,194812522,5,4,4,4,15-06-24,离家很近，还不错照了几张很有趣的片子。
19827981,24490818,5,4,4,4,15-06-24,很有意思的地方，虽然地方不大，但是创意无限哦
19827981,4274815,4,3,3,2,15-06-24,还可以，比较粗糙，商业区地方比较小
19827981,112331524,5,4,3,4,15-06-23,学生票确实划算，拍照也挺有意思的。不过是去的时候人很少，拍双人要看缘分。。按了铃没有人上来管。。
19827981,50059103,5,4,4,4,15-06-23,挺不错的，真心不错，特别的好玩儿，就是离我哪里有些远了
19827981,55575339,5,4,4,4,15-06-23,五一假期的时候和妈妈去的，留下很多有趣的照片、值得去噢！ps：很费体力的！
19827981,2131881,5,4,3,3,15-06-23,真是奇思妙想的地方，太搞了。门票可以团购，如果没带孩子两个大人直接100，小孩子30，团购的话2+1是115，能便宜15。里面场景算是可以了，只是周末去人有点多，拍照需要相互错位。一层是大堂，二层三层是拍照的地方，三层坐电梯直接就下来了，出来后不得再次进入，连在入口处拍照都不可以。不过其实还是挺值的，可以几个人一起在里面相互拍，超 high的。三层电梯口附近还有视觉错像的地方，告诉你你看到的一些视觉上的错觉，挺好的。
19827981,185748473,4,3,2,3,15-06-23,位置很好找 里面挺大的有两层
19827981,4525167,4,4,2,3,15-06-22,还好，需要点照相技术，地方有点小，所以显得拥挤，照相时总会互相干扰！
19827981,47152975,5,4,4,4,15-06-22,带老妈一起去的，老妈非常地开心，遇见了画画的大叔是日本人，非常的友善，里面的3D画也是蛮真实的，推荐哦！
19827981,7586769,5,3,3,3,15-06-22,工作日去的 人很少 还不错 挺好玩的
19827981,138596222,4,3,3,3,15-06-22,一般般吧。东西不多。。。场地不大，人多就不好玩了
19827981,333506326,5,4,4,4,15-06-20,喔喔喔喔喔喔，体验不错，非常棒
19827981,22537193,5,4,3,4,15-06-20,学生票真的很超值，图像也很有创意，不过端午节人也很多，拍照都没有位置，是不是该考虑下限流什么的，这样用户体验会更好
19827981,30723956,5,4,4,4,15-06-20,上下三层，不错的3D画展，孩子喜欢！
19827981,792048295,5,4,3,3,15-06-19,有趣！！和同学来最好！！！！！
19827981,20989460,5,4,4,4,15-06-18,不错的体验，就是里面没有卫生间值得改进
19827981,187598458,3,2,2,2,15-06-18,地理位置相当不错！去拍拍照玩儿一下还不错~
19827981,16037922,5,4,4,4,15-06-17,带媳妇一起去的，不过可惜我俩都不太会照相，没照出好的效果！地方还算不小，都照一遍也挺累的
19827981,2518699,4,4,4,4,15-06-16,场景布置挺有意思的，人不多，环境还可以。
19827981,32671778,5,4,4,4,15-06-16,挺好的好玩 很开心 不过貌似微信扫码比团购便宜
19827981,38766893,5,4,3,3,15-06-15,团购很值！照相还是要赶在人少的时候～
19827981,5255743,2,1,1,1,15-06-15,真的是一点意思都没有完全不值，还不如去动物园看动物呢。
19827981,18394404,4,3,3,3,15-06-15,还可以吧，三层小楼，有的图片不错，照出来3D效果很好，有的一般……就是空间太小，幸亏当天人不多，不然照相会相互影响……总体感觉还可以，可以随便玩玩……现场买票也是一百两人，跟团购一样～对了，地铁七号线珠市口下来走几步就到了～
19827981,1054009,5,4,4,4,15-06-14,没想到还有学生票，虽然里面不大，但是夏天室外那么热，室内几个人拍拍有趣的照片也是不错的选择，只有有创意点子就能拍出好玩的照片
19827981,24307541,3,2,2,2,15-06-14,图很多都没那么立体，感觉和给的参考照片很多差距很大
19827981,789259333,5,4,4,4,15-06-13,工作日去的 人很少 有三层 和朋友玩的很开心 就是只有一名工作人员 两个人去就是很难合影 可以多一点人去 学生票很划算 很喜欢
19827981,8706542,5,4,4,4,15-06-13,和闺蜜玩的很嗨 挺大的 嘿嘿嘿嘿嘿
19827981,4147940,5,4,4,4,15-06-12,平时早上去的，没什么人，基本是个人专场，非常好。
19827981,92976783,5,4,4,4,15-06-11,真不错，拍的很有意思，以后有机会还会去
19827981,62062276,5,4,4,4,15-06-10,还可以，带着娃去看画面。还可以，平日去的人不多。
19827981,52649313,5,0,0,0,15-06-10,不错，很喜欢这个地方，有意思，创意很好
19827981,4079470,3,0,0,0,15-06-09,总得感觉还不错，里面的画挺多的，可以和朋友一起拍，位置也很好找，就在前门步行街里面，这次体验还是很棒的，不过去一次就好了。人也不是很多。
19827981,765723710,5,0,0,0,15-06-09,拍出相片效果不错、就是当时没开空调有点闷、人有点不舒服
19827981,47411124,5,0,0,0,15-06-09,好好玩 照相需要靠自己的各种想象 还是人多去比较好照相
19827981,48298076,5,0,0,0,15-06-09,很不错，周末去的，人不多，孩子很配合我们拍照。
19827981,25064230,5,0,0,0,15-06-09,很好玩！照了不少照片！我很喜欢
19827981,761614464,4,0,0,0,15-06-09,对小朋友来说是个非常有趣的地方。
19827981,33723006,2,0,0,0,15-06-08,场景不是很多，和小伙伴们一起去拍照比较合适。上面也会提示场景该怎么摆造型。要是场景能更多一些就好了。
19827981,79482876,5,0,0,0,15-06-08,最少两个人去玩，拍的照片特别搞笑
19827981,768399847,4,0,0,0,15-06-07,很不错，照出来的效果很好。比较真实
19827981,4264613,5,0,0,0,15-06-07,好有趣啊，一玩玩了三个小时，需要想象力才能照的好！
19827981,20840083,5,0,0,0,15-06-07,平日去的^人不多^放开了照^都照了其实还挺需要体力的^
19827981,30859632,5,0,0,0,15-06-07,很好玩的地方，照片也多！玩完了还可以逛逛呢！
19827981,137524736,4,0,0,0,15-06-07,还行，就是有点小，创意不错，不足一米的孩子都要票
19827981,37897561,5,0,0,0,15-06-07,挺好玩的，带孩子去看的。唯一的缺点，里面没洗手间，对小孩要应急的话，确实比较麻烦。
19827981,73756597,5,0,0,0,15-06-07,虽然里面不大，但是真心挺好玩的，我和小伙伴是周日去的，最值得庆幸的是人不多，几乎每个背景都不用等待，可惜的是从三楼下到一楼的图没看见，我们是原路返回的！小伙伴们可以从三楼乘坐电梯下来哟！第一个也是奇思妙想家的，就在一进门口的位置，效果就跟油画一样，我要的小的加相框五十！除了觉得小以外都挺好的
19827981,154440192,5,0,0,0,15-06-07,还想再去一次，等我有时间了和男盆友一起
19827981,75004026,5,0,0,0,15-06-07,好玩，不错挺有意义的，和女朋友去的，她都玩疯了
19827981,51175002,5,0,0,0,15-06-06,值得带孩子去，除了空间小点，非常有创意！闺女还要去
19827981,7325193,5,0,0,0,15-06-06,用了团购券～还是比直接购票便宜一点的！地方真的很好找就在前门大街的明面上，一共有三层，虽然是这样，但是第一层是售票处…进去以后直接上二楼，里面不是很大，可以照相的一般多吧，不过有的确实是挺有意思的！
19827981,26037312,5,0,0,0,15-06-05,周五下午和先生偷偷翘班去哒，人很少，玩的很嗨皮，店里的场景有些少，没拍够。
19827981,27490159,4,0,0,0,15-06-05,关注奇这家有一段时间了，也看到了他们的抢票活动，抢来抢去的好麻烦，关键是——我从来没抢到过！早已经累觉不爱了！好在团购的价格也很给力！本身就是自拍狂，不得不去，走起~在前门大街127号，傻子路，很好找，没想好玩的人一波接一波的，团购的价值体现出来了~场景不少，摆好pose和造型拍照拍照，照片出来效果还不错，搞笑的很，有那么点3D的感觉，也就是图个新鲜好玩，哪天心血来潮可能还会来~
19827981,40749930,5,0,0,0,15-06-04,很有趣的地方 团购很划算 服务人员也很贴心 值得去！
19827981,22840025,5,0,0,0,15-06-04,挺好玩的！地方也很好找！有三层！还可以吧
19827981,755634979,4,0,0,0,15-06-04,价格还行，拍出来的效果也不错，可能需要你找好角度。
19827981,5427441,3,0,0,0,15-06-03,朋友去过上海的3D艺术馆，感觉很不错，于是来这里尝试了一下，整体感觉就是比较简陋吧，环境很拥挤，人多的时候要等很久才能拍的满意，但是本身也不是高科技不能要求太多，看到拍完的成果还是很有趣的。
19827981,94822660,5,0,0,0,15-06-03,太好玩了，这个就是在其他地方很难出现的
19827981,6596582,5,0,0,0,15-06-02,和朋友一起带孩子去的，孩子玩的很高兴
19827981,127063585,3,0,0,0,15-06-02,其实就一般，一共就几间房，可以拍照，效果还不如PS，价格太贵了！
19827981,61880347,4,0,0,0,15-06-01,还不错哦，刚好儿童节去的，但是人不多，很好
19827981,26341708,5,0,0,0,15-06-01,特别好玩!今天团的今天去的!玩的很好!
19827981,273025901,4,0,0,0,15-06-01,小了点，孩子玩的不尽兴。找那个地方真不好找，说离杜莎蜡像馆旁边，其实远着呢。
19827981,56481828,5,0,0,0,15-06-01,位置不错，面积不是很大，有点拥挤，人不少
19827981,777281784,5,0,0,0,15-06-01,六一儿童节带儿子去照相，赶脚真的不错！人不算多，拍的很开心！
19827981,45398076,4,0,0,0,15-06-01,挺好玩的，照了很多3D照片，很不错。值得一去。
19827981,43097979,5,0,0,0,15-06-01,非常愉快的体验？很好玩 有好几层！！
19827981,53260695,4,0,0,0,15-06-01,情侣闺蜜家长孩子都合适照相啥的挺有意思
19827981,136232375,5,0,0,0,15-05-31,挺有意思的，孩子们很嗨皮！就是小了点，有点贵！
19827981,41288533,4,0,0,0,15-05-31,来的时候一层在装修，还送了两张券，拍照很有意思，来的时间人也不多，正适合拍照！
19827981,45103401,5,0,0,0,15-05-31,到孩子去过一次，面积不大，两层，照片效果好！经常会更新背景！工作人员态度不错！
19827981,6356542,5,0,0,0,15-05-31,很满意，几个大人小孩一起去的，很开心
19827981,29136259,5,0,0,0,15-05-31,挺有意思的，就是地方不大，最多呆一个小时，人多的时候还不行，在前门大街，我们周末10点左右到的，还可以耍的开！
19827981,299825,5,0,0,0,15-05-30,很不错的。好玩，带爸妈一起去的，就是不好停车，在步行街里面。
19827981,39394619,5,0,0,0,15-05-29,好玩我喜欢，就是我去的时候人挺多的
19827981,161420859,5,0,0,0,15-05-28,和闺蜜玩了整整一下午，老板也很nice
19827981,89390404,5,0,0,0,15-05-28,不错 很贴心 人也不少 但是玩了一圈后发现场地有些小 但是貌似对面的蜡像馆更好玩一些
19827981,17264029,5,0,0,0,15-05-27,挺好玩儿的 当天没什么人 感觉操场啦 哈哈
19827981,50091670,4,0,0,0,15-05-27,和朋友一起玩的很开心，还是人多好玩！
19827981,74458916,5,0,0,0,15-05-27,陪死党来的，很有趣周二去的，人很少我玩的很欢乐。喜欢拍照的朋友一定要去逛逛…
19827981,5789265,4,0,0,0,15-05-26,挺好玩的，和朋友一起照了很多相片，里面的图还不错，很多都和知名3d错觉照相馆很像，还是很不错的，推荐
19827981,768712594,4,0,0,0,15-05-26,很好，也不贵，店家人很好说话呢
19827981,8062066,5,0,0,0,15-05-25,非常好玩儿 没想到有那么多场景 很有趣 照的时候多想想动作和表情会更好看
19827981,117303948,5,0,0,0,15-05-24,还可以，可惜手机没电了，没能好好拍。
19827981,6032487,4,0,0,0,15-05-24,感觉没有那么强的视觉冲击感，门票价格有点小贵。不过前门好吃的很多哦，首推门框锅贴
19827981,9797471,5,0,0,0,15-05-24,不错，适合两个人过来玩。此处凑15个字
19827981,48343946,5,0,0,0,15-05-24,挺新奇的，没想到是两层。还不错。
19827981,49605242,4,0,0,0,15-05-23,带孩子去很有意思，就是地方太小！去的要按提示跟照相点配合……
19827981,121410692,5,0,0,0,15-05-22,挺好的。很有意境。不错不错。可惜有几个忘拍照了。
19827981,48661118,5,0,0,0,15-05-22,好玩！不过感觉不值！没有团购的话就不推荐了！
19827981,759615517,5,0,0,0,15-05-21,呵呵呵呵，不错，我是团购的，我和老公还有儿子一起去的，挺有意思的，孩子玩的很开心，呵呵，他的快乐就是我作为妈妈最大的快乐啦，
19827981,32100942,5,0,0,0,15-05-21,挺有意思的地方，很有创意，就是有点小，能在大点就更好了！
19827981,188256124,4,0,0,0,15-05-21,地方不大，但是场景还是很不错的，店家也很贴心，主动跟我们讲有储物柜可以放东西，拍了很多照片，和朋友一块儿玩还是很开心的！
19827981,162789369,5,0,0,0,15-05-20,地方挺小的，不过很有趣，一定要带个好一点的相机，最好再带上比较会拍照的朋友。
19827981,758113864,5,0,0,0,15-05-20,和朋友一起去的，非常开心。如果场景再多些就更好的了
19827981,140129474,5,0,0,0,15-05-20,图片很多，拍的很爽，位置在前门的最里面
19827981,599303969,4,0,0,0,15-05-18,男人说带我去怎么踩也不会化的冰激凌上，带我去恐怖电梯上兜一圈儿看起来和跳楼机的感觉一样还要让我见见明星这次算是看见了^_^
19827981,772602027,5,0,0,0,15-05-18,去了就是拍照片，挺好的，哈哈~~真的是奇思妙想啊
19827981,32955376,4,0,0,0,15-05-17,团购了点评券，好多人都去参观可惜人太多了不好照相，总体来说还是挺有意思的。
19827981,753908727,5,0,0,0,15-05-17,好好看看 有意思 一直都想玩的活动
19827981,5876694,5,0,0,0,15-05-17,要的很嗨，小长假去的也没有太多人，几乎所有都拍遍了，两三个人一个半小时就能玩遍，也不是很需要跟别人抢位子拍。
19827981,64505592,4,0,0,0,15-05-17  更新于05-17 13:17,特价买的，还不错，就是小点。。
19827981,18925754,4,0,0,0,15-05-16,周一去人那个少，拍照非常爽！之前也去过韩国的3D艺术馆，觉得这家的画质还有待提升，尤其是墙与地的衔接处有磨损，不够逼真，不过总的来说这个票价很值了~
19827981,4189957,5,0,0,0,15-05-16,好喜欢 就是有点小 不过照相还是挺好玩的
19827981,754085580,4,0,0,0,15-05-16,要穿漂亮衣服 画漂亮装 还要保证你男盆有的照相技术 你就很满意了
19827981,8578031,5,0,0,0,15-05-16,很好玩'还有我最喜欢的辛普森'就人多了点
19827981,129274966,5,0,0,0,15-05-14,很好玩的，妈妈和女儿都玩的非常开心。有机会还会再去的。
19827981,57280941,5,0,0,0,15-05-14,专门为拍张去的，场景还好，再多点就更好了
19827981,23517514,5,0,0,0,15-05-13,在前门，挺方便，挺好找，爱拍照的童鞋应该喜欢这里～～
19827981,196019371,5,0,0,0,15-05-13,挺有意思的'就是场景不是特别多'一会就走完了
19827981,115370246,4,0,0,0,15-05-13,拍照的好地方，很有创意。就是小了点。
19827981,1659404,4,0,0,0,15-05-09,当时一块钱抢的票，周末人挺多，排队进排了一小时吧，不过这样也好控制人数，里面不会显得特别拥挤的。3D的图不是特别多，我觉得还不如韩国乐天里免费的多呢，但是形式还算新颖，有趣。里面布局有点拥挤，互相拍照容易影响别人，还是场地所限制！个人还是推荐，票价不是团购略贵~~~~
19827981,2826155,4,0,0,0,15-05-06,为了躲雨误打误撞，还不错，虽然地方不大，但蛮有意思的。可是如果去的人去的人多了，会转不开吧。太密集了。
19827981,8447169,4,0,0,0,15-05-02,还可以吧 就是拍拍拍 
19827981,20164880,4,0,0,0,15-05-01,还不错，节假日是需要早些去，和姐儿们一起去的，她家的孩子玩疯了。
19827981,2194289,3,0,0,0,15-05-01,就还行觉得
