3341932,8662766,3,0,0,0,11-07-09,地处偏僻，要不是别人带着去，还真不知道这里还藏着个铁路博物馆，门票20元一位，太贵了吧，一共就一个厅几个火车，很多博物馆都不要钱了，这里还是20啊，算了，既然来了，去进去看看吧。不过这里周一闭馆休息，大家注意下，别白跑一趟。有学生证的可以带，我享受不了了呀..................
3341932,4050600,3,0,0,0,11-07-07,就住在附近，以前是出租给商户的，有永和大王，有麦当劳。每次在里面吃饭都觉得怪怪的。有些不伦不类。不过自从改为铁路博物馆以来，没有进去过，大多时候只是做为一个历史标志矗立在那里。
3341932,5337199,4,0,0,0,11-07-05,一到前门就能看到这个博物馆。
3341932,5482192,4,0,0,0,11-07-01,去逛前门大街的时候经常路过这里，只进去过一次，门票好像是20，里面讲的是铁路的历史，还有很多模型可以观看，我去的时候人很少，感觉这里如果可以免费就更好了
3341932,6586829,3,0,0,0,11-06-13,铁道博物馆就在前门这边，下了地铁前门站B口出来就能看到。每次到这都想进去看看，可惜由于种种原因都没能如愿，下次再来的话一定要进去感受一下~
3341932,8761916,3,0,0,0,11-03-29,路过N次没进去过，因为要门票，其实连国博都免费进了，你个铁路博还撑个什么劲哪，赶紧免费，做火车又不是不给钱，弄个博物馆还差个门票钱吗？
3341932,4186163,4,0,0,0,11-02-01,门票20元，半价票10元。里面分为地下1层和地上3层。地下1层展示青藏铁路、京沪高速铁路等沙盘模型。一层展示古代中国铁路历史，二层和三层是现代铁路展览。里面有个和谐号模拟驾驶器，收费10元。
3341932,3901495,4,0,0,0,10-12-31,单位组织去集体参观的。票价20元。
3341932,5546887,3,0,0,0,10-12-12,一直以来都默默沉寂于喧嚣的前门大街商圈地带，甚至一度被小商小贩所占据。但依然抹杀不了古建筑的百年风貌，尤其是夜色中的旧址建筑更现沧桑美景
3341932,4664705,5,0,0,0,10-02-07  更新于02-08 10:10,上世纪50年代末我初次去京，乘火车到达的就是前门火车站，记得是三座站台，人来人往熙熙攘攘，1个月后新北京站起用，旧站就停用了。那是一座典型的欧式建筑，上世纪60年代初先被改造成铁道部的科技馆；之后又改建成北京铁路工人文化宫，候车室则被改造成剧场使用多年；上世纪90年代，又被改建成“老车站商城”和“电讯市场”；直到2004年，前门火车站被划定为文物保护单位，原貌才得以恢复；可是改造过程中，钟楼左侧的部分建筑被拆掉，并在钟楼右侧重建，所以只有钟楼以北西墙和北墙西边一段真正保留了原有的结构和砖墙，其余的墙体都是改造后新建的钢筋混凝土结构。
3341932,3766923,5,0,0,0,10-02-07,就是原来正阳门车站旧址，已经渐成了100所年的历史，感觉那种沧桑感好像对我们诉说着什么。08年奥运正式像友人开放。~~
3341932,2512378,4,0,0,0,10-01-21,爷爷总跟我讲起 老北京的事儿
3341932,3853307,0,0,0,0,09-10-25,地处天安门广场东南侧的京奉铁路正阳门东车站旧址，在建成一百多年后的今天，掀开了它新的一页：作为北京铁路博物馆，展现在世人面前。去年八月北京奥运会开幕前正式向国内外观众开放。
