19827981,44445541,5,3,3,3,15-08-08,还算不错吧！不过感觉东西好像少了点。不过瘾
19827981,175304991,5,4,4,3,15-08-08,不是很大   但是工作人员很好哈～～
19827981,62468903,5,4,4,4,15-08-08,孩子喜欢的不得了，开心的照相，
19827981,299064217,4,3,4,2,15-08-08,和孩子一起不错，孩子说地方太小，门票不便宜。
19827981,19051361,5,4,4,4,15-08-08,给两个小朋友买的，评价超赞，值得去看
19827981,37955757,5,4,4,4,15-08-08,挺有意思的，各种摆拍，哈哈，一天很欢乐。
19827981,48538363,5,4,4,4,15-08-08,还可以，就是太少了，没尽兴，好评吧
19827981,21694856,5,4,4,4,15-08-08,挺好的，很新奇特，孩子很赶兴趣！
19827981,26746519,5,4,4,4,15-08-08,有意思～～～效果棒棒嗒～～～～
19827981,51721214,5,4,4,4,15-08-08,和小伙伴一起不错感觉！！！！！
19827981,547031,3,2,2,2,15-08-08,这种3D照相都大同小异，这家设置还很不错，不用团购直接买门票现在是优惠价65
19827981,161107105,3,2,3,1,15-08-08,电梯下来后基本没东西，有一点点上当的感觉
19827981,23399105,4,4,3,4,15-08-07,学生价比较划算，国外大大学得学生卡也可以用真的太赞！
19827981,768816590,5,4,4,4,15-08-07,好玩好玩 值得一去 女生不要穿裙子 照相不方便哟
19827981,147408733,5,4,4,4,15-08-07,今天来的时候人很少，基本上都照全了，很开心！
19827981,107148922,5,3,3,4,15-08-07,很不错的地方 挺好玩儿的 就是不是特别立体
19827981,19606852,3,2,2,3,15-08-07,大概半个小时逛完，感觉救值这个价位，甚至应该再便宜点，票价定在40～50比较好
19827981,797900462,5,4,4,4,15-08-07,还可以，有创意，风格独特，可以推广
19827981,6617224,5,4,4,4,15-08-06,价格还行40/元，图画道具很好很新奇，早点儿去人少可尽情拍照。
19827981,182232638,5,4,4,4,15-08-05,太小了，没几分钟转完了！价钱有点不值
19827981,116769740,4,3,3,3,15-08-05,很适合带小孩子来玩，不过空间有限，场景画面设计的不算多，如果不用团购感觉比较贵。
19827981,58928347,5,3,3,2,15-08-05,地方没有想象的大，而且应该打扫的干净点，，适合女生和孩子玩，，就是夏天热在室内玩耍比较好，图个新鲜而已
19827981,159797715,4,2,2,2,15-08-05,很有创意，适合朋友，情侣一起去，就是感觉有点儿贵了。
19827981,807538556,5,4,4,3,15-08-05,很不错，前台的小妹妹也很可爱，孩子很喜欢！愉快的玩耍吧
19827981,56982433,5,4,4,4,15-08-05,孩子非常喜欢，在前门大街上，玩得很开心
19827981,54526624,5,3,3,3,15-08-05,总体上还算可以，略有一点小小的失望，主要是各种照，虽是团购但也些小贵!
19827981,106439766,5,4,4,4,15-08-05,带孩子过去玩儿的，很有意思，孩子们喜欢。
19827981,797527578,4,4,4,4,15-08-05,虽然有点小，但是画的都很有趣。
19827981,59302471,5,4,4,4,15-08-04,很开心抽中了免费体验～来交作业～
19827981,802612490,3,2,2,2,15-08-04,还行吧！带孩子去的，一会儿就逛完了。
19827981,42551930,5,4,4,4,15-08-04  更新于08-04 21:14,挺好玩儿，值得一去，就是还没玩够就出去了，而且3人或以上去比较好～
19827981,60814069,4,3,3,3,15-08-04,地方比想象中的小 20分钟都足够玩一遍了
19827981,26038656,5,4,4,4,15-08-03,很好玩 也特别开森 还有点小恐怖呢
19827981,2401573,5,4,4,3,15-08-03,感谢被点评网抽中参加免费体验。
19827981,74677211,5,4,4,4,15-08-03,当失去的时候人特别少 所以没有包袱 玩的特别的HIGH 创意不错
19827981,750558764,5,4,4,4,15-08-03  更新于08-03 17:26,跟媳妇儿玩得好开心，以后一直要在一起，爱你
19827981,4160344,4,3,3,3,15-08-03,得到了体验的门票 感谢点评和店家哦
19827981,25811862,5,4,4,4,15-08-03,没有武汉的好 里面3D效果设计的不好 而且太挤了 好多照片都有边边
19827981,47698200,5,4,4,4,15-08-03,画很不错，就是人太多了，不过也证明受欢迎
19827981,58594909,4,3,3,3,15-08-03,各地跟风都建起这种3D照相馆，大同小异的，适合带孩子来玩，照相还挺不错。
19827981,766097042,5,4,4,3,15-08-02,孩子们玩的很开心也很尽兴，魔相很有特点尺度
19827981,53531740,5,4,4,4,15-08-02,挺好玩的，画面挺多的，人不算太多
19827981,22577944,5,4,4,4,15-08-02,超级棒！超级好玩，人不多哟～可以尽情照相哦！
19827981,22675946,5,4,4,4,15-08-02,特别有意思，人也不多，价格不贵，拍出来的效果非常好玩
19827981,336654450,5,4,4,4,15-08-02,一道来到这里，和杜莎夫人很近不错。
19827981,46742891,3,2,2,2,15-08-02,周日去的，人不多，但地方很小。
19827981,46711263,5,4,4,4,15-08-02,很有意思的地方，能够拍得很立体。
19827981,152310110,5,4,4,4,15-08-02  更新于08-02 12:23,非常好玩，各种三D效果都特别棒，拍了一个多小时呢，值得期待
19827981,34213761,4,3,3,2,15-08-02  更新于08-02 12:09,带孩子去的，还是挺有意思的，有点儿奇思妙想的感觉。稍大一点的孩子去更好一些，太小的宝宝有时候不能体会里面的含义，表情也不太能配合那些场景。
19827981,93073178,4,4,3,3,15-08-02,总体还可以 团购的40块也挺划算！ 就是里面人比较多！ 照相都要排队，还有的人老挡在前面，，，差评 希望以后控制进厂的人数 感觉景有点儿少 没什么新意
19827981,780825075,5,4,4,4,15-08-02,不错 很好玩 就是有些小 场景少了点
19827981,4083145,2,2,2,2,15-08-02,非常凑乎，地方很小，人一多没法拍照
19827981,34899103,4,3,3,3,15-08-02,还不错！有些地方的创意没标清楚，不知道该怎么照
19827981,81986269,5,4,4,4,15-08-02,挺好的，非常喜欢，玩的很开心，哈哈哈
19827981,22961184,5,4,4,4,15-08-01,一直用这个牌子 很好用 信赖        你
19827981,6438503,3,1,3,2,15-08-01  更新于08-01 20:54,一直想带孩子去3D照相馆去玩玩，感觉今天凉快就三人一起找过去了。团购价格，再加上优惠券，三个人一共花了105，价格倒是不算贵，只是三岁小娃娃要是可以免票，那就更好了
19827981,23096677,2,1,1,1,15-08-01,非常一般，就是一些夸张的图片。不值
19827981,34973282,5,4,4,4,15-08-01,照相的好去处。就是找位置不好找
19827981,808781286,5,4,4,4,15-08-01  更新于08-01 19:38,总体还可以，也没啥的，就是拍照，半小时就完事了
19827981,752755789,5,4,4,4,15-08-01,团购参观好划算。。。。。。。。。
19827981,136720904,4,3,4,3,15-08-01  更新于08-01 18:00,感觉还不错，但是俩人没有带自拍杆是件失误的事，最好人多一点更好玩，就三层，人不是很多，可以尝试。
19827981,755125004,5,4,4,4,15-08-01  更新于08-01 17:45,挺好，人不算多    要是几个人一起就更好了。
19827981,6840906,5,4,3,3,15-08-01,特别不错，有幸抽到大众点评的免费门票！就是场馆小点，而且我是自己去的，一个人去的，一个人去的，一个人去的……实在没法照相啊！呜呜，不开心
19827981,55115973,5,4,4,4,15-08-01,地方小的，孩子喜欢！反复看了几次！
19827981,52916240,4,3,3,3,15-08-01,总体而言还算不错，孩子们都玩的很开心，就是里边的地方有点儿小
19827981,9158784,5,4,4,4,15-07-31  更新于07-31 17:33,同事介绍过来的，比较不错，适合儿童拍照玩，带着孩子和老人过来的，照的非常高兴，里面不是很大，总共三层，服务员不是很多，只看见三个，没用多长时间就逛完了，不过照的背景非常奇特，孩子和他爸爸玩得挺高兴的，照了好多的照片，团购的还算便宜吧，总体满意
19827981,3952345,3,2,2,2,15-07-31,很幸运抽中，谢谢大众点评。简单介绍下，总体来说一般，太小了，一会就逛完了。设计还可以，3D效果还成。位置很好找，是3层小楼
19827981,41461802,5,4,4,4,15-07-31  更新于07-31 15:50,非常好：）还会去玩哒 孩子喜欢
19827981,113107757,5,4,4,4,15-07-31,孩子对这个挺感兴趣的，觉得很值得一游
19827981,765072812,4,4,4,2,15-07-31,就是有点小贵哦！拍照片确实不错 不过我们也没时间细琢磨...嘿嘿
19827981,391956,5,4,4,4,15-07-31,挺有意思的地方，人多可不方便照相
19827981,107591011,5,4,4,4,15-07-31,还可以。值得体验一次。但也就一次够了
19827981,192812055,5,4,4,4,15-07-31,一大群人玩的很high哦  还回来
19827981,194772047,5,4,4,4,15-07-31,亲子票很实惠，跟弟弟来的，划算，都去第二次了，
19827981,6000414,3,3,3,2,15-07-31,地理位置好 景点太小 玩不了一会儿 设施需要更新
19827981,155818159,5,3,3,3,15-07-30,还好～可玩的地不多～一会儿就转完了
19827981,24652517,5,4,4,4,15-07-30  更新于07-30 21:03,抽中了体验去玩儿，不用预约，工作日人不太多。很好玩儿，值得和朋友去玩一下的地方，而且有团购学生票，很划算。馆有三层，外面看着不大，有几十个场景可以拍照，每个都特别有创意。可以请工作人员帮忙拍照，每个场景都有示范的图片，适合拍照的指示地标，特别贴心。一楼有咖啡馆，韩式的，可以写许愿卡，有纪念意义，比起前门只能逛的商店有意思多了，还可以在咖啡店歇歇，就是价格有点贵，没有卫生间。里面的装饰连电梯的超人图案都很有趣用心。新开的店在搞活动，发朋友圈还送小礼物。
19827981,801018066,5,3,4,4,15-07-30,感觉很不错，玩的很开心！！！！！！！
19827981,2344621,1,0,0,0,15-07-30,点评同城活动抽中的，28号才有空去，可惜没去成。已经到那里了，验证兑换码时出了问题，工作人员说验证不过去，他们的验证码都是10位数字的，点评给我的是9位数。当时是下午，大热天的，我也懒得给点评客服打电话了，那个工作人员也没别的解决办法，只好放弃了，不过还是要来点评下完成作业。最后附上点评给的兑换码。
19827981,33404682,5,3,3,3,15-07-30,还行 就是必须要带学生证 孩子们一看就是小学生 还要求拿学生证 我们是外地游客 最后好不容易说服让进
19827981,167402063,4,3,3,1,15-07-29,临时团的票，人有点小多，不过还不错。
19827981,778326698,5,4,4,4,15-07-29  更新于07-29 21:15,点评秒杀了他家的门票，一直没时间过去，有效期很可爱，正好前天路过就决定进去看看，因为害怕人多，中午十二点去的，结果发现人还是很多，门口验证，没有门票直接进去，中间要是上洗手间什么的票就废了，建议小伙伴提前去好洗手间，免得浪费，进去之后乍一看就是普通的图，实际拍出来就是完全不一样的效果，很有意思，旁边还有攻略，不错！
19827981,97379157,5,4,4,4,15-07-29,还是很有意思的，我挖掘出了我的逗比潜能
19827981,27078015,4,4,3,3,15-07-29  更新于07-29 16:43,像其他网友说的，地方不大，摆放很紧凑，每个场景旁边基本都有提示图片，好像芭比那个场景的被人拿走了。另外，只有一层入口有一两名服务员，二层三层都没有，如果有什么事情发生都不知道，尤其是史瑞克那个场景有半个身子真的很可怕，建议多招聘服务员，每层一两个，还可以帮消费者拍合照，要不然都不好照相，还有安全隐患。总体还是比较满意
19827981,32453234,5,4,4,4,15-07-29,孩子们的天堂，童真一回，傻傻的笑
19827981,21947255,4,3,3,3,15-07-28,还可以，和朋友一起来的，人不是很多，基本都能拍到，在前门步行街，但这个现在已经不是特新鲜了
19827981,6638834,5,4,4,4,15-07-28,不是周末去的，人没有想象中那么多，环境很好，不错
19827981,94218045,4,3,3,3,15-07-28,孩子玩得比较开心，全程耗时1小时吧，周五下午去的，没什么人，不用排队，喜欢拍照的同学适合去，就在kfc对面，还是比较好找。
19827981,172201445,5,4,4,4,15-07-28,宿舍的团体小活动、很有意思、就是照相去了～
19827981,6020248,5,4,4,4,15-07-27,场景还算够多，但是去过一次就不会去第二次了，就是个新鲜感
19827981,18951083,5,4,4,4,15-07-27,免费抽中很开心！！因为小妹放暑假，所以吧机会让给他用啦！跟家人一起去的。就在前门大街一直一直走，对面是肯德基。不远处也有杜莎夫人馆，但是比这个贵很多。环境不错，门面不太大，里面还可以，足足可以逛上半个小时。前门也是可以溜达二三十分钟嗒。总之就是很赞哟！
19827981,13967016,5,4,4,4,15-07-27,还不错。还有建议拍照的位置还有sample照片。空调也很足。
19827981,4023714,4,3,3,3,15-07-27,北京这样方不多，有一家在国瑞城，算是夏日里不太受罪的娱乐活动吧。。。
19827981,44939568,5,3,3,3,15-07-27,来北京7年了，第一次听说这地方，非常有趣。
19827981,32425825,5,4,4,4,15-07-27,还好吧，儿子拍了许多照片，他喜欢就好╭(╯ε╰)╮
19827981,35777811,5,4,4,4,15-07-27  更新于07-27 12:48,免费抽到的 来玩了 真心不错 希望下次中奖的还有我
19827981,26735714,5,4,4,4,15-07-27,非常开心中了这次体验，去年的时候单位组织集体去过一次
19827981,9212936,4,4,3,3,15-07-27,还行吧！就是有点小，东西有点少
19827981,788598953,5,4,4,4,15-07-27,离家进，孩子比较喜欢，老有的不是很喜欢，在多些项目。
19827981,8866145,3,2,4,4,15-07-27,布景没有意思，有几个比较特别，希望以后能新增更好玩的
19827981,58454655,5,3,3,3,15-07-26  更新于07-26 23:01,挺好玩的，就是样子少了点，还有就是没有停车的地方，有一个设计超烂的小停车场经常堵的一塌糊涂，建议还是坐地铁去吧千万不要开车
19827981,180252147,4,4,4,4,15-07-26,还不错带孩子是个不错的选择，很好找！下次还会去
19827981,31157318,5,4,4,4,15-07-26,去的时候人不多，里面很好玩儿。
19827981,195783971,5,4,4,4,15-07-25,非常满意!孩子非常喜欢玩!非常开心!
19827981,15678771,5,4,4,4,15-07-25,非常棒！团购还是比较实惠。孩子比较喜欢
19827981,47541462,5,4,4,4,15-07-25,地理位置很好哦，就在前门步行街上。
19827981,33952204,5,4,4,4,15-07-25,挺好玩的，场景很多，玩了大概一个小时吧，拍了好多照片，喜欢。
19827981,176205257,5,4,2,3,15-07-25,没有服务。人不多。地方比想象中的大。还不错吧
19827981,3758220,5,4,4,4,15-07-25,照相很有意思，奇思妙想很搞怪。
19827981,4516050,5,4,4,4,15-07-25,没有失望，虽然不大，但很有意思 一直在照相
19827981,140531030,5,4,4,4,15-07-25,很有趣，可以带孩子来照相玩儿，奇思妙想
19827981,44744027,5,4,4,4,15-07-25,不错的地方，比王府井好多了！………
19827981,117968546,5,4,4,4,15-07-25  更新于07-25 11:41,带宝贝来玩，很开心，下次还会来
19827981,24858080,5,4,4,4,15-07-25,孩子很喜欢，不错的去处。下次还过来。
19827981,593807,5,4,4,4,15-07-25,第一次抽中点评的霸王餐，好开心。
19827981,84047837,5,2,2,2,15-07-25,还行，但是不如另一家3D艺术馆好
19827981,7603523,4,3,3,3,15-07-24,第一次在同城活动中中奖，获得了“奇思妙想魔相馆3D单人参观票免费”的机会，所以就和小伙伴一起去参观。
19827981,123955864,5,4,4,4,15-07-24,很有趣～值得一看的地方，父母拍照时都逗乐了～
19827981,751030538,4,3,4,4,15-07-24  更新于07-24 17:18,团票很划算，售票的两位美女很赞，善解人意。经验是一开门就去，人特少，拍照不排队，表情随便做，不尴尬。
19827981,40655680,5,4,3,4,15-07-24,还不错！孩子很喜欢，适合带孩子来拍照，体验，就是小点要是再大一些内容在丰富一些就更完美了
19827981,26843308,5,4,4,4,15-07-24,很好，玩儿的挺高兴，团购很划算
19827981,8298636,4,3,4,2,15-07-24,价钱不便宜，但是能玩的很少，面积太小了，去了济州岛的活生生之后回来带着爸妈过来玩，但是玩的不尽兴
19827981,130746570,5,4,4,4,15-07-23,团购去的  仨人照了好多相  还不错  就是人多的时候感觉有点挤
19827981,4598418,2,0,0,1,15-07-23,人多，简陋，闷热，道具简单，空间狭小，需要改进！
19827981,30757805,5,4,4,4,15-07-23  更新于07-23 13:01,又一次抽中了体验～这次是3D照相馆。一年前这种照相馆就开始在朋友圈风靡，一直都没去，去韩国的时候因为太累了也没去成，这次抽到了体验就带老公来玩玩～
19827981,2651048,5,4,3,4,15-07-23,地方不是很大，但场景不少，挺有意思
19827981,41094254,4,3,3,3,15-07-22,和朋友去的 挺好玩的 第一次去 玩了一下午
19827981,36770993,2,3,3,3,15-07-22,一点也不划算，适合小朋友去玩耍。
19827981,10699533,5,4,4,4,15-07-22,很适合照相的地方，很不错，不过去一次也是够了
19827981,6352256,5,4,4,4,15-07-22,很高 为什么会有15字的限制呢？
19827981,109727613,5,4,4,4,15-07-22,还不错，我们团购的50元，到店验证之后非团购发现45元，呵呵，为什么服务人员非要在我们验证以后再吆喝原来有更便宜的。
19827981,768365472,5,4,4,4,15-07-22,挺好的，弟弟玩的很开心！！！！
19827981,31851563,5,4,4,4,15-07-22,位置：前门的步行街上，招牌很大，容易看到。
19827981,2708864,5,4,4,4,15-07-22,很幸运抽中了大众点评的人免费体验～验证很顺利报了手机号核对ID就进去了玩儿了～场馆很大有三层，还有为顾客拍照的服务，只需按下铃很周到～会介绍给亲戚朋友，让他们也来体验一下有趣的3D魔相世界
19827981,97256896,5,4,4,4,15-07-22,人少的时候还可以，带孩子玩一玩。
19827981,2980477,5,4,4,4,15-07-21,很有意思，儿子很喜欢，只是需要排队
19827981,120457049,5,4,4,4,15-07-21,孩子喜欢玩，地方不大，挺过瘾的
19827981,86468642,5,4,4,4,15-07-21  更新于07-21 08:22,挺好的价格便宜 附近也有好多北京小吃什么的 就是地方不好找 不过和姐们去的挺好玩的 距离地铁口近  服务态度也挺好的 里面东西感觉也挺全挺好的 拍出来的效果也不错 人也不算拥挤 朋友我和泰迪像就让我和它合影 已上传到朋友圈 都在问我哪儿拍的照片 已经推荐
19827981,28660303,5,3,3,3,15-07-20,还不错 就是需要拍照好的朋友去帮忙
19827981,37057010,5,3,2,2,15-07-20,挺好玩的 各种拍拍拍 有的能找到好的角度和构思 但是有的根本就没有效果
19827981,4374433,5,4,4,2,15-07-20  更新于07-20 18:02,中了免费体验，周日晚上五点去的，人不太多，但有时拍照也要排队或互相错开现拍别的，感觉人气还是挺旺的，还有韩国人去玩。拍照的场景还是挺多的，在里面玩了两个半小时，都拍到了。多约点朋友一起去会更有意思，不过拍照也需要一点技巧才能拍出效果，拍前建议参照下墙上的提示。虽然整体感觉不错，但还是要提两个小建议，一是建议场馆里安排一些工作人员指导并帮游客拍合影，或者提供有偿的全程帮助拍摄服务。二是门票价格有点贵，建议多搞一些优惠活动。
19827981,772223514,5,4,4,3,15-07-20,女儿和儿子一起去的，早就听别人说那里有多好玩，今天终于实现了
19827981,56645329,5,4,4,4,15-07-20,很好玩的地方，团购很值得，有两层的地方里面很宽阔，场景也多，地方很好找就在前门大街上。
19827981,184344600,5,4,4,4,15-07-20,位置不太好找 其他一般。。。。。。
19827981,33570071,5,4,4,4,15-07-20,还不错 不过至少同行三人比较好
19827981,29104351,4,3,3,3,15-07-20,很好玩，就是太小，不尽兴啊，能大点就好了！
19827981,2561409,5,4,4,4,15-07-19,非常好玩，还会再来的！非常好玩，还会再来的！
19827981,50600724,5,4,4,4,15-07-19,很好很满意，小孩子很喜欢玩的很开心！
19827981,14904850,5,4,4,4,15-07-19,拍摄出来的效果很好！孩子玩的很happy！
19827981,231417,4,3,3,3,15-07-19  更新于07-19 13:39,感谢点姐抽中了我体验奇思妙想～
19827981,17690955,5,4,4,4,15-07-19,大众点评秒杀了一张券，带了个摄影师去，特意又团了一张，不贵，而且里面挺好玩的，布景都很有创意，周末去人还不多，不像旁边的杜莎，门口挤满了人，估计照相得排好久队吧
19827981,37626019,5,4,4,4,15-07-19,地方有上下三层，拍照很有意思，建议上午早去，人少
19827981,42159175,4,3,3,3,15-07-19,带着小盆友玩很不错，就是太小了
19827981,50656822,4,3,1,3,15-07-18  更新于07-18 23:02,整体感觉还行
19827981,50601389,5,4,2,4,15-07-18,比较有意思 服务态度一般 和朋友玩的很开心
19827981,36708864,4,3,3,3,15-07-18,一般般。东西不是特别多有点挤。可能去的时候是周末，人本来就多。但是呢，团购一下也没那么贵，凑合啦
19827981,56589145,4,3,3,3,15-07-17,还行，就是内容有点少，如果用原价不划算
19827981,766885469,5,4,4,4,15-07-17,因为天气和不是周末的原因，人很少。我们玩的非常开心，照片特别有意思
19827981,7040358,5,4,4,4,15-07-16,快关门的时候去的，没啥人，很不错哈哈
19827981,23491000,5,4,4,4,15-07-16,奇思妙想魔像馆，在前门步行街上。很好找。
19827981,4778761,4,3,2,3,15-07-15,非常好，我们同事看过照片之后都问我在哪
19827981,51102392,5,4,4,4,15-07-15,还不错，就在前门，其实就是大的图像。。。
19827981,103799332,3,2,2,2,15-07-15,一般，场景不多，带小孩随便转转还可以，大人玩不太适合
19827981,17919576,5,3,2,2,15-07-15,算是北京不错的了，只不过有些有点儿假
19827981,21143299,4,3,3,2,15-07-15,虽然很多人说一下就逛完了，但是因为人多，其实还是能逛两个小时的，人没有多到人挤人，一般每一个场景等一两个人就好了，毕竟周六。
19827981,165256028,5,4,4,4,15-07-14,不错的一次亲自活动～孩子玩的挺高兴！很有创意
19827981,120351039,5,4,4,4,15-07-14,两个人去的 里边照相非常有意思
19827981,35242561,5,4,4,4,15-07-14  更新于07-14 21:00,特别荣幸被大众点评抽中此券，不来不知道啊来了才知道高科技发展太迅猛啊，说的奇思妙想魔相管，简直是一次大开眼界啊，太有意思了，各种想不到的景象都看在眼里了，第一次来的这种奇妙的相管，和老公一起去的，要不自己也照不了相，老公花了65元的门票进去的，我觉着这里面就是适合年轻的小情侣玩，得玩嗨了，像我们老夫老妻的了也来找一下年轻时候的感觉，还是喜欢这里的情景，以后还会带着孩子一起来玩，今天没有带孩子来挺遗憾的，等孩子在大一点就可以带着一起来玩了，老公觉着还可以说应有意思的，总而言之我们还是会再来的。
19827981,24204047,5,4,4,4,15-07-14,很高兴中了点评的免费体验，第一次玩这种3D体验馆，大热天的，来这种室内的游戏最靠谱。
19827981,119190534,5,4,4,4,15-07-14,第一次来三D馆，有团购还挺值得。一层人很多，继续往里走上楼，人就少了，也更好玩了。每个情景边上都有个小相框告诉你如何拍照摆姿势，拍出来效果还是挺好的。就在前门大街上，位置很好找。
19827981,8092139,4,3,3,3,15-07-14,感谢大众点评中活动。位置很好找，在前门大街KFC对面，七号线比二号线近。进门工作人员已打印好所有大众的会员资料，找一下即可。我是晚上去的，只有两组人员，所以照照片很爽。有两层，场景还挺多的。门票价格如购买比较贵，但在前门这种地方吧，便宜了估计连租金都不够
19827981,3114356,3,2,2,3,15-07-14,携程网指定日子提前买票不能退票的价格是18超级划算，果断周末约上小伙伴去耍，本以为暑假档会人山人海，其实倒是还好，场景不是很多大概二十来个，但每个都愉快的拍皂了～～又是爬又是蹲的其实还是蛮累的～～
19827981,37438900,5,4,4,4,15-07-14,孩子大人玩的都挺开心，地方能在大点就好了
19827981,123422898,5,3,4,2,15-07-13,在前门很明显的位置，人很多，就是里面的地方很小，拍几张就完了
19827981,26567876,3,2,2,2,15-07-13,只能说还行，去的时候还有在装修的，地方不大，。
19827981,53592559,5,4,4,4,15-07-13,很好玩，带孩子去色，很有创意！
19827981,37643096,5,4,4,4,15-07-12,很有意思！孩子很喜欢！效果杠杠的
19827981,6511438,3,2,3,1,15-07-12,场景还可以，但拍好了还是需要表情真情投入的。50大洋略有小贵，不过高兴就好。
19827981,35900496,5,4,4,4,15-07-12,听说不错帮姐姐团的 照了很多照片回来
19827981,2924244,5,4,4,4,15-07-11,非常满意！我和男朋友一起，周六晚上八点去的，九点闭店，所以人不是很多，每个布景都拍了，一个小时刚刚好！
