58807265,69777791,3,0,0,0,12-09,新国展搬到顺义后第一次来，场馆比原来老国展大了很多，环境也很好，适合做各种展销会什么的，门口的行车路线有点不畅，可能活动时候就这样吧。停车费5元每小时。
58807265,13393179,5,0,0,0,11-18,国际展览中心新馆，在顺义区，地铁15号线国展站即是，离首都国际机场很近。地方很大，今天去看了世界食品博览会，这个展览只用了国展八个展厅中的两个，就已经很大了。可以品尝世界各地的美食，当然喜欢的也可以买回去啦，不过价格嘛，你懂得……在里面逛了两个小时都快吃饱了哈哈，有一种俄罗斯的饼干特别好吃……犹豫了好久还是因为心疼银子没有买……据说这里最有名的是车展，下次可以再来看看～
58807265,637812,4,0,0,0,10-31,新国展地处顺义，依着京密路（京沈路），面积大，场馆多，最常用的E1-E4，W1-W4，无论是参展的还是观展的，停车是个头疼的事，停车费姑且不论，主要是堵车，如果想要开进展馆里面的停车场，比如南面的，需要开进去再调个头，10几分钟常事，遇到路边停满的时候，这里要说组织和管理真是北京的弱项，这个跟上海会展比起来都是泪。进过实地考察，有个好的建议，免费还省时省事，展馆南停车场对面有个中石油加油站，这条路直接通到京沈路，可以把车停在这条路边上，前提是还有位置，土路、地铁线下面，不贴条，如果没有干脆停在京沈路的南面，周边小区和工业区都行，除了免去排队停车，最大的好处还有观展完毕，抬腿就走，直接上主路。观展没什么好说的，遇到车展等人气展会，建议先到总服务台拿一份观展指南。
58807265,63335203,4,0,0,0,10-28,中国国际展览中心(天竺馆)最有名气的展览非车展莫属了，每次车展真的是吸引了无数聚光灯还有车迷模迷们来看。周围环境不错。
58807265,10897837,4,0,0,0,10-20,This exhibition center located nearby the airport which is easier to get there by taking the plane.
58807265,10221856,2,0,0,0,10-19,地铁新国展这有一站，在展馆东侧，步行10分钟左右可以到展馆南门。CWP2016组委会脑残把入口规划到西门，要走很长一段路，以往都是南门出入。安保都是呆头呆脑临时雇佣的。
58807265,4807565,3,0,0,0,09-22,今天来这边参加展览，地铁很方便，15号线国展站出来就是，一出地铁，妈呀，太脏了，地下都是各种垃圾，跟无语，我以为新国展各种高大上呢。好几个展馆，分不同的展。感觉场馆很破旧的感觉，这不是新馆吗？我太好奇了
58807265,133956331,4,0,0,0,09-19,地铁新国展站出来就是啦，离机场不太远。
58807265,707580,4,0,0,0,09-16,经常要去北京参加图书博览会，前几年都是在三环里面的老国展，但是由于受展馆面积的限制无法承揽更多的国内外展商，于是就搬到了离机场很近的顺义区新国展。地方确实很偏，坐地铁十五号线可以直达，以前北京地铁都是两元一票制，现在改成里程计费，所以每天的交通费也就水涨船高了。
58807265,23753788,4,0,0,0,09-03,没看过车展但看书展也不错。
58807265,36233527,4,0,0,0,08-28,很大很大！地铁站都像纪念馆……把我们给走傻了_(:з)∠)_ 需要插门票进去的 不过五点就关门轰人了 国际图书展里面好多国家的绘本小说展览~又长见识了 还能拿到免费的小扇子和明信片 没有赶上导盲犬珍妮的活动……真是好可惜啊
58807265,48905913,4,0,0,0,08-25,地铁十五号线国展站下车，出站就可以看到，走路五分钟，非常方便。这次是去北京书展暨国际图书节，里面还有手帐集市，活动很多。遇到马来西亚知名大厨大显身手，现场气氛很热烈，还有试吃。童书展位占了很大比例，孩子们有好多互动活动可以参加。孔夫子旧书网的读赠活动也是人气爆棚。有个展位外文特价书二十一本，品相不错，性价比高。
58807265,142266734,5,0,0,0,08-25,来顺义新国展参观第23届北京国际图书展，开幕头一天，人不算多，但是几乎没折扣，都打算留着放在周末或者结束那天招揽人气呢。从我家到目的地还真近，坐地铁6号，换14号再换15号，才用了一个小时。A出口过马路就是东门，安检购票，这里得票是20元，是大门票，官网可以领免费大门票，里面有些区域，比如儿童国际绘本展就是要额外购票的，不便宜呢。我们今天过来是担任亲子平台的小主持人的，录像完毕还有几个小时可以看书，不过儿童图书和益智玩具展位太多了，我和孩子都眼花缭乱了。场内有免费wifi，人不多还算凉快，周末情况可想而知，吃饭不是问题，有很多快餐店，30元上午餐起步，不过不能赶饭点儿，最好自己带吧。
58807265,120293604,5,0,0,0,08-25,第二十三届北京国际图书博览会于2016年8月24日至28日在中国国际展览中心新馆举办。该展已在国展新馆举办过五届。本届展出面积约为7.8万平方米，参展企业单位预计将有二千多家，展品包括各类图书和音像制品。
58807265,35882475,4,0,0,0,08-13,作为一个姑娘却很喜欢车大概也是少有了……
58807265,2048441,4,0,0,0,07-29,改装车展在这搞的，来看了看，一个小型的展会
58807265,4975202,3,0,0,0,07-25,车展来过几次 把车停一个大空地免费坐车去。里面很大 水十块钱一瓶 一般般吧 比市区的痛快
58807265,2808948,4,0,0,0,07-25,很热的一天，我们乘坐地铁来到新国展。地铁口到展馆的距离并不遥远，但是烈日当空，步履艰难。
58807265,194694071,4,0,0,0,07-20,位于顺义天竺地区，新馆建成后这里就一直承办大型展览，尤其车展，人满为患。
58807265,4110276,4,0,0,0,07-10,感谢试驾协会的免费赠票 汽车改装展在新馆 南门停车 3号馆还有户外试驾活动 太热就没去室外 馆内还是很凉快的 休息区还有很多座位 各种改装上色 涡轮 排气管 底盘 音响还是很齐全的 还有礼品赠送 最后一天过来人不多 展览到下午两点结束
58807265,5398965,4,0,0,0,07-09,占地挺大，有4个展馆，下地铁向西就到了。到这里看的2016改装车展，很多品牌，让人眼花缭乱，当然车模也挺显眼。国展的空调还是很给力的。此次还可以看漂移和体验卡丁车。
58807265,8144314,5,0,0,0,06-22,1979年04月 经国务院批准，北京市领导发文同意贸促会征用北京市朝阳区太阳宫附近20万平方米的土地作为外贸展馆土地。
58807265,748873,4,0,0,0,06-15,每次到北京来参展都是来的这里。地方在天竺镇，离首都机场很近，大概也就六七公里的样子。地铁15号线就在展馆门口，站台就叫国展站。还是非常方便的。整个国际展览中心还是很大的，分8个展馆。有E1，E2，E3，E4，W1，W2，W3，W4，每一个馆的面积都有上万平米。进口有两个，东进口和南进口。东进口比较空，南进口相对较挤。
58807265,123851619,4,0,0,0,06-11,展馆很大，车展很成功，看到了许多❤️车呢，下次还去哈
58807265,3828467,4,0,0,0,06-09,顺义的国展，第一次来，坐地铁的话很方便，直接十五号线就可以到，很容易找到，出了地铁就可以看到场馆。动漫展在这办的，来的人很多。
58807265,2133485,3,0,0,0,05-25,五一期间去看车展，第一次去新国展，真的好远，地铁倒了好几趟线！新国展很大，赶上车展人多，逛起来好慢，最后都找不到出口了。。。。不知道是人挤人还是馆里根本没开空调，反正超级热！每个馆之间有小花园，绿化的还不错，有椅子，供人休息！馆里餐厅很多，麦当劳、俏江南快餐、丽华快餐、costa咖啡。。。。。每个馆里都有吃饭的地方，总之很方便！馆里保安培训不到位，咨询楼上会议室位置，多个保安都表示不知道！
58807265,8747781,4,0,0,0,05-24,从投入使用以来，现在每届北京车展都在新国展顺义这里～感觉这里最大的问题就是停车场里展馆有点远……都是在外围～虽然开通了了15号线～可是对于我来说没有什么意义～从没感受过地铁带来的便利……每次都是开车前往，停车是最伤脑筋的……想图个省事少走几步弄不好就会被贴罚单……新国展真的很大～去了3届车展都没完全走遍过……新国展分东西两区～两区又被分别分成4个小展区～真的挺大的……但里面的休息区不多～赶上人多的时候……吃个饭都是站着解决的……到今年为止，餐厅数量增多了～但是用餐区的座位永远是供不应求～每次去那里也只为看车……其他的都没太在意……
58807265,6688521,5,0,0,0,05-23,近期第二次来这里了，本次是2016年交通运输设备展，来自各大整车企业、配套企业的众多参展商参加展会。
58807265,4008867,3,0,0,0,05-23,这回可以好好的来车展看车了。
58807265,22638337,4,0,0,0,05-22,去那参观一个机械方面的展览，还不错。
58807265,35683883,3,0,0,0,05-21,车展人超级无敌多啊，工作日也是人山人海。
58807265,31290036,5,0,0,0,05-20,2016北京车展就在这里举办。虽然车多人多，但是很有秩序。展厅比较大，参展的车辆品牌比较全。今年有幸参观了此次车展，见到了很多亲民汽车，豪车，还有感念车，大饱眼福。现场有很多赠品，还有免费的水和牛奶喝。
58807265,3233653,3,0,0,0,05-05,第一次到中国国际展览中心看车展，人非常多，展馆也超级大，走了大半天也没走全，只能挑些有兴趣的看看。因为人比较多的关系吧，展馆里有些热，一开始没找到休息吃饭的地方，后来发现麦当劳，赛百味，costa一应俱全，只不过价格略贵，做出来的东西比较难吃。总之，看展览还是不错的，推荐。
58807265,776863144,3,0,0,0,05-04,本来对车展一点兴趣没有的，但是老弟在重庆不能来，让我帮忙看看有没有什么新款车，于是就去了，真的好远呀，坐地铁14号线转15号线，一个半小时。 到那里就已经饭点了，打了个车去中粮祥云吃饭，路过车展停车场，好堵呀，门口那两个疏导的保安简直就是废物，还不如不疏导呢，一点效果没有。 
58807265,296589,4,0,0,0,05-03,没有了车模，人依旧挺多的，微信扫码的也不少。
58807265,5305785,2,0,0,0,05-03,我是第一次参加车展，但是真心觉得这家车展好烂……活动少、导购都摆着张臭脸、询价咨询都不耐烦、门口一堆黄牛。南侧出口封闭，要绕好大一圈才能出去打车或者去南边的购物中心。洗手间脏的要命！周边交通拥堵严重，私家车停车场离展区很远，连带着把周边交通全毁了。反正是一次很差的观展体验，来回要小四个小时，还没看到什么好东西！
58807265,22252561,5,0,0,0,05-03,5月2号 去了趟2016北京车展 趁着五一最后一天休息去的 没长大的大下雨天人还是这么多 今年车模不多 车子都很酷 看的心里痒痒的 还是得有钱啊哈哈 觉得场馆也没点评里说的那么乱 整体还好
58807265,6804939,5,0,0,0,05-03,进场一定要先拿地图，展区挺大的，整体划分比较明确，有地图就很明白～停车场有摆渡车，5月2号去的车展，下雨，停车场全是泥加水，特别难走，弄的车上都是泥。建议开车的朋友，下雨天要多准备纸巾，最好备一双鞋在车上～
58807265,9392194,5,0,0,0,05-02,位置在顺义区，地铁15号线直达。交通很方便，感觉乘坐地铁前往比开车要方便。
58807265,52868912,4,0,0,0,04-30,2016北京国际车展，作为汽车爱好者的我又来啦！
58807265,4081179,5,0,0,0,04-29,相比上次来感觉好很多，服务人员虽然都很累但是还都在强打精神恪守本分，辛苦了各位！奔着奔宝和粪叉子来的，不知道是不是因为今年没有车模的缘故人少多了，之少可以走的动了，呵呵！可能五一期间人流量会加大吧！进去先找服务台领一个观展指南，很清晰的标着各个品牌再各个馆的具体位置，不用像没头苍蝇一样乱找，当然，如果你方位感够强的话！
58807265,42247702,3,0,0,0,04-28,这应该属于最后一次参与这次的车展闹剧了。
58807265,5886593,4,0,0,0,04-28,累垮，北京车展，来国展逛逛
58807265,5173958,5,0,0,0,04-27,场地很大。最近车展。人多车多的。周围还都是黑停车场。展区各个品牌都有。划分的特别清晰。今年的车站不再有露骨的车模了。各种大牌明星啊。陈小春最炫了。红色的发型。炫酷。而且车型什么的都有超吸引眼球。真心不错。
58807265,56160410,3,0,0,0,04-27,相比于2014年的车展，这块场地依然没有什么变化，而且管理还是那么混乱。出场馆的时候，在西门绕了半天，楞是被安保人员指着兜了三大圈儿……套用朋友圈里一段话，北京车展观后感：1.不熟悉场地的情况下，请原路进退，不然手机没电你就跪了；2.请不要让手机没电；3.不能拼模特，可以拼前台；4.不能拼前台，可以拼购车顾问；5.要不干脆做个地头蛇，我就上模特了你能把我咋滴？6.韩国艺人谱儿最大，出场封了半个馆；7.权志龙还是不认识，但是混混封路王从此留下了坏印象；8.容朕想想...
58807265,59907484,5,0,0,0,04-25,事隔多年！再一次目睹车展！朋友帮弄了一张车展的免费门票！跟朋友一起来帮忙！当一回媒体人！这次主要看的长安的！说心里话！国产车也还算不错！不论是外形还是内饰！在或者是舒适度上都还可以！关键价格还公道！看图吧！
58807265,2295038,4,0,0,0,04-25,跋山涉水来这里看车展！场馆里实在是太热了！太热了！
58807265,3415186,3,0,0,0,03-08,这里经常会搞一些展览，大展小展都不少，每次都是人多，车多，这回也不例外，开车肯定是堵你没商量，从京顺路上就开始，一直进去到空港工业区，附近周围绝对是水泄不通，停车位也不好找，收费的没位置，免费的也很少很少，只有地铁还算靠谱，那也是人挤人的节奏啊！
58807265,15705469,3,0,0,0,01-29,地方比较远在顺义的某个地方，好在有地铁能直达，还是挺方便的~当时是个图书展，场馆地方超级大~貌似车展也是在这里~
58807265,18377844,4,4,4,4,15-10-26,今年的8月20-22日新国展这边办了中式生活艺术展览会，免费参观，那个时间正好就在附近，和长辈们一起去的，场馆很大，但是停车场正对着的场馆门没有开，必须步行绕到正门，8月的太阳好毒啊，晒死了，幸亏展览不错，总算没白跑，展厅不错，展出各种中式艺术品，精美的紫檀雕刻，玉雕，瓷器，书画等等，很多精湛技术就在展区当场演示，最前方还有表演，有陈氏太极传人的太极拳，还有很可爱的孩子们表演的皮影戏，很快时间就过去了几个小时，中心里有免费的水，好像也有吃饭的地方。
58807265,26418142,4,0,0,0,15-10-25,房车展示，这是一个旅行漂泊的“家”
58807265,2102819,5,4,4,4,15-09-02,每年至少去两次，每次去都累个半死，如果公事，脑子累死。如果个人兴趣，腿就累残。地铁坐着都嫌累，时间太长了。真是不明白，好端端的，为什么离着市区那么远？！如果从飞机场出来倒是距离不远。
58807265,4313860,4,4,3,3,15-08-31,来这里参加北京书展～地方够大，就是太远了！好在15号线国展站下车就到，不用走太久～北京书展搬过来有几年了，亲自来参展这是第二次～这次还有北京国际图书节一起举办，可是工作太忙，没时间去挑选喜欢的书籍…新国展里面很宽敞，展厅宽大明亮，逛起来还是挺舒服的～午饭得吐槽一下，可能是位置太偏远，这里吃饭的几家餐厅都比外面贵很多，拿麦当劳来说，外面20的套餐，这里都要四五十！所以来参展的盆友如果不想在里面被宰，可以带些好吃的～
58807265,2606159,2,1,1,1,15-07-11,因为是在10月底来北京参加国际安防展的，此时的北京已经温度比较低了，而且在国展这里比较偏，风也比较大。北京国展的服务态度真的不好，和深圳国展服务态度比起来真的是天壤之别，下次估计不会来了。
58807265,5578648,3,4,4,3,15-06-23,新国展虽然有点儿远，但是有地铁还是挺方便。
58807265,17842882,5,3,3,4,15-06-14,非常开心参加了这届改装车展。这是第二次来到新国展，第一次是12年的时候北京国际车展。位置好找，停车位充足。地铁的话新国展站下来就到了。
58807265,20646829,5,0,0,0,15-05-13,前几天在这里开展会，真的很大，n1-3w1-12
58807265,430631,5,0,0,0,15-04-28,展馆很大，人也很多。小卖部太少了。
58807265,6934170,4,0,0,0,15-04-25,来逛机床展，占地面积挺大的。逛了两天都没有逛完。。展馆里面有好多小的快餐店，还有赛百味，肯德基，麦当劳，costacoffee等连锁品牌。。另外还发现了俏江南快餐==！虽然前阵子知道俏江南开始卖快餐了，可还是觉得这是逗我呢吧。。
58807265,36816464,5,0,0,0,15-01-29,新国展，很大，展馆很多，比老国展规模宏大很多，位置在顺义天竺，近几年交通越来越方便。地铁15号线新国展有一站。
58807265,57777776,2,0,0,0,14-12-05,要不是看展会，看美眉，谁会没事来这么远的地方，好偏咯
58807265,4092914,4,0,0,0,14-07-18,每次下班必经的地方啊，一到展会就人山人海的，造成拥堵，连带周边的宾馆也都爆棚、涨价
58807265,36246416,3,0,0,0,14-07-14,新建的展馆，在顺义。开车的话还是很方便的。现在通地铁了，也不错。周围i的设施和人气就在短短几年间慢慢起来了，有很好的配套服务和便利设施。只是管理方便还是那帮人，服务能力、水平都很差，关键是，他们根本就没有服务意识，当大爷当惯了。展馆空间非常大，中间需要休息几次，才能基本上逛完，如果遇到车展之类的大展览，人山人海的，非常拥挤。
58807265,31995020,4,0,0,0,14-07-02,来新国际展览中心，
58807265,7027686,3,0,0,0,14-06-18,4月底来这儿看车展，国展竟然在这么郊区的一个地方。星期一来的，人也非常多，不知道究竟有多少人是真正来看车的，感觉人群围观的都是豪车和车模或者展台表演，再或者排队领小礼品。暴走半天，腿都快断了，下次绝不主动来凑这热闹。
58807265,7898988,2,0,0,0,14-06-10,曾经来这里看过车展 同liushuo一起 哪年看的不记得了 人山人海啊
58807265,53726,3,0,0,0,14-06-07,建成后第一次来，是看2014国际车展。公众日去的，怕堵车没敢开选择了公交（事实证明选择是对的，太堵了），虽有轨道交通直达，但从地铁芍药居站开始就已经人头攒动，寸步难行了，一路拥挤不堪，让人没去就直接萌生了退意。展馆虽好，但交通问题还真是令人头痛啊！！！
58807265,2057904,1,0,0,0,14-05-28,我们办展会在这边，W3馆，我觉得这些可能有一些地痞流氓之类的，比如保安。
58807265,2223997,4,0,0,0,14-05-04,坐地铁去的，出地铁站就是了，去看的车站，人山人海，展馆多，就是垃圾桶太少了，想扔个垃圾很困难的
58807265,29231609,4,0,0,0,14-04-29,车展人好多啊，车展人好多。玩得很开心，在这嘚瑟了一顿，然后，就没有然后了。
58807265,8929996,3,0,0,0,14-04-28,由于参观2014年的北京国际车展，第一次造访新的国展。实话实说这这完全看不出是近年修建的展览设施，无论从建筑还是服务，都完全是上个世纪的水准。新国展侧面有一个欧陆广场，不知是何原因，故意将临近的大门关闭。如果观众需要去欧陆广场就餐，需要至少步行两公里。
58807265,3042430,2,0,0,0,14-04-28,周末人太多了，可是平时又没时间，通道中都是人，尤其是名车的展位旁边~我们没有心思拍照，只好在人群中挤来挤去~这么大的展馆，不是很通风，人多空气不好，真心不建议上了年纪的、带孩子的来，看到他们几乎坐在那里累的都睡着了，何苦呢~
58807265,57446924,3,0,0,0,14-04-28,2014年4月28日两人去的，展厅不错，车不错，就是E4、E5馆人实在是太多了，在长安汽车的展台订购了1辆CS751.8T精英型，裸车价13.68万（京五），全下来45.5左右，觉得车挺满意，就是什么优惠也没有很遗憾。
58807265,7447714,5,0,0,0,14-04-24  更新于04-27 20:33,参加2014年北京国际汽车展览会，自从有了位于北京城边天竺的新国展，象国际汽车展览会这样的大型盛事的举办就不再成为问题，15号线地铁直通，让更多的人可以更加便利、快捷、环保到达
58807265,9575215,4,0,0,0,14-04-27,地方挺宽敞，环境不错，配套设施也都很完善，各种名车，高端大气上档次~模特一个比一个漂亮~就是人实在是太多了，看个车展累个半死。
58807265,6776519,4,0,0,0,14-04-26,累吐血了看个车展，人太多太多了，等我们出来坐地铁排队进站排了四十分钟！里面名车名模遍地都是，国产车也投入高成本。基本每个展台都会送点儿小玩意儿，领的人居多！
58807265,2769463,4,0,0,0,14-04-25,坐地铁是很方便，但是赶上车展，人真的很多，想上地铁都是个问题。自己开车去的话，堵车是必然的，而且车展时期，停车场离现场非常远，必须坐摆渡车。展馆很大，今年开放了9个展厅，逛一遍下来很累，不过很过瘾！
58807265,2199073,5,0,0,0,14-04-24,地铁过去很方便，下了地铁就到了，2014车展不错，车不错，车模也不错，各种不错，赞
58807265,6220173,3,0,0,0,14-04-23,有了地铁挺方便哒下车顺着人流不远就到了～感觉展厅又大又糙，吃饭的地方少。买个subway感觉不新鲜也变小了
58807265,21852155,3,0,0,0,14-04-05,真是偏僻啊，就在机场不远。到了这么偏远的地方，邀约参展的客户吃也没地方吃，住也没地方住，玩也没地方玩，要不就参展员工每天早早起床地铁通达。总之就是折腾。离机场这么近的地方，居然打车要80块钱，问保安有没有靠谱点的的士，一付爱莫能助的样子。好歹也是首都，要不要这么嚣张啊！哪像广州琶洲展馆那么方便。
58807265,25655,3,0,0,0,14-03-21,来这边参加展会，除了地铁或者开车以外，交通真是不方便。展馆内吃喝都比较少，仅有的几家价格也超贵。外面要走好远才有商场。
58807265,1485260,5,0,0,0,13-12-30,今年的母婴展就是在这儿举办的，三天连着都去了，太爽了简直，各种买，各种逛
58807265,42950370,4,0,0,0,13-10-27,看的2012年车展，交通太不方便了，地铁15号线快坐穿了才到，车展人也很多，不错车模还是很漂亮的。
58807265,11519166,5,0,0,0,13-10-13,很多馆   都很气派   很多车模 都很漂亮   知性美    人山人海的…… 看到很多男士拿着大单反   拍车模的太多了  有美女在的地方总是吸引无数男士的眼球   车模中也有外国的   总是来看看  多了解不同的车型 也很开眼界
58807265,947749,4,0,0,0,13-10-09,此展馆真是超大的，参展期间，每天基本要花半小时排队等入场，哎~~~
58807265,1693482,4,0,0,0,13-09-22,环境不错，真心远啊！去看书展，去的当天，北京难得空气质量为良，所以更平添了几分好感，吼吼~~
58807265,1223856,3,0,0,0,13-09-11,这里是新馆，一定要注意与旧馆相区别，搞错可就麻烦了……感觉硬件设施已显陈旧，周边配套也不是很齐全，除了有家购物中心外，其它就剩路边等活儿的黑出租了。虽然有地铁经过，但要从高铁停靠的北京南站来此，需要分别乘坐4、2、13和15号线共4趟地铁才能到达，全程要将近2个小时，都够从北京到天津往返2次了，如此看来，你说这的交通是方便呢？还是不便呢？
58807265,8495224,3,0,0,0,13-09-07,冲着那个该死的门真想给差评，地铁和可以进馆的门一东一西，想进馆就得绕那么大圈！还不派人在外面搞个说明！真心次。。是和门口的票贩子....么（瞎得瑟）...管内东西贵。门口有KFC、吉野家，就是走出去很费事
58807265,1003240,2,0,0,0,13-08-31,交通不便利，配到服务设施不到位，馆内东西价格高，东西次。如期是饮食。小偷很多。基础设施还是可以。
58807265,8858675,4,0,0,0,13-08-10,还行吧，大就一个字。再描述就是傻大傻大的。。。。。
58807265,25083304,5,0,0,0,13-07-31,新展馆比老展馆大多了，也气派多了，每两年举办的车展是最著名的了，离市区比较远，不过有地铁很方便
