23216161,4792007,4,0,0,0,10-11-20,同事给的票，提前约好伙伴今天来参观这里，为这事我还推掉了免费试吃的活动（好可惜呀！希望以后还有机会），展厅很大，周六去人不少，用人山人海来形容一点也不过分。在此说明一下：有通票的，要去售票处把票换成卡，才能进入博览会。让我印象深刻的是动漫游戏展区，那里有一处提供免费的人物画像，你坐在椅子上等上5分钟，就会得到自己的自画像，画像传神，但排队的人很多，要排上很长时间。画像区旁边是录音区，也很有意思，在录音棚里会有专人给你制作自己的唱片，可以亲身体验当歌星录音的感觉，戴上耳麦的感觉真不错！每个展厅都各有特色，在这里我就不一一介绍了，大家去了就知道了，嘻嘻！
23216161,2881494,5,0,0,0,10-11-04,单位在这开过展会，自己来这免费参观过展会，很大，展览馆基本都大同小异吧，这里现在的展会比前几年少了很多，但是一到开展会这边交通就堵的要命到处都是大汽车还是N长的那种
23216161,6396101,4,0,0,0,10-09-04,我是去参观国际机床展的，我们三个人去，填个调查表就可以免费领票，我同学的名字都打错了，就我的对了，所以我还留着那张门票。
23216161,5352718,4,0,0,0,10-09-02,就在姥姥家边上、挺大的展览的地方~
23216161,6166665,4,0,0,0,10-09-02,这两天国展有图博会，去看了，真是很大，出版社也很多，书更是巨量
23216161,2922724,3,0,0,0,10-08-27,国展好久不去，最近去的就是礼品展了，呵呵，相信很多亲也去了，主要是为了维络城的礼物，不过好耗人呀，要分三天去~~~
23216161,4399571,3,0,0,0,10-08-22,上周去这里参加了礼品展
23216161,3378379,4,0,0,0,10-08-18,这里可是个关键的地标
23216161,4860619,4,0,0,0,10-08-17,这里来的最多的就是为了参加招聘会，
23216161,5120911,3,0,0,0,10-08-14,去过这里的招聘会，没有找到工作，人很多，还有借机赚钱的，也去过这里的展览，就是填个名片就可以的，一般吧，收废纸的倒是不少，每年也成就了不少人估计
23216161,3114356,3,0,0,0,10-06-26,昨天国展旅游博览会单位有展台，进去要带记者证或参观证。里面有各地各国的试吃，鸡尾酒和小礼物，和同事边吃边玩太开心了。最喜欢的当数国际展区。
23216161,1811527,3,0,0,0,10-05-09,来过几次，招聘会啊，传媒展什么的。有些展览是免费的，观众登陆一下就可以了。真的没法跟新国展比，太不专业太小了。唯一的优点就是在市区里，周围有家乐福啊，KFC啊等等可以消费一下。
23216161,5653085,3,0,0,0,10-04-30,国展每月定期举办招聘会还有各种形式的展览，个人门票要10元，感觉里面环境还行，就是场馆内吃饭不方便。
23216161,2553004,3,0,0,0,10-04-28,每年至少进这里一次吧~~单位春节联欢会总在这里办~~
23216161,4046067,3,0,0,0,10-04-22,老国展了，就在我家边上，几乎每周都有展览，招聘会在招聘月上比较频繁，基本属于2周一次，大小企业都有，有时候有专场招聘，一开招聘会就容易堵车，哎~~旁边就是家乐福，附近吃饭可以往西，到燕丰商场3F，好吃不贵。国展后门也有餐厅。附近有租赁展会桌椅的地方，对面有一个很大的停车场，不过展会期间，车位比较拥挤。
23216161,4289553,5,0,0,0,10-03-25,传统的大小企业招兵买马地，三月末，九月中，一个学生和另一个学生、职员防着经理、经理防着总监，不远万里，心有忐忑，辇来于此，就是图个多挣钱，早买房。
23216161,4601844,4,0,0,0,10-03-21,每次去好像都是看摄影器材展，能逛上多半天
23216161,2596641,3,0,0,0,10-03-17,各种展览会....文博会，科博会，车展...当然最多的还是招聘会。我真象征性的去过一个...结果得到的确是一售楼的面试....当时说实话真挺有压力的...
23216161,5280810,3,0,0,0,10-03-15,每次来这里都是因为招聘会，下车就很看到黑丫丫的人群，跟着走就能到了，路上会有卖票的和卖笔的，感觉来这里就是拿了一些的招聘的报纸，在这里就能感觉求职的激烈，不知道为什么不在各个城区都办招聘会。
23216161,871152,4,0,0,0,10-03-15,"很熟悉的老国展,在这里看过很多的展览了，布置得还比较方便，就是里面卖的饮食比价贵, 看展览最好带点吃的,不然只能吃里面又贵又难吃的盒饭."
23216161,4001063,3,0,0,0,10-03-05,近期去国展总是因为有展览会或者是招聘会，感觉国展的展览或者招聘做得都比较不错，比较有秩序而且安保一类做得都比较好，而且处在东三环附近，位置比较好，不管是坐车还是开车都比较顺利
23216161,4008867,3,0,0,0,10-03-05,虽然新的国展已经建好了。不过这个老国展也没有被抛弃。还在继续使用。
23216161,162499,3,0,0,0,10-02-18,名字看上去叫国际，但是实在只能说是还行，感觉挺旧的，设施也一般。个人感觉不如北京展览馆。那里大部分的展览都是免费的，但是总的来说特别好的展览不多
23216161,283972,2,0,0,0,09-11-29,今天去了老国展，去看那个第四届北京文博会，人叫那个多啊！！！
23216161,4770811,0,0,0,0,09-11-04,"中国国际展览中心,东三环这边，坐车在静安庄下就成了。"
23216161,889468,0,0,0,0,09-10-21,来过几次，都是为了参加招聘会，展馆挺大的，但是那个人呦，尽看人了。每次一有招聘会，就连附近都是人满为患，坐车都很挤。现在不怎么去了，感觉不太靠谱～～～
23216161,1081186,0,0,0,0,09-09-25,十几年前就开了，那时这边还很僻静呢。现在成了城里了！又挨着个家乐福，一天到晚人乌泱乌央的。
23216161,1663348,0,0,0,0,09-09-15,印象里来这里几次都是快要毕业那会儿，一次是出国留学咨询，一次是我们专业的招聘专场，最后还是通过家里给找到第一份的工作，唉。
23216161,587959,0,0,0,0,09-09-15,这里太堵了
23216161,1732138,0,0,0,0,09-08-19,这个地方办展览有个得天独厚的优势，那就是地理位置非常好，不过停车也很麻烦。我觉得办招聘会最合适了，学生们坐三环环线的公共汽车，容易找啊。
23216161,1339582,0,0,0,0,09-08-19,以前找工作时进去过 感觉里面设施有点老 现在住在旁边 每天经过 倒没在进去过 经常有展会 后门就排满了车
23216161,2452834,0,0,0,0,08-10-21,国际展览中心，我上学的时候给一个公司打工，就在展览中心里面～～感觉还真不错
23216161,2670346,0,0,0,0,08-10-21,有一些人才交流会，这时候人会疯狂的多。有展会的时候人反而少，大部分展会都是免门票费的。以前这里有车展时状况非常好，可惜新国展把车展带走了，呵呵。
23216161,1643540,0,0,0,0,08-10-21,其实这里就在我家附近
23216161,1454938,0,0,0,0,08-10-20,原来肯定点评过这里
23216161,252313,0,0,0,0,08-09-03,家门口的国展，一定得评价一下。这地方怎么说呢，车展我在这儿看过好几次，招聘会也参加过好多回，家门口有个这样的地方真是方便。不过，国展一有展会，附近的交通就烂到不行，堵得稀里哗啦，也是让人很郁闷的一个地方！
23216161,1653544,0,0,0,0,08-08-19,国展离家很近，只要有机会就可以去看展览。
